article_time,article_title,article_link,article_content
Updated: 07 Aug 2021,Companies selling in-home consumption products perform well on 2-year basis,https://www.livemint.com/industry/retail/companies-selling-in-home-consumption-products-perform-well-on-2-year-basis-11628329836590.html,"NEW DELHI: Packaged consumer goods companies selling products suited for in-home consumption benefited in the post-pandemic world, reporting better revenue growth over a two-year period, according to a report by Edelweiss Securities. “On a two-year basis, companies with more in-home consumption portfolio, hygiene and personal care did well as they received a push during the pandemic, followed by second wave impact. On the other hand, discretionary portfolios and summer consumption have been negatively impacted,"" the brokerage said in a report on the consumer staples sector This is especially true for packaged food companies as consumers bought more biscuits, edible oils, snacks, and frozen foods for in-home consumption. Britannia Industries, Tata Consumer and ITC’s FMCG segment, which has a strong in-home consumption portfolio, evinced good response, boosting volumes and therefore revenues. GCPL also saw a similar effect due to its household insecticide, personal care and hygiene portfolios, it said. Revenue growth was also aided by price hikes taken by several large companies over the last two quarter as commodity pressures remained high. Companies selling soaps, packaged tea, edible oil, snacks etc took prices hikes in March and June quarters. “Revenue and volume growth over two years were shaped mostly by portfolio mix, and relevant and activations riding evolving consumer trends. Revenue growth has benefited from pricing action as most companies took some pricing action to combat inflation,"" the brokerage added. Meanwhile, discretionary goods such as personal care products are yet to fully recover. For instance, ITC’s cigarettes volumes fell 18% on a two-year basis. Bajaj also performed poorly due to discretionary nature of its portfolio. Several companies diversified their portfolio, launching surface cleaners and disinfectants as demand for such products surged. “Companies which were quick to launch products and activations based on consumer trends like rising concern for health, safety and immunity driven by pandemic saw increased revenue traction,"" the report added."
Updated: 03 Aug 2021,"Britannia invests ₹130 cr in capacity building, to hike prices",https://www.livemint.com/companies/news/britannia-invests-130-cr-in-capacity-building-to-hike-prices-11628003706121.html,"KOLKATA : Food major Britannia Industries on Tuesday said it will gradually undertake price hike of its products to offset a sharp rise in cost, amid uncertainty arising out of the COVID-19 pandemic. The company, which is being cautiously optimistic, has infused ₹130 crore in capacity building in the current fiscal, an official said.It is also eyeing at a greater revenue share from e-commerce which currently contributes two per cent. “The commodity inflation was sharp during the (first) quarter (of the current fiscal). We are taking price calls in a calibrated and gradual way to offset the cost pressure,"" Britannia managing director Varun Berry told PTI. The company, in the recent past, had taken price calls in value products but the constant cost pressures were not enough to match the impact which is estimated at 5-6 per cent. The biscuit maker had posted a 29 per cent decline in consolidated net profit to ₹389 crore for the quarter ended June 30 over the corresponding period last year. According to company officials, it is not easy to increase the prices of the products during difficult times, and the same has been done in a calibrated approach.Amid disruptions due to COVID-19, it stays optimistic with a steady unlocking process that would result in greater traction in consumption, they said. The company is focusing on new product launches, they said, adding that it has introduced ""fusion snacking"" and expanded Britannia 50-50 basket. It unveiled the first-ever potato-based biscuits under the brand, ""5050 Potazos"".The product was unveiled in Assam and other North-East markets and will be rolled out in rest of the country in the coming months, the officials said.The COVID-induced lockdown had disrupted product launches as trials were delayed, they said.To meet demand, Britannia continues to invest in capacity building in various product lines, including dairy. “We have invested ₹130 crore in the capacity building during the quarter. The company was expanding the Khurda plant in Odhisa, and Tamil Nadu facility. A greenfield unit is also coming up in Uttar Pradesh and land has already been acquired,"" Berry said. The new Ranjangaon plant in Maharashtra will add new products lines, including dairy.In the Khurda plant, about ₹94 crore was invested to ramp up capacity in multiple categories.The greenfield facility in Uttar Pradesh will entail an investment of about ₹300 crore, the official said.Berry said e-commerce sales gained momentum and reached two per cent of the revenue from about 0.4-0.5 per cent earlier, but he thinks the contribution should rise to five per cent. Britannia will work more closely with partners having expertise in this trade, the official added.  "
Updated: 02 Aug 2021,"Margin unexciting, but revenue brings cheer for Britannia in Q1",https://www.livemint.com/market/mark-to-market/britannia-industries-margins-take-a-knock-in-q1-as-cost-pressures-bite-11627887071376.html,"Britannia Industries Ltd’s shares closed more than 2% higher on Monday on the National Stock Exchange. One reason for this optimism is that the June quarter (Q1FY22) results were decent on the revenue front despite last year’s strong base. This is at a time when inflationary pressures gave grief, hurting margins. Consolidated gross profit margins in Q1 dropped by 296 basis points (bps) year-on-year to 38.7%. One basis point is 0.01%. Gross margin is down sequentially, too, decreasing by 178bps. The company continued to see an increase in the prices of palm oil and crude oil. “In view of the pandemic and the hardship to consumers, we were cautious with our price increases and aggressive on cost efficiencies,"" said Britannia in its earnings presentation. To cope with the cost pressures, it will take judicious price increases ahead, and continue to drive cost efficiencies. As such, Britannia was able to marginally increase its Ebitda margin vis-à-vis Q4FY21, although the measure was down almost 470bps compared to Q1FY21 to 16.3%. Ebitda is earnings before interest, taxes, depreciation and amortization. Meanwhile, revenues declined by 1% year-on-year to ₹3,352 crore on a strong base given that Q1FY21 revenue growth was 26.4%. The company has exceeded analysts’ revenue estimates even as the tailwinds from the covid-19 pandemic were not expected to be as high this time around. Last year, Britannia reaped the benefits of a sharp rise in consumption at home as consumers spent more time indoors during the first lockdown. On a two-year compound annual growth rate (CAGR) basis, Britannia’s revenue growth for Q1FY22 stands at around 12%, which is nothing to sneeze at. Even so, the Britannia stock has massively underperformed the broader markets in the past one year. To that extent, valuations are inexpensive. The shares now trade at about 40 times estimated earnings for financial year 2023, based on Bloomberg data. Unfortunately, triggers for the stock to outperform appear limited. Going ahead, investors would closely follow Britannia’s strategy on price hikes to offset cost pressures. “We believe success of (at least few) new segments—Salty Snacks, Wafers, Croissants and ramp-up of adjacent categories—Dairy, Rusks, Cakes and now Milk Bikis in biscuits are imperative for re-rating,"" said analysts from ICICI Securities Ltd in a report on 1 August. The broker further added, “While lower ad spends in FY21 have driven higher profit growth versus revenue growth, FY22 is likely to be a low-profit-growth year."" Of course, a better-than-expected revenue performance would help improve sentiments."
Updated: 31 Jul 2021,Britannia Q1 profit down 28.6%,https://www.livemint.com/companies/company-results/britannia-q1-profit-down-286-11627707777275.html,"New Delhi: Britannia Industries Ltd. (BIL) on Friday reported a 28.6% drop in June quarter profit to ₹387.01 crore, missing Street estimates. The company had reported a net profit of ₹542.68 crore in the year-ago period. Consolidated revenue from operations for the three months ended 30 June stood at ₹3,403.46 crore, down marginally from the ₹3,420.67 crore it reported in the year-ago period. Estimates by 21 analysts had pegged Britannia’s consolidated revenue at ₹3171.10 crore, while projecting quarterly consolidated profit of ₹412.10 crore. The company continued to witness higher commodity prices, especially palm oil and crude. Other expenses grew 9.27% during the quarter. “On the cost front, we continued to witness increase in the prices of palm oil and crude. In light of hardship to the consumers owing to the pandemic, we were cautious on pricing but aggressive on cost efficiencies, which helped us improve our operating profit from 14.9% in Q4FY20-21 to 15.1% in Q1F21-22,"" Varun Berry, managing director, Britannia Industries Ltd., said. In the June quarter of the last fiscal, Britannia posted a 26% jump in sales as it benefitted significantly from increased in-home consumption. Indian households bought more biscuits during India’s protracted lockdown a year ago. The second wave of covid-19 that struck the country hard was followed by lockdowns imposed by various state governments. While companies saw limited supply-side disruptions, demand normalized with consumers going easy on pantry-stocking. “We witnessed evolving nature of the pandemic as well as consumer sentiment and behaviour. In these uncertain times, we delivered a healthy consolidated 24-month sales growth of 25% and net profit growth of 55%,"" he said. The company warned of “calibrated"" price increases in the future. ""Britannia will continue to create and sustain an ecosystem of financial and operating efficiencies through rigorous process improvements which would act as a strong pillar for sustainable growth,"" Berry said. During the quarter the company relaunched Goodday Chocochips with a campaign and launched 50-50 Potazos in the northeast. Britannia’s brands were back on air and its full range of products retailed in market as the supply chain impact was less severe."
Updated: 30 Jul 2021,"Markets likely to be under pressure; Sun Pharma, IOC, Britannia in focus",https://www.livemint.com/market/stock-market-news/markets-likely-to-be-under-pressure-sun-pharma-ioc-britannia-in-focus-11627613211585.html,"MUMBAI: Indian markets are likely to be under pressure on Friday while trends in SGX Nifty suggest a weak opening of Indian benchmark indices. On Thursday, the BSE Sensex closed at 52,653.07, up 209.36 points or 0.40%. The Nifty ended at 15,778.45, up 69.05 points or 0.44%. US equity futures slid and Asian stocks dipped Friday as traders weighed signs of a slowdown ahead for megacap technology companies and risks from China’s regulatory crackdown. Treasuries and the dollar rose. Stocks fell in Hong Kong and China as well as Japan. Asia-Pacific stocks had jumped Thursday after Beijing tried to allay fears over regulatory curbs on private industries, but US-listed Chinese equities later resumed declines. S&P 500 futures also fell. The gauge rose overnight on data signaling scope for the Federal Reserve to keep policy ultra-loose. US economic growth was solid while trailing estimates. Jobless claims dropped but were higher than forecast. Among key companies, Sun Pharmaceuticals, Indian Oil Corporation, Britannia Industries, Marico, UPL, Bandhan Bank, PI Industries, JSW Energy, and Shriram Transport Finance Co.y Ltd will release their June quarter earnings today. The Maharashtra Food and Drug Authority (FDA) on Thursday said it has issued notices to e-commerce giants Amazon and Flipkart after it allegedly found that pregnancy termination kits and pills are available for sale on these platforms without prescription. IFC, and two investment funds managed by IFC Asset Management Company—IFC Financial Institutions Growth Fund and IFC Emerging Asia Fund—have bought a 4.99% stake in Federal Bank Ltd for ₹916 crore, the lender said on Thursday. The dollar snapped a four-day retreat but is on course for its biggest weekly drop since May. Oil mostly held recent gains on expectations that demand from economic reopening will weather delta-strain Covid-19 flareups. Stocks are rounding out a volatile week amid Beijing’s clampdown on private enterprise, which sparked a sharp selloff in Hong Kong and China and briefly caused widespread risk aversion. But the Fed’s expansive monetary policy continues to underpin broad market sentiment, after chair Jerome Powell signaled the central bank is moving only gradually toward tapering stimulus if the US makes sufficient economic progress. (Bloomberg contributed to the story)"
Updated: 25 Jul 2021,Brands congratulate Olympic winner Mirabai Chanu through digital campaigns,https://www.livemint.com/news/india/brands-congratulate-olympic-winner-mirabai-chanu-through-digital-campaigns-11627205545512.html,"Social media was flooded with congratulatory messages to celebrate athlete Mirabai Chanu who opened India's medal tally at the Tokyo Olympics. Chanu won a silver medal in weightlifting in the 49-kg category for women on 24 July, the first day of the ongoing global sporting event. Brands across categories have also joined the bandwagon to wish the young athlete through digital campaigns across social media platforms such as Facebook, Instagram and Twitter. Dair brand Amul, for instance, released a topical campaign featuring Chanu lifting the weight with a caption that said: ""Worth her wait in silver! Amul, Mira, tera , humara favourite snack."" Amul, which is known for its quirky advertising, is also an official partner of the Indian Olympic Association (IOA). Britannia Industries, on the other hand, used its product as a tool to send out the congratulatory message. Its social media campaign featured a weightlifting equipment made from digestive biscuits with the accompanying caption: ""Mirabai Chanu, worth her weight in 'Gold."" Studds Helmet post showed a fist holding a silver medal with a caption that said, ""Congratulations Mirabai Chanu. We are proud of you."" Meanwhile, beauty and wellness chain VLCC, in its post featuring a picture of Chanu, congratulated the young athlete saying, ""Silver is beautiful. Congratulations on the historic win."" Giving the historic win a quirky twist, delivery platform Dunzo in its social media post took inspiration from a popular Punjabi song and came up with a caption that read, ""Chanu ve ghar aaja ve. Your home is proud, it was worth the weight. #JoyComesHome."" Costa Coffee India, Federal Bank Limited, Bikano and Kochi Metro Rail also joined the club of brands congratulating the young athlete on her win. Ritesh Nath, an independent sports consultant said that the Olympics is an extremely well-regarded sporting event and brands can gain by associating with it in any form. ""These brands might also consider forging a formal partnership with athletes who win at the Olympics and leverage their popularity in form of a possible brand ambassador partnership,"" he added."
Updated: 21 Jun 2021,"Britannia Industries offers relief measures to 10,000 frontline workers",https://www.livemint.com/companies/news/britannia-industries-offers-relief-measures-to-10-000-frontline-workers-11624262494876.html,"New Delhi: Packaged foods company Britannia Industries Limited on Monday announced relief measures to support over 10,000 frontline personnel impacted by the covid-19 pandemic. The company will provide assistance in the form of a term insurance policy and hospitalization insurance of ₹2 lakh and ₹1 lakh respectively, to those affected by covid-19. The beneficiaries include sales personnel and merchandisers employed with its distributors across the country. “The company is also contributing ₹2 lakh each to the bereaved families of the personnel who were not insured earlier,"" it said in a statement. Several fast-moving consumer goods companies said that on-ground sales staff was affected severely during the second wave of the pandemic. In fact, in its April earnings call, the maker of Good Day, Tiger, NutriChoice biscuits said it was advising its sales staff against going to markets. “In times like this, we are actually asking our salespeople not to go to the market. So again, we are going to see a downtrend as far as our distribution is concerned; there will be a lot more sales on telephone and a lot more wholesale trade during this time…This wave just seems to be a very, very vicious wave of covid,"" Varun Berry, managing director, Britannia Industries, said in post-earnings call then. Additionally, the company is offering domiciliary covid treatment worth ₹7,500 for patients who need support at home, apart from reimbursing vaccination costs. “Despite the unprecedented impact of the pandemic, our frontline sales and merchandising personnel have worked tirelessly to ensure uninterrupted supply of our brands across the nation,"" said Vipin Kataria, vice president, sales, Britannia Industries Limited. These measures, said Kataria, will ensure business continuity while minimizing disruption."
Updated: 07 May 2021,Tata Consumer's shares fall 5% post muted Q4; but valuations still pricey,https://www.livemint.com/market/mark-to-market/tata-consumer-s-shares-fall-5-post-muted-q4-but-valuations-still-pricey-11620368469201.html,"MUMBAI : Tata Consumer Products Ltd’s (TCPL's) shares have had investors’ love for some time now. In calendar year 2020, the shares had appreciated as much as 84% on the National Stock Exchange, easily making it one of the best performing consumer stocks in the country. After the sharp re-rating, 2021 has begun on a relatively slow note with the shares gaining around 5% so far. This is after accounting for nearly a 5% drop in early deals on Friday, after the company’s March quarter financial results disappointed the Street. Consolidated earnings before interest, tax, depreciation, and amortization (Ebitda) declined by 2.6% over the same period last year to Rs300 crore vis-à-vis Bloomberg consensus estimates of Rs353 crore. Ebitda margins contracted by 294 basis points year-on-year to 9.9%. One basis point is one-hundredth of a percentage point. True, margins were expected to take a hit considering the extraordinarily sharp spike in tea prices. Even so, margin is lower than expectations. Tata Consumer said, “Consolidated Ebitda growth for the quarter was impacted by tea inflation in India and increased A&P investments, which more than offset the strong Ebitda growth in India food and international business."" A&P refers to advertising and promotion expenses. Even so, JM Financial Institutional Securities Ltd’s analysts point out, there are two aspects in the March quarter report that merit attention and monitoring. One, Sampann portfolio grew just 2% during the quarter. Tata Consumer has said the volatility in the pulses market has impacted growth. According to JM Financial, a business that is all of Rs400 crore in size per year should not have been impacted so badly by such macro events. It is also worth noting that the salt revenues saw robust growth in the March quarter, boosting the company’s India foods segments. Two, the international beverages business was especially weak. “While there is some high-base effect here due to pantry-loading in March quarter last year, the imputed 'normalized' growth rate seems to remind us that these are businesses that would continue to exhibit low-growth characteristics over the medium-term, once low-hanging fruits therein are plucked."" Overall, Tata Consumer’s revenues grew by 26% year-on-year to Rs3,037 crore. Weaker operating profit meant pre-tax and exceptional item earnings grew at a much slower pace of 5.8%. Meanwhile, the sharp appreciation in Tata Consumer’s shares since 2020 has understandably increased its valuations. As things stand, the Tata Consumer shares are higher than peer Britannia Industries Ltd’s. For perspective: Tata Consumer stock trades at 49 times financial year 2022 estimated earnings, based on Bloomberg data. The same parameter for Britannia stands at 45 times. As such, Tata Consumer’s high valuations could well limit upsides hereon."
Updated: 30 Apr 2021,FMCG companies eye virtual orders to shield staff,https://www.livemint.com/industry/retail/companies-face-manpower-challenge-step-up-virtual-orders-11619790553165.html,"New Delhi: Fast-moving consumer goods (FMCG) firms are trying to minimize mobilization of sales staff and not looking to expand their distribution networks in view of the massive spike in coronavirus cases, and are instead opting for virtual orders to keep their frontline workers safe. Britannia Industries, Hindustan Unilever Ltd (HUL), Parle Products and GCPL, among others, said they are keeping a tab on frontline staff. “In times like this, we are actually asking our salespeople not to go to the market. So again, we are going to see a downtrend as far as our distribution is concerned; there will be a lot more sales on telephone and a lot more wholesale trade during this time. I think, it’s unfortunate, because you build your distribution and then something like this happens and you have no choice but to tread on the side of caution as far as your employees are concerned. This wave just seems to be a very, very vicious wave of covid,"" Varun Berry, managing director, Britannia Industries, said in a post-earnings call this week. The second wave has led to a record number of daily infections and climbing death rates. Last year’s pan-India lockdown had disrupted supplies to all companies, including in the procurement of raw material, production and access to the market. Even though the companies are in better control of production and supplies, the infection has taken its toll on sales staff and other frontline workers. “As far as salesmen are concerned, yes we are also concerned because there are pockets where despite our very high standards and protocols, people have got impacted. Our entire focus has been on how we best look after them,"" said Sanjiv Mehta, chairman and managing director, HUL. “One of the steps that we are very clear about is that we will facilitate and, if necessary, pay for the vaccination of not just our employees and their families, but all the people who are in our ecosystem. Which comes to nearly about 300,000 people, including the salesmen. But yes, we also have our fair share of people who have been infected,"" he added. HUL said 90% of eligible employees have been inoculated with the first dose. “Supply is an important element given the localized restrictions. Today, our capacity available is 1.3x where we were pre-covid. We have initiated multiple models to make sure stocks are available downstream and, therefore, closer to the consumers,"" said Srinivas Phatak, HUL’s chief financial officer in a post-earnings call. “We have driven the digital agenda hard. And today, more than 500,000 outlets can order digitally...We have almost added at the rate of 1,000 outlets a day in the last year to create this capacity,"" he said. In an earlier interview, Sunil Kataria, chief executive, India and SAARC, Godrej Consumer Products, said as a precautionary step it had advised its sales teams to work from home. Kataria said over the last year, the company has leveraged technology and built systems to manage different aspects of its sales and engage with partners in the ecosystem, which is helping the company ensure stocks reach markets."
