article_time,article_title,article_link,article_content
Updated: 15 Dec 2020,Mrs Bectors IPO may ride piggyback on Burger King’s stellar listing,https://www.livemint.com/market/mark-to-market/mrs-bectors-food-ipo-despite-burger-king-listing-boost-valuations-may-vary-11608007963545.html,"As Mrs Bectors Food Specialities Ltd’s initial public offering (IPO) opens today, there are two main factors that work in its favour. One, the company operates in the packaged foods segment, which has lately benefited from the increase in stay-at-home consumption during the pandemic. Mrs Bectors operates in the premium and mid-premium range of biscuits and bakery segment in North India. Secondly, the issue comes at a time when the IPO market is performing well. On Monday, Burger King India Ltd saw a spectacular listing gain with the stock more than double from its issue price of ₹60. However, valuations are pricey, says Sachin Bobade, analyst at Dolat Capital Market Pvt. Ltd. The price band of Mrs Bectors issue is ₹286-288 per share. According to Bobade, “At ₹288, Mrs Bectors trades at 54 times FY20 earnings per share, 14% discount to Britannia Industries Ltd.""  Also read: Why Dalit students are facing a fund crunch in India’s educational institutions True, Mrs Bectors performed well in the half year ending September (H1FY21), backed by covid-19 tailwinds, making it an attractive proposition. Revenues increased by 18% year-on-year in H1FY21. Bigger peer, Britannia too saw about 19% year-on-year revenue growth in H1FY21. Mrs Bectors’ Ebitda margin expanded to 16.7% in H1FY21 compared to 12.2% in FY20. Ebitda is earnings before interest, tax, depreciation and amortisation. But the moot question is whether the good run will continue? As the impact of the pandemic wanes, it would be difficult for the company to sustain its robust margins and revenue growth seen in H1FY21. “Considering mere 1% market share in biscuit category and higher dependence on B2B business, we believe that the offer price is expensive,"" says Bobade. Even so, given that the general IPO market scene is bright and demand is strong going by the grey market premium, it is likely that Mrs Bectors shares may see decent listing gains as well. Coming to the financials, revenues in FY20 had declined by nearly 3% year-on-year. On the other hand, Britannia’s revenues had increased by 5%. Arun Kejriwal, founder of Kejriwal Research and Investment Services Pvt. Ltd, “Mrs Bectors’ relatively smaller size in terms of revenues compared to Britannia and Nestle means they are not fully comparable even though all these companies are in the packaged foods."" For perspective: Mrs Bectors revenues for FY20 stood at Rs762 crore and Britannia’s operating revenues were Rs11599 crore. Nestle’s revenues for the year ending December stood at Rs12370 crore. Kejriwal added, “Mrs Bector would have to grow fast and build capacity at a rapid pace to take advantage of the ever-growing market and command higher multiples like bigger peers."" Prabhudas Lilladher Pvt. Ltd’s analysts said in a report on 14 December, “We believe Bread and Institutional Buns business is a silver lining (for Mrs Bector) given strong share and the credibility it provides to the system and processes from being a supplier to McDonald’s, KFC, Burger King and Rebel Foods."" Mrs Bectors’ issue will comprise of a fresh issue of shares to the tune of Rs40.5 crore and an offer for sale for ₹500 crore. Potential listing gains notwithstanding, investors will have to closely watch whether the initial euphoria persists later. Optimism on that isn’t particularly bright."
Updated: 10 Nov 2020,India beverages biz helps Tata Consumer brew a good Sep quarter,https://www.livemint.com/market/mark-to-market/india-beverages-business-helps-tata-consumer-brew-a-good-september-quarter-11605008908471.html,"Tea has been comforting Indians during the pandemic, or so it appears from Tata Consumer Products Ltd’s September-quarter results. The company, which is a beneficiary of the rise in at-home consumption, had seen consolidated revenue growth of 13% year-on-year during the June quarter. Growth has further improved to 18.5% in Q2 on the back of robust performance of domestic beverage segment, revenues from which grew by 32%. The segment saw better realizations driven by higher tea prices and volume (up 11%). On the other hand, revenue growth from Tata Consumer’s international beverage business was slower at 7%. Revenue in the company’s domestic food business grew at 13% in Q2, down from 19% in Q1. To be sure, packaged foods company Britannia Industries Ltd saw a sharp revenue growth deceleration to 11% in the September quarter from 26.4% in the June quarter. In this backdrop, Tata Consumer’s performance appears better. While improved tea realizations helped boost overall revenues, higher tea prices did pose a risk to the company’s profitability for the quarter. After all, average domestic tea prices were up about 65% year-on-year. But the company managed well, restricting its consolidated gross profit margin contraction to about 270 basis points. One basis point is a hundredth of a percentage point. A relatively slower pace of growth in employee costs, advertisement and sales charges, and other expenses boosted earnings before interest, taxes depreciation and amortization (Ebitda) margin, which expanded by 95 basis points to 14.4%. Post the results announcement on Friday evening, Tata Consumer’s shares closed marginally higher on Monday on the NSE. But, recall that the stock has seen a massive rally already. Currently, the shares are around 25% higher than pre-covid highs in February. Analysts from JM Financial Institutional Securities Ltd said, “Strictly speaking, we find the stock overvalued at 45 times one-year forward price-to-earnings ratio, especially since one-third of its revenue are from slow-growth international developed markets and another 10% are non-branded."" In a report on 8 November, the analysts said, “For now, however, the stock price could stay strong given that upgrades were still made to earnings forecasts, which came by on the back of good growth momentum in the overall business and expectations of further margin gains from acquisition synergies."" In the near term, domestic tea inflation remains a headwind. “While we have gained market share in tea and salt, navigating the unprecedented inflation in raw tea prices will be critical,"" said the company. It also remains to be seen whether the double-digit volume growth in the domestic beverage segment last quarter sustains. Nevertheless, valuations suggest investors haven’t woken up to these concerns yet."
Updated: 28 Oct 2020,"As virus changes consumer habits, FMCG firms see e-commerce business booming",https://www.livemint.com/industry/retail/as-virus-changes-consumer-habits-fmcg-firms-see-e-commerce-business-booming-11603844085935.html,"Fast-moving consumer goods (FMCG) companies are seeing a surge in contribution of e-commerce to their overall sales as the pandemic has led more households to buy groceries online. Hindustan Unilever Ltd, the country’s top FMCG company, said the share of online retail to its total sales volume is close to 6%, rising from 3% in 2019. E-commerce sales at Nestle India Ltd surged 97% in the September quarter, comprising 4% of its local business. Packaged foods company Britannia Industries also said that its e-commerce sales have grown very “aggressively"" in the September quarter even as modern trade sales have been slow to catch up. “E-commerce has been a growth accelerator for us. Today, e-commerce has actually doubled from where it was pre-covid. It’s a shade under 6% in terms of our business and the growth rates have also doubled,"" Srinivas Phatak, chief financial officer, Hindustan Unilever, said last week after HUL’s earnings call. The maker of Surf Excel detergent and Dove soaps has been beefing up its e-comme-rce capabilities over the years. India’s FMCG trade is still dominated by millions of traditional mom-and-pop stores, despite the latest surge in online retail. Online sales have a minuscule 3% share, market researcher Nielsen said in a September report. The share is, however, more in metros. Packaged beverage company Parle Agro said it has seen “unprecedented growth in the segment"" as the supply squeeze prompted consumers to place online orders. “A lot of people who resisted adopting e-commerce as a platform to buy from had no choice because of the supply situation, or the number of stores open or even because the fear of going out was so high. So, most people started depending on e-commerce,"" said Nadia Chauhan, joint managing director and chief marketing officer, Parle Agro, which sells Frooti and Appy Fizz beverages. The curbs put in place to contain the spread of coronavirus and consumer worries about venturing into physical stores is fuelling the growth of online retail, with a lot of people ordering goods online for the first time. For FMCG firms, personal care categories helped get new consumers online, according to Nielsen. “It’s a very profitable part of the business and every company is treating this as the most important vertical from a medium-to-long term perspective, because if you can grow your market share here, obviously your pan-India market share will improve as e-commerce grows. Though it is 2-5% for every FMCG company, in the long term it will be in double digits,"" said Abneesh Roy, senior vice-president, research, Edelweiss Securities."
Updated: 21 Oct 2020,"Stocks to Watch: RIL, Vedanta, HUL, Britannia Industries",https://www.livemint.com/market/stock-market-news/stocks-to-watch-ril-vedanta-hul-britannia-industries-11603245072355.html,"NEW DELHI: Here is a list of top 10 stocks that may be in focus on Wednesday: Reliance Industries: Qualcomm and Reliance Jio on Tuesday announced they have aligned efforts to fast-track development and rollout of indigenous 5G network infrastructure and services in India. Jio has indigenously developed a 5G RAN (Radio Access Network) product that has achieved ultra-high throughputs, and it has been tested by a Tier-1 carrier in the US. Vedanta Ltd: Anil Agarwal’s natural resources company Vedanta Ltd may offer an inter-corporate loan to the Singapore-listed Vedanta Resources Ltd (VRL) to help pay off debt, after its bid to delist from the exchanges failed. HUL: On Tuesday said the worst of the fallout from the coronavirus pandemic is over as India’s largest household goods maker reported an 8.7% increase in quarterly profit. The maker of Lifebuoy soaps said rural markets have emerged stronger but warned that urban demand icould take a while to recover. Britannia Industries: Varun Berry, managing director at the company, known for Tiger and Marie Gold biscuits, said rural markets continue to grow faster than urban. Modern trade has suffered and sales are tepid because consumers are wary of returning to stores. E-commerce has been growing very aggressively. Adani Group: Billionaire Gautam Adani is looking to buy a large power transmission project from debt-laden Essel group. The ₹4,000 crore project involves laying about 941 km of transmission lines across Maharashtra, Telangana and Andhra Pradesh, and building a sub-station at Warangal. Motherson Sumi: The automotive parts maker said it has acquired the electrical wiring interconnection systems business of Bombardier Transportation in Mexico. This is expected to strengthen Motherson’s rolling stock component manufacturing business in the railway sector in the American continent. SpiceJet: Budget carrier SpiceJet on Tuesday announced the launch of 62 new flights, including four international services to Muscat from Delhi and Ahmedabad and back, starting Thursday under the air bubble agreement with Oman. Mahindra CIE Automotive: Has reported a net profit of ₹60.7 crore in the September quarter against ₹61.17 crore a year ago. Revenue fell to ₹1,694.3 crore from ₹1,868.5 crore. Bajaj Auto: Life Insurance Corporation of India increased its stake in the company to 6.4% in the September quarter from 4.76% in the June quarter. Shriram Transport Finance: The company on Tuesday said it has raised ₹100 crore by issuing bonds on a private placement basis."
Updated: 20 Oct 2020,Britannia’s profit jumps 23% in Q2 to ₹495 crore,https://www.livemint.com/companies/company-results/britannia-s-profit-jumps-23-in-q2-to-495-crore-11603165085745.html,"Packaged foods company Britannia Industries Ltd on Monday reported 23% net profit growth for the September quarter. Its consolidated revenue from operations grew 12.1% year-on-year to ₹3,419.11 crore during the quarter, as growth in packaged foods normalized from its highs in the first quarter. Consolidated profit grew 23% to ₹495.20 crore from ₹402.73 crore in the year-ago. Total expenses moved up 7.8% to reach ₹2,822.02 crore. During the quarter, Britannia resumed sales of its entire portfolio, spanning biscuits, dairy and bakery items. “We got our full range of products to the market, focused on efficiency in distribution, followed continuous replenishment system of distribution, improved the health of our distributors and inched closer to normalcy in promotions,"" said Varun Berry, MD, Britannia. All adjacent businesses also delivered healthy profitable growth, he added. “Britannia’s Q2FY21 performance was slightly lower than our and Street expectations with revenue growing by 12% as against an expectation of 14%,"" said Kaustubh Pawaskar, assistant vice president, research at Sharekhan."
Updated: 19 Oct 2020,Britannia Industries Q2 net up 23% to ₹495 cr; revenue rises 12%,https://www.livemint.com/companies/news/britannia-industries-q2-net-up-23-to-rs-495-cr-revenue-rises-12-to-rs-3-419-cr-11603114858767.html,"Food company Britannia Industries Ltd on Monday reported a 22.96 per cent increase in consolidated net profit to ₹495.20 crore for the quarter ended September. The company had posted a net profit of ₹402.73 crore in the July-September period a year ago, Britannia Industries said in a BSE filing. Total revenue from operations climbed 12.15 per cent to ₹3,419.11 crore during the quarter under review as against ₹3,048.44 crore in the year-ago period. Total expenses were at ₹2,822.02 crore, up 7.80 per cent from ₹2,617.64 crore earlier. Britannia Industries Managing Director Varun Berry said this quarter the company got its full range of products to the market, focussed on efficiency in distribution, followed continuous replenishment system of distribution and inched closer to normalcy in advertisement and promotions. Besides, all the adjacent businesses delivered a healthy profitable growth, he said. ""On the cost front, we witnessed moderate inflation in the prices of key raw materials and expect the prices to be stable going forward given the positive outlook on monsoon and harvest,"" he said. It sustained a large part of the efficiency gains that the company witnessed in the previous quarter as supply chain efficiencies, reduction in wastages and fixed costs leverage. ""These measures helped us sequentially sustain the shape of our business and record a massive 390 bps increase in operating profit during the quarter vs. last year,"" he said. On the outlook, the company said it is keeping a close watch on macro-economic factors, changes in laws, evolving consumer behaviour and is framing its medium-term strategy. ""We are confident of performing well in these tough times with the agility in our action and passion of the team,"" Berry added. Shares of Britannia Industries Ltd on Monday settled at ₹3,773.80 on BSE, up 0.70 per cent. This story has been published from a wire agency feed without modifications to the text."
Updated: 19 Oct 2020,FMCG Q2 earnings to help gauge demand direction,https://www.livemint.com/companies/company-results/fmcg-q2-earnings-to-help-gauge-demand-direction-11603076219017.html,"India’s top fast-moving consumer goods (FMCG) companies are set to announce their September quarter earnings that will give a peek into which way consumption demand is headed in millions of Indian households after the blow from the coronavirus pandemic. Analysts expect rural growth to march ahead of urban. The easing of the lockdown and resumption of supplies to the market are expected to aid recovery of some personal care products and continue to benefit those that rely on in-home consumption. But demand for more discretionary items could remain weak. Packaged foods company Britannia Industries Ltd is set to announce its earnings this week followed by India’s top FMCG company Hindustan Unilever Ltd that acts as a bellwether for India’s household consumption. “Major trends in Q2FY21 include normalization of in-home food consumption and revival of skin care. Overall, we expect demand sentiments to continue to improve aiding the sector’s revenue growth in H2FY21,"" said analysts at Edelweiss Securities Ltd in a report. For Q2, the brokerage expects FMCG firms it tracks to post a year-on-year average volume growth of 1.3%, compared to a dip of 20.2% in the first quarter. It estimates revenue growth of 4.2% for the quarter, with year-on-year Ebitda growth of 3.8%in Q2FY21 compared to 15.5% and 26.6% year-on-year contraction in Q1FY21. Ebitda, or earnings before interest, taxes, depreciation and amortization, is a measure of profitability. India’s lockdown in late March severely dented FMCG distribution and manufacturing. While demand for health and hygiene products and packaged foods grew heavily, other categories such as personal care and on-the-go foods and beverages suffered. In fact, April and May were the worst for FMCG makers due to restrictions on store openings and many households had stockpiled provisions in March in anticipation of the lockdown. As a result, the April-June quarter witnessed a 17% decline in sales by value as compared with the same quarter of 2019, market researcher Nielsen said. For the full year, it lowered its growth forecast for the sector to between 1% and -1%. However, demand and supply have since improved. Nielsen reported demand for FMCG products neared pre-covid levels in June, but again fell in August. “Following a good Rabi crop yield and sharp increase in government allocation toward MGNREGA , the outlook for rural consumption is getting better due to good monsoons and record high Kharif crop sowing,"" Motilal Oswal said. They project flat sales for FMCG firms in Q2 after two quarters of decline in year-on-year sales and Ebitda. Those projected to benefit include businesses hinged on in-home consumption, along with those that have a significant part of their sales coming from hygiene products, staples and illness prevention (herbal products). On an aggregate level, the brokerage expects a 0.5% growth in quarterly sales."
