article_time,article_title,article_link,article_content
Updated: 18 Apr 2022,What Holcim's likely exit from India means for cement sector's pricing power,https://www.livemint.com/market/mark-to-market/what-holcim-s-likely-exit-from-india-means-for-cement-sector-s-pricing-power-11650268693591.html,"The cement sector is in the headlines, yet again, but this time, it is not for cost inflation pressure issues. Investors in the sector may need to prepare for the announcement of a landmark deal. Media reports said Switzerland-based building materials conglomerate Holderind Investments Ltd (Holcim) is looking to exit India and is exploring a stake sale in Ambuja Cements Ltd. Holcim holds a 63.19% stake in Ambuja and a 4.48% stake in ACC Ltd. It should be noted that Ambuja also holds a 50.05% stake in ACC. Clearly, if and when such a deal goes through, there would be repercussions not on these stocks but for other companies as well. For ACC and Ambuja a change of ownership could be a re-rating event, note analysts. Investors would reckon that both these companies have been losing market share due to capacity constraints. This is at a time when their close competitors Ultratech Cement Ltd and Shree Cement Ltd were expanding their footprints across regions aggressively. During the calendar year 2011-2016, Holcim lost 460 basis points (bps) market share due to weaker capacity addition, according to Axis Securities Ltd. One basis point is 0.01%. During this period, Shree Cement and UltraTech added 220 bps and 630 bps of volume share, respectively, said the Axis report. Perhaps, a whiff of this potential deal has got investors excited. In April so far, the Ambuja stock has sharply outperformed peers ACC, Ultratech and the broader market, likely reflecting market anticipation for the merger & acquisition news, said analysts at Jefferies India. “In the near-term, while both these stocks may remain afloat on deal newsflows, driving outperformance versus other large-cap peers, Ambuja's recent sharp up-move tilts our preference towards ACC,"" added the Jefferies report. But a bigger near-term positive could come in the form of improved ability to raise prices. Analysts at HDFC Securities Ltd note that the delays in the sell-off, owing to its mega-deal size, regulatory approvals, etc. could potentially derail the focus on ACC and Ambuja's planned expansions. ""This would be good news for the industry as a slower pace of capacity addition will reduce the demand-supply imbalance, supporting industry’s pricing power,"" said the domestic brokerage house in a report dated 18 April. That said, since market share loss has been an irritant for shareholders of ACC and Ambuja, the new buyer is expected to go full-throttle on fixing this. ""In the last decade, Holcim India has lost market share and an unlikely leeway under a new promoter. We see an emerging overhang of market disruption and risk of de-rating on leaders – Ultratech Cement and Shree Cement Ltd,"" analysts at Kotak Institutional Equities said in a report on 18 April. According to media reports, Holcim is in early-stage negotiations with the Adani and JSW Group for this deal. Meanwhile, Holcim’s exit from its India cement business should be viewed in the backdrop of its strategy to reduce its carbon footprint by 2025. The company aims to cut its cement business to around 35% of revenue in calendar year 2025 from 55% in 2021. Indonesia, Malaysia, Singapore and Brazil are among the regions where Holcim has already off-loaded its stake in the cement business.    "
Updated: 23 Mar 2022,Cement price outlook muted for East India,https://www.livemint.com/market/mark-to-market/cement-price-outlook-muted-for-east-india-11648057381490.html,"Cement companies are seen exiting the March quarter (Q4FY22) with flat prices, despite Q4 being seasonally strong. In the following quarter, Q1FY23, cement makers are expected to raise prices amid steep cost inflation, showed dealers channel checks by various brokerages. Higher realizations would help the sector prevent the erosion of operating margins. However, the eastern region is unlikely to see a meaningful increase in prices as it suffers from an acute demand-supply imbalance. Oversupply in this market against the backdrop of inadequate cement demand growth would weigh on prices, at least in the near term. If demand fails to absorb the supply, the region’s utilization can be expected to stay low. Of the total slated capacity additions of 27.5 million tonnes in FY23, 13.1 million tonnes is scheduled in east India alone, according to estimates of JM Financial Institutional Securities Ltd.     "
Updated: 04 Mar 2022,Cement stocks under pressure as price hikes offer little solace,https://www.livemint.com/market/mark-to-market/cement-stocks-under-pressure-as-price-hikes-offer-little-solace-11646369777074.html,"There is no light at the end of the tunnel for investors in cement stocks, at least for now. Shares of key cement manufacturers Ultratech Cement Ltd, ACC Ltd, Ambuja Cements Ltd and Shree Cement Ltd have dropped 12-8% in the last five trading sessions. This is despite dealers' channel checks indicating that price hikes have been taken in some regions. On a month-on-month basis, cement prices have risen by 4-5% in southern, western and eastern India, according to Jefferies India Pvt Ltd's report dated 3 March. On the other hand, the northern region saw a month-on-month price decline of 2%. Two crucial factors have not played out as per expectations of the Street. In a double whammy, costs are feared to rise futher and uptick in demand has not been as strong as previously anticipated. It should be noted that cement companies use crude-derived petroleum coke (petcoke) and imported coal as key inputs. Prices of these commodities were already elevated, but the ongoing Russia-Ukraine conflict could add to further upward pressure on supply constraints. ""There has been a substantial increase (up 75%/52%) in South African/Australian coal prices in the last one month (40-50% increase in two weeks),"" domestic brokerage house Motilal Oswal Financial Services Ltd said in a report on 2 March. At present, imported coal prices are significantly higher than their peak in October 2021. For example, the South African coal price stood around $300/tonne versus its peak of $248/tonne. Petcoke prices too have started to rise, added the report. Analysts caution of peak margin pressures for cement companies in the June quarter of FY23. As far as demand growth is concerned, there is no cheer on that front as well. It should be noted that March quarter is seasonally strong for the sector and has historically seen meaningful uptick in construction activities. However, this time around demand so far in the quarter, has remained muted. ""Demand was weak in Feb'22 like Jan'22 - while dealers attribute to increasing costs of construction materials like steel/sand, companies attribute it to a high base,"" said the Jefferies report. Given the unimpresaive demand scenario, analysts at Jefferies see a risk to their estimate of Rs40 per bag increase in cement prices in Q4FY22. Needless to say, for cement companies the risk of earnings downgrades is getting more pronounced. ""Variable costs are expected to remain elevated in H1CY22 and may pose downside risks to our / consensus FY22-24E earnings in the absence of cumulative Rs45-50/bag price increase during H1CY22,"" analysts at ICICI Securities Ltd said in a report on 2 March."
Updated: 02 Mar 2022,Super 15: Stocks benefitting from rising popularity of ESG theme ,https://www.livemint.com/market/mark-to-market/super-15-stock-benefitting-from-rising-popularity-of-esg-theme-11646195130371.html,"In a post-Covid world, conscious investing has gained lot of traction among investors. In fact, in 2021, at a global platform, India made a commitment to reach net carbon zero by 2070. With the environment, social and governance (ESG) theme fast catching-up, analysts at Jefferies India Pvt. Ltd have outlined key considerations for investors and picked stocks from five sectors to bet on this theme. They are as follows: 1) Coal Sector: The fundamental question for India's transition is linked to its coal sector. Ensuring a well-planned and just transition away from coal will be a significant challenge, with both risks and opportunities in the power sector and beyond. With around 8% of state revenue from coal activities, diversification of the economy is needed. Coal India Ltd will be central to the transition. The company has already taken steps to diversify into renewable power, with three gigawatts of planned solar capacity to FY24. Natural gas is also set to play a significant role in displacing coal. GAIL India Ltd operates around 220 mmsmd (million metric standard cubic meter per day) of pipeline capacity and is the largest LNG trader in India. 2) Agriculture accounts for around 20% of India's greenhouse gas emissions and is the main source of non-carbon dioxide related emissions. Opportunities exist for investors through chemical free farming and low-cost solutions which improve irrigation and energy efficiency. UPL Ltd will likely play a central role in decarbonisation efforts. Through various projects, it is driving the adoption of digital solutions and increased penetration of bio-solutions. 3) Road Transport: With auto demand set to grow to 2040, an uptake in electric power-trains is an important area of focus for policy-makers. Tata Motors Ltd leads the local market with nearly 7% market share. Bajaj Auto Ltd, TVS Motor Company Ltd & Hero MotoCorp Ltd are actively expanding their electric vehicles portfolios. 4) Power Utilities: State-run distribution companies will underpin India's energy transition. Their financial fragility however currently inhibits their appetite for investment and transformation of the power grid. NTPC Ltd should be a key beneficiary of new renewable capacity given its access to low cost funding. Power Grid Corporation of India, Larsen & Toubro Ltd, Siemens Ltd and KEI International Ltd could all see tailwinds from increased transmission and distribution spend. 5) Heavy Industry: Heavy industry's share of energy consumption has increased to 42%, making it the largest end user of energy. Incumbents are focused on renewable power with Shree Cement Ltd, The Ramco Cements Ltd and Ultratech Cement Ltd all active in this regard."
Updated: 17 Feb 2022,Why cement stocks are under pressure ahead of Ambuja Cement Q3 results,https://www.livemint.com/market/stock-market-news/why-cement-stocks-are-under-pressure-ahead-of-ambuja-cement-q3-results-11645082954903.html,"Stock market today: Ahead of Ambuja Cement results for Q3FY22, cement stocks are under selloff heat. UltraTech Cement shares are down near 1 per cent, Shree Cement share are down 0.50 per cent, JK Cement share price is quoting 1.50 per cent lower from its yesterday's close, Ramco Cements shares shed around 1 per cent whereas ACC cement shares are down near half a per cent today. According to stock market experts, cement shares are under pressure ahead of Ambuja Cement results as market is expecting weak Q3 numbers from the cement major. They said that market is trying to adjust with the new EPS (earning per share) and P/E ratio of the cement companies comparing with the P/E ratio and EPS of Ambuja Cement in the wake of weak Q3 results. They went on to add that major reason for weak Q3 results from cement major is rising input cost after surge in coal prices. Speaking on why cement prices are under pressure ahead of Ambuja Cement results for October to December 2021 quarter; Avinash Gorakshkar, Head of Research at Profitmart Securities said, ""Cement shares are under selloff heat ahead of Ambuja Cement results announcement as market is expecting weak Q3 numbers from the cement major. Market expects that input cost of the cement companies have gone up in recent quarter after the rise in coal prices. So, input cost of the company would lead to rise in margins of the company, even when they manage to keep their revenue on the higher side."" On how weak Ambuja Cement results can impact other cement companies; Ravi Singhal, Vice Chairman at GCL Securities said, ""In the wake of weak Q3 earning of Ambuja Cement, market is adjusting the EPS and P/E ratio of Ambuja Cement shares. After adjusting Ambuja Cement shares P/E ratio and EPS, these indicators of other cement stocks have gone down and this is the reason for other cement stocks being under pressure ahead of Ambuja Cement results for Q3FY22."" Asked about stocks to buy from the cement segment in this falling cement stocks, Ravi Singhal of GCL said that cement companies are expected to report weak results in upcoming quarter as well because the rising coal prices are expected to fuel its input cost in near term. He advised positional investors to look at metal, banking and real estate stocks instead of cement stocks. Disclaimer: The views and recommendations made above are those of individual analysts or broking companies, and not of Mint."
Updated: 10 Feb 2022,"Once a laggard, ACC is now fast catching-up with peers",https://www.livemint.com/market/mark-to-market/once-a-laggard-acc-is-now-fast-catch-up-with-peers-11644480122958.html,"The December quarter earnings of cement maker ACC Ltd were unexciting. Akin to peers Ultratech Cement Ltd and Shree Cement Ltd, ACC's sales volumes fell, while input cost rose. It should be noted that Ambuja Cements Ltd is yet to announce its December quarter earnings. ACC's sales volume was down 3% year-on-year (y-o-y) to 7.49 million tonne. The company follows a January-December accounting year. Ultratech and Shree Cement saw sales volume decline 3% y-o-y and 8.3% y-o-y in Q3FY22. High variable cost continued to hurt, leading to contraction in ACC's operating margin to 13.1% in 4QCY21 from 14.1% in Q3CY21. Hit by a surge in coal prices, power and fuel cost on a per tonne basis rose 27% year-on-year in Q4CY21. In a positive, however, due to its master supply agreement (MSA) with Ambuja, freight cost and raw material costs declined in Q4CY21 compared to Q4CY20. Understandably, ACC shares were muted on Thursday, trading flat on the National Stock Exchange, in reaction to the company's December quarter performance. Nonetheless, the stock’s performance in the last one year has been impressive. ACC shares have risen 31%, outperforming Ultratech’s 17% returns in the same span. Shree Cement stock price has declined 9% in the last one year. In the last five years, ACC shares have given lower returns than Ambuja, Ultratech and Shree. In the the last three years, ACC shares have risen by 66% compared to 110% surge in Ultratech and 80% jump in Ambuja shares. Analysts say the company’s expansion plans are on track and its cost rationalisation measures are yielding results and driving optimism towards the stock. “ACC’s volume improved during CY17-19 after remaining stagnant over CY11-16, which helped to arrest the market share loss seen during CY09-16. Going forward, we expect ACC to benefit from capacity expansions in Central India. Benefits from cost saving strategies (Project Parvat and MSA with Ambuja Cements) are expected to continue going forward,"" analysts at Motilal Oswal Financial Services Ltd said in a report on 10 February. It should be noted that ACC’s 1.6 million tonnes per annum (mtpa) grinding capacity in Tikaria, Uttar Pradesh and an integrated plant with a clinker and grinding capacity of 2.7mtpa and 1mtpa, respectively in Ametha, Madhya Pradesh are expected to be commissioned by calendar year 2023. Meanwhile, on the valuation front, the ACC stock is trading at a one-year forward (FY23) EV/Ebitda of 9.34 times, showed Bloomberg data. EV is short for enterprise value. Ebitda stands for earnings before interest, tax, depreciation and amortisation. Peers Ultratech and Shree Cement are trading at a higher valuation multiples of 16 times and 18 times, respectively. Analysts say, while the stock price is catching-up, bridging the valuation gap will be a gradual process for ACC."
Updated: 07 Feb 2022,Shree Cement is losing its key edge over peers,https://www.livemint.com/market/mark-to-market/shree-cement-is-losing-its-key-edge-over-peers-11644168633437.html,"Shree Cement Ltd’s December quarter (Q3FY22) earnings were quite disappointing. Cement sales volumes fell by 8.3% year-on-year (y-o-y) to 6.55 million tonnes, impacted by the strike by transporters in markets such as Chhattisgarh. Cost inflation meant standalone earnings before interest, taxes, depreciation, and amortization (Ebitda) per tonne was the lowest in the past few quarters at ₹1,260. Higher sales of traded goods, where the company bought thermal coal globally and sold to its subsidiary in the UAE, also weighed on its costs. So, its total cost per tonne spiked to a multi-quarter high of ₹4,162.    "
Updated: 20 Dec 2021,Shree Cement to set up ₹1500 crore cement plant in AP,https://www.livemint.com/companies/news/shree-cement-to-set-up-rs-1500-crore-cement-plant-in-ap-11640008826189.html,"Shree Cement will set up a ₹1,500 crore cement plant in the Guntur district of Andhra Pradesh, an official statement from the state government has noted. A delegation of officials from Shree Cement on Monday met Andhra Pradesh Chief Minister YS Jagan Mohan Reddy and held discussions for setting up a Greenfield Cement plant in Guntur district. During the meeting with the company officials, the Chief Minister discussed how Andhra Pradesh is the best destination for investments and also the incentives being given to Industries sector in the state, an official release said. Shree Cement has cement manufacturing and allied sectors plants in nine states and it will be setting up its first plant in Andhra Pradesh and the plan is prepared to complete the project in 24 months. On Monday, Shree Cement shares were down over 3% to close at ₹25,341 apiece on NSE. Speaking on the occasion, Shree Cement managing Director H M Bangur said the Chief Minister has been working wholeheartedly to improve the position of the state. Shree Cement, headquartered in Kolkata, is one of the biggest cement makers in Northern India. The company has reported ₹578 crore profit in September quarter as against ₹547 crore in the year-ago period, while revenue from operations came in at ₹3,206 crore in reporting period."
Updated: 01 Dec 2021,"Stocks to Watch: Maruti, Future Retail, Coal India, NTPC",https://www.livemint.com/market/stock-market-news/stocks-to-watch-maruti-future-retail-coal-india-ntpc-11638321831823.html,"Here is the list of the top 10 stocks that are likely to be in focus on Wednesday: Maruti Suzuki: India's largest carmaker Maruti Suzuki has flagged the impact of chip crunch on the vehicle production at two of its manufacturing units in the country. The vehicle production could only be around 80% to 85% of the normal production, owing to supply constraint of electronic components due to the ongoing semiconductor shortage situation. Future Retail: Future Retail Ltd’s lenders are planning to discuss allegations of financial irregularities against the retailer and may initiate a forensic audit of the company’s books, two people aware of the development said. In a 24 November letter to the finance ministry and the Reserve Bank of India, Future Group’s partner Amazon.com Inc. alleged funds diversion in Future Retail, including unfair related-party transactions worth about $1 billion; a sudden spike in Future Retail’s debts; and an inordinate delay in payment to creditors due to discrimination by promoters. NTPC: State-owned power giant NTPC said 250-MW unit-4 of its Nabinagar power plant will begin commercial from the midnight of Wednesday. ""Unit-4 of 250 MW capacity of Nabinagar Thermal Power Project (4X250 MW) of Bhartiya Rail Bijlee Company Limited (a subsidiary company of NTPC Ltd) is declared on commercial operation w.e.f. 00:00 hrs of December 1, 2021,"" according to a BSE filing. With this, the commercial capacity of the NTPC group will become 67,907.5 megawatts (MW), it stated. Coal India: State-run Coal India Ltd (CIL) plans to invest ₹19,650 crore by FY24 to increase coal transportation capacity by 330 million tonnes (mt) by constructing rail links and setting up joint ventures (JVs). The world’s largest coal miner’s rail mobility play comes against the backdrop of a coal shortage that has raised concerns. The situation has however improved with fuel stock sufficient for nine days at 136 coal-run power projects totalling 166.109 giga watt (GW). Shares of Coal India surged in Tuesday's opening deals after the miner in a regulatory filing on Monday said that the board in its meeting held approved payment of interim dividend for FY22 at ₹9 per share of the face value of ₹10 as against ₹7.5 per share announced last year. Rail Vikas Nigam: The company signed MoU with Economic Policy Research Institute of KYRGYZ Republic, Government of Kyrgyzstan, for development of railway corridor projects in Kyrgyz Republic specially to connect from Bishkek to Karakechenskoye. NMDC: State-owned mining company NMDC on Tuesday slashed prices of lump ore by ₹750 a tonne and fines ₹200 per tonne, with immediate effect. In a regulatory filing, the company said it has revised the rates of lump ore or higher grade ore to ₹5,200 a tonne. While the price of lump ore or low-grade ore has been fixed at ₹4,560 per tonne. Yes Bank: The Supreme Court on Tuesday set aside a Noida police directive that barred Yes Bank Ltd from exercising its rights over the shares it owns in Dish TV India Ltd and stayed the ongoing police probe, saying such actions can have “dangerous consequences"". The top court’s order allows Yes Bank, the satellite-TV provider’s largest shareholder with a 25.63% stake, to continue its now over-two month battle for a board reconstitution at Dish TV. Torrent Pharma: Shares of Torrent Pharmaceuticals Ltd have gained more than 10% over the last one week. The renewed investor confidence is led by expectations of a strong growth trajectory in the domestic market, which have prompted analysts at Credit Suisse to upgrade the stock to “outperform"" from “underperform"". The company had reported lower-than-expected performance for September quarter. Axis Bank: Private lender Axis Bank has received approval from both Bombay Stock Exchange (BSE) and Nation Stock Exchange (NSE) to reclassify four insurers from promoter category to public shareholders. ""We wish to inform you that BSE and NSE vide their respective letters dated November 30, 2021 have granted their approval for the reclassification of aforementioned promoters to “Public"" category from “Promoter"" category,"" Axis Bank said in a filing. Zomato: Close on the heels of launching a $1 billion corpus to invest in startups, food delivery company Zomato on Tuesday unveiled Zomato Wings, a platform to help restaurants raise investments. Zomato said it would facilitate fundraising for its partner restaurants by helping them position their story and metrics and connecting them with investors. Zomato itself, though, will not invest in the restaurant brands."
