article_time,article_title,article_link,article_content
Updated: 24 Jun 2022,Top picks: Sharekhan is bullish on these 6 cement stocks for robust gain ahead,https://www.livemint.com/market/stock-market-news/top-picks-sharekhan-is-bullish-on-these-6-cement-stocks-for-robust-gain-ahead-11656089157281.html,"The leading brokerage firm Sharekhan has placed a buy call rating on the shares of Shree Cement for a target price (TP) of ₹26000, Ultratech Cement (TP: ₹7100), Grasim Industries (TP: ₹1740), The Ramco Cement (TP: ₹850), JK Lakshmi Cement (TP: ₹600), and Dalmia Bharat (TP: 1850). These recommendations were made because the brokerage forecasts that, in accordance with the plans disclosed by major cement players, the cement sector would add more than 90 mtpa in capacity between FY2023 and FY2025. The brokerage has said in a note that “Cement industry is expected to add over 90 mtpa in capacities over FY2023- FY2025 as per plans announced by major players. This implies a 5% CAGR in installed capacity, while cement demand is estimated to post a 6-7% CAGR over FY2023-FY2025. With the rise in supply almost equivalent to demand growth, industry capacity utilizations levels would stay almost flat at 67-68% over FY2023- FY2025. Pan-India cement prices have risen each year during FY2015-FY2022 barring a couple of years, while in Q1FY2023, they are up 8% as compared to FY2022 level. Going by historical anecdotes, we believe cement prices to remain on an uptrend despite capacity additions over the next three years. On the cost front, International petcoke prices have corrected by 17% m-o-m and 20% from March 2022 levels in June 2022."" According to Sharekhan “The diesel prices across Metros declined by 5% m-o-m while they were up 3% y-o-y in June 2022. We expect the easing of petcoke/ coal prices during Q1FY2023 and ahead to reflect in operational performance for the industry from H2FY2023 as it exhausts high-cost fuel inventory fully during H1FY2023. We estimate our cement coverage universe to report 11% CAGR in sales volume over FY2022-FY2024 as against industry growth estimated at 6-7% per annum. Higher-than-industry growth is expected to be lead by market share gains by larger companies aided by rise in capacities."" The brokerage has claimed that “We estimate weighted average EBITDA/tonne for our coverage universe to grow at 4% CAGR during FY2022- FY2024 although the same may remain lower than peaks seen in FY2021. The improvement in EBITDA/tone is based on our assumptions of capacity utilizations remaining almost flat due to high capacity additions, part retention of growth in cement prices and easing of energy and freight costs."" By staying positive on the cement sector, Sharekhan has said “Our cement coverage universe has seen 30%-45% correction in stock prices over trailing five months led by Russia-Ukraine crisis, rise in energy costs and large capacity plans announced by leading cement players. The same has led to one year forward EV/EBITDA valuation multiples of almost all cement companies sinking below their historical averages. Notwithstanding, soft earnings performance for the cement pack in H1FY23, the recent correction offers good entry points for long term investors as sustainable infrastructure push over next 3-5 years coupled with easing out of input cost pressure in H2FY23E would drive stock performance over next 12-15 months. We remain construction and stay Positive on the sector. Our preferred picks are UltraTech, Shree Cement, Dalmia Bharat and JK Lakshmi Cement."" Weakness in demand, a decline in cement prices and a rise in key input costs like energy and freight costs are key risks to the industry, said Sharekhan, which investors should take note of. The views and recommendations made above are those of individual analysts or broking companies, and not of Mint.  "
Updated: 20 Jun 2022,Shree Cement’s new capex doesn’t excite,https://www.livemint.com/market/mark-to-market/shree-cement-s-new-capex-doesn-t-excite-11655748076514.html,"Indian cement companies are announcing fresh capital expenditure (capex) plans amid biting cost pressures and subdued demand, with Shree Cement Ltd the latest to join the bandwagon. The company is setting up a clinker and cement plant with a capacity of 1.5 million tonnes per annum (mtpa) and 3 mtpa, respectively, in Guntur, Andhra Pradesh at a total cost of ₹2,500 crore, it said on Saturday. The company aims to commission the plant by December 2024. However, this has not enthused investors much. On Monday, the stock dropped to a 52-week low initially on NSE and closed about 2% higher than the previous close. Even so, several challenges are foreseen in pursuing these plans. Plus, capex in Andhra Pradesh is fraught with risks owing to excess capacity. “This capacity addition would cost Shree Cement ₹8,262 per tonne, much higher than the capex made in the past. Second, this plant is situated in Andhra Pradesh, which is an oversupply region where demand is muted. Thus, utilization levels are low. So this will be RoCE dilutive for Shree Cement,"" said Mangesh Bhadang, analyst at Nirmal Bang Institutional Equities. RoCE is return on capital employed.      "
Updated: 02 Jun 2022,Dividend stocks to watch: These 11 stocks shall turn ex-dividend next week,https://www.livemint.com/market/stock-market-news/dividend-stocks-to-watch-these-11-stocks-shall-turn-ex-dividend-next-week-11654173103142.html,"The following 11 stocks will go ex-dividend next week, implying that these stocks will trade without the price of the upcoming dividend or declared dividend amount for the current financial year on the ex-dividend date or ""ex-date,"" and that shareholders should buy these stocks before the ex-dividend date to receive the declared dividend amount.  The company's Board of Directors approved the payment of an interim dividend of ₹0.50 per equity share (i.e. 5%) of the face value of ₹10/- each for the financial year 2022-23 at a meeting held on May 27, 2022. For the purpose of determining the shareholders' eligibility for an interim dividend, the record date is Tuesday, June 07, 2022, and the stock will trade ex-dividend on June 06, 2022. The stock closed today at ₹331.25 on the upper circuit, up 4.99 per cent from its previous close of ₹315.50.  The board of directors of the company has recommended an interim dividend of ₹4.50 per equity share of Re 1 for the fiscal year 2021-22, according to the corporation. The record date has been scheduled for Tuesday, June 7, 2022, and the stock will go ex-dividend on June 6, 2022. The stock closed today at a market price of ₹534.20, a 1.20 percent drop from its previous close of ₹540.70.  The company has said in BSE exchange filing that the Board of Directors has considered and declared a second interim dividend of ₹105 i.e. 1050% per equity share of ₹10 for the financial year 2021-22. The record date for the purpose of determining the members eligible to receive the 2nd interim dividend is fixed as Tuesday, 7th June 2022. The stock will go ex-dividend on June 6, 2022, and the company's latest trading price was ₹926.00, up 1.92 per cent from its previous closing of ₹908.60.  The company has said in BSE exchange filing that the Board of Directors of Pearl Global Industries Ltd considered and declared an interim dividend of Rs.5/- per equity share of Rs. 10/- each for the financial year 2021-22 at its meeting held on May 25, 2022. The record date for the purpose of this is Friday, June 8, 2022, and the stock will trade ex-dividend on 07-06-2022. The stock closed at a market price of ₹425.00 in Thursday's closing session, down 1.11 per cent from its previous close of ₹429.75.  The company has informed BSE by saying that the Board of Directors at their meeting held on 28th May 2022 has declared an interim dividend of ₹13 per share (130%) per equity share for the financial year 2021-22. The company has fixed 10th June 2022 as the record date for the purpose of the same and the said interim dividend will be paid to the eligible shareholders on or after 20th June 2022. The stock shall trade ex-dividend on 9th June 2022.  The company has said in BSE exchange filing that “The Board has recommended a final dividend of 100% (Re. 1.00 per share) for the year, in addition the Company had declared interim dividend of 125% (Rs. 1.25 per share) paid on 22nd November, 2021. Accordingly, the total dividend is 225% (Rs. 2.25 per share) for the financial year ended 31st March, 2022 as compared to total dividend of 525% (Rs. 5.25 per share) including special dividend of 200% (Rs. 2.00 per share) declared last year. Final dividend, when declared, will be payable on or after Tuesday, 28th June, 2022, to those Members whose names are registered in the Register of Members of the Company as on Thursday, 9th June, 2022 and to the Beneficiary holders as per the beneficiary list as on Thursday, 9th June, 2022 provided by National Securities Depository Limited and Central Depository Services (India) Limited."" On June 8, 2022, the stock shall trade ex-dividend, and it closed today at a market price of ₹413.00, up 2.49 percent from its previous closing of ₹402.95.  The board of directors of Welspun Corp Ltd have recommended a dividend of 100% (i.e. Rs.5/- per share) on 260,949,395 fully paid-up equity shares of Rs.5/- each, i.e. Rs. 1,304,746,975/-, according to a BSE exchange filing. The board also recommended paying a dividend on the 6 percent cumulative redeemable preference shares with a face value of Rs.10/- each fully paid up at the specified rate of 6% per share (i.e. Rs.0.60). The record date has been set for Friday, June 10, 2022, and the stock will trade ex-dividend on June 9, 2022. The stock closed at ₹235.60 today, up 2.37 percent from its previous closing of ₹230.15.  The company has said in BSE exchange filing that “the Board of Directors of the Company at its meeting held on Monday, the 9th May, 2022 has, inter alia, approved and recommended a final dividend of ₹3. 75,- per equity share of Rs. 5/- each (75%) for the financial year ended 31st March, 2022, subject to the approval of shareholders at the 36th Annual General Meeting (AGM). In this regard, pursuant to Regulation 42 of the Securities and Exchange Board of India (Listing Obligations and Disclosure Requirements), Regulations, 2015, the Register of Members of the Company will be closed from Saturday, 11th June, 2022 to Friday 17th June, 2022 (both days inclusive) and the record date for the purpose of determining the eligibility of the equity shareholders for the dividend will be Friday, 10th June, 2022. Further, the dividend, if approved by shareholders will be paid/dispatched to the shareholders within 30 days from the date of approval by the shareholders at the 36th AGM."" The stock will go ex-dividend on June 9, 2022, and it closed at ₹2,378 with a 0.13 percent gain over its previous price of ₹2,374.95.  The company has said in BSE exchange filing that “Pursuant to Regulation 42 of the SEB1(Listing Obligations and Disclosure Requirements) Regulations, 2015 ('Listing Regulations'), the Register of Members and Share Transfer Books of the Company will remain closed from Saturday, 11th June, 2022 to Tuesday, 28th June, 2022 (both days inclusive) for the purpose of Annual General Meeting and Record date is Friday, 10th June, 2022 for the final dividend as recommended by the Board of Directors of the Company, if approved by the shareholders at the 62nd AGM, would be paid to the members as Final Dividend of Rs. 1.00/- (i.e. 50%) and additionally Special Dividend of Rs. 0.40/ - (i.e. 20%), to mark 70 years of Elecon Brand, which aggregates to Rs. 1.40/- (i.e. 70%) per share having face value of Rs. 2/ - per share for the financial year ended on 315t March, 2022."" Elecon Engineering Company's shares closed today at a market price of ₹229.80, up 13.26 percent from their previous closing of ₹202.90. The stock will trade ex-dividend on June 9, 2022.  The company has said in BSE exchange filing that the Board of Directors has “Recommended payment of final dividend of Rs. 15.50 (Rupees fifteen and paise fifty only) per equity share of the face value of Re. 1 (Rupee one) each for the financial year ended 31 st March, 2022, subject to approval of the shareholders at the ensuing 76th Annual General Meeting. The Company has fixed Friday, 10th June, 2022 as the Record Date for determining entitlement of members to final dividend for the financial year ended 31 st March, 2022. The dividend, if approved by the shareholders will be paid on or after Friday, 1st July, 2022."" The stock shall trade ex-dividend on June 9, 2022, and it closed today at ₹2,907.75, up 1.94 percent from its previous closing of ₹2,852.50.  The company has said in BSE exchange filing that “The Board of Directors is now pleased to recommend a Final Dividend of Rs.2.00 (i.e. @20%) per equity share on 14,40,27,778 equity shares of Rs. 10/- each for the year ended 31st March, 2022, aggregating to Rs. 2,880.56 lakhs, payable to those Shareholders whose names appear in the Register of Members as on Record Date. Thus, the aggregate dividend for the year 2021-22 is Rs.3.50 (i.e. @35%) per equity share of Rs. 10/- each with a total payout of Rs.5,036.96 lakhs and pay-out ratio of 91%."" The record date is set for Monday, June 13th, 2022, and the stock will trade ex-dividend on June 10th, 2022. The stock closed at a market price of ₹65.10 today, up 2.04% from its previous closing of ₹63.80."
Updated: 31 May 2022,Another Adani Group stock may get included in Nifty 50 index,https://www.livemint.com/market/stock-market-news/nifty-rejig-adani-enterprises-may-replace-shree-cements-in-nifty-50-index-11653974812632.html,"Edelweiss Alternative & Quantitative Research has carried out a pre-emptive analysis of the Semi-Annual Index (SAIR) September 2022 Rejig for Nifty indices. The index provider will officially announce the list in the second half of August 2022. According to the brokerage's preliminary analysis, Adani Enterprises holds a high chance to dislodge Shree Cements in the upcoming Nifty September review for the Nifty 50 index. The only risk factor is of any sharp contra price move in either of the probable names can lead to a change in conviction.  Adani Enterprises will be the second Adani Group stock, if included, in the Nifty 50 index. Currently, Adani Ports and Special Economic Zone Limited is part of the index. Shree Cements has a higher probability of being excluded from the Nifty index while the next name on radar, as per Edelweiss, would be Hero Motors. The cut-off date is July 29 whereas the announcement is expected to be in the second half of August and rebal date is September 30, 2022. On the other hand, Nifty Next 50 Index could see probable inclusions of Life Insurance Corporation (LICI), Tata Power, Adani Wilmer, IRCTC, Mphasis Ltd. While, probable exclusions in the index could be Lupin Ltd , Jubilant Foodworks, Zydus Lifesciences, Punjab National Bank (PNB), Steel Authority of India (SAIL) and Adani Enterprises. For the Nifty Bank index, Edelweiss said “looks like Status quo. None of the stocks qualify yet, but any significant O/P by Canara Bank or U/P by PNB of 15% till mid of June, which if sustained till July end can lead to changes."" The most important criteria for Nifty 50 Inclusion is that the stock should compulsorily be part of the derivatives segment. For instance, average free float market cap of Avenue Supermarts (DMART), Adani Green Energy and Adani Transmission is significantly higher than most of the existing Nifty 50 constituents, but the stock has not been included in the index for the past few reviews as they are not a part of the F&O segment.  If any of the above mentioned stock gets included in the derivatives segment till the expected announcement date, then it would make it to Nifty 50 index."
Updated: 25 May 2022,"This cement stock hits 52 week low, stock is down over 2% in 5 trading days",https://www.livemint.com/market/stock-market-news/this-cement-stock-hits-52-week-low-stock-is-down-over-2-in-5-trading-days-11653471705648.html,"Shree Cement has an annual cement production capacity of 47.4 million tonnes and a power generation capacity of 752 megawatts. The company's operations span India and the UAE, with four integrated facilities in India, one in the UAE, and nine grinding units, and it is one of India's top three cement firms. Shree Cement's stock reached a 52-week low of ₹21,303.60 in intra-day trading on the BSE on Wednesday at around 1:34 PM (IST). The BSE Sensex was down 237 points at 53,815, while the NSE Nifty 50 fell below the 16,100 barrier in afternoon trade. The stock has been losing over the previous 5 days, falling 2.86 per cent in that time. Concerns over a drop in EBITDA owing to the high rise in power and fuel prices have also weighed on the stock. The stock has dropped 18.71 per cent in the last month, and it has dropped 20.12 per cent in the last six months. So far in 2022, the stock has lost 21.78 per cent YTD, and it has lost 21.19 per cent in the previous year. Shree Cement is now trading below its 5-, 20-, 50-, 100-, and 200-day moving averages. On the 24th of May, the delivery volume of 13.77 k fell by -17.58 per cent compared to the 5-day average delivery volume. Its latest trading price on the BSE was ₹21,292.95 down 1.5 per cent. The stock Shree Cement's last traded price on the NSE was ₹21,300.0, down 1.6 per cent. Shree Cement's share price has dropped 17.1% in the previous 30 days, and the company's current market capitalization is ₹76,826.56 crore. Shree Cement's revenue increased 3.1 per cent YoY and 20 per cent QoQ to INR 43,642 million in Q4FY22, while revenue increased 10.7 per cent YoY to INR 150,096 million in FY22. EBITDA decreased by 26.3 per cent YoY to INR 9,188 million in Q4FY22, however, it increased by 8.7 per cent QoQ. EBITDA margin fell 837 basis points year over year and 219 basis points quarter over quarter to 21.1 per cent. EBITDA fell 9.1% year-on-year to INR 37,079 million in FY22, while EBITDA margins fell 538 basis points to 24.7 per cent. The PAT for Q4FY22 increased 36.4 per cent QoQ to INR 6,572 million, despite a 17.7 per cent fall on a year-over-year basis. PAT margin increased by 181 basis points year over year to 15.1 per cent. PAT increased by 2% YoY to INR 23,319 Mn in FY22, but PAT margins shrank by 132 basis points to 15.5 per cent. The brokerage firm KRChoksey has said that “In Q4FY22, Shree Cement commissioned its 3 mtpa grinding unit at Pune, taking its overall capacity to 46.4 mtpa. The company’s current utilization level stands at ~60% giving ample room for future growth by increasing its utilization level in subsequent quarters. The company is on track to achieve its target of 57 mtpa of capacity in next three years time. During Q4FY22, Shree Cement’s sales volume stood at 8 MT, a growth of 22.1% on QoQ basis. However, on YoY basis it was a modest decline of 2.4%."" “In light of the input cost inflation, we have lowered our EBITDA margin assumption for FY23E/FY24E from 29.6%/30% earlier to 26.3%/27.6%. However, we believe with increase in utilization level, economies of scale will kick in, which will help the company to withstand the margin pressure. Since our last result update, the stock price has corrected by 11.4% in line with overall market correction,"" said the brokerage. We continue to value the stock at 16x its FY24E EV/EBITDA, which yields a target price of INR 25,085 (previous TP of INR 27,978), giving an upside potential of 14.3% from the current market price. Accordingly, we maintain our “ACCUMULATE"" rating due to the correction in stock price, further added the brokerage. The views and recommendations made above are those of individual analysts or broking companies, and not of Mint."
Updated: 24 May 2022,"Capacity expansion of Shree Cement is on track, but near-term outlook is muted",https://www.livemint.com/market/mark-to-market/nearterm-outlook-for-shree-cement-is-muted-11653334235019.html,"The March quarter earnings of Shree Cement Ltd, announced on Saturday, were hardly exciting. Hit by higher-than-expected input costs, standalone Ebitda at ₹910.6 crore in Q4FY22, was much lower than consensus estimate of ₹1,010.7 crore. Ebitda is short for earnings before interest, tax, depreciation and amortization. Muted cement prices in its key market of East India limited its ability to adequately pass on the burden of increased costs, said analysts. Consequently, the decline in operating margin continued. At 22.2%, its standalone operating margins fell to a three-year low in Q4FY22.         "
Updated: 19 May 2022,"The landscape of India’s cement oligopoly, in five charts",https://www.livemint.com/companies/news/the-landscape-of-india-s-cement-oligopoly-in-five-charts-11652871713817.html,"Earlier this week, in a move that has significance for the Indian cement sector, the Adani Group announced its acquisition of Switzerland-based cement major Holcim’s Indian assets. In one shot, the Adani Group will catapult to the second spot in a sector that has historically demonstrated an oligopolistic character, with a handful of companies at the top controlling nearly half the capacity, and more. Here’s how that has played out in the last two decades or so, when the sector has grown faster than the economy and delivered market-beating returns. 1. Capacity control Between them, ACC and Ambuja have 65 million tonnes of annual cement manufacturing capacity. As a combine, this is next only to the 120 million tonnes of UltraTech, from the Aditya Birla Group. This troika has shaped the sector and led consolidation in it. Over 1999 and 2000, the Tata Group sold its stake in ACC to Ambuja. In 2005, Holcim entered Ambuja. In between these two transactions, Grasim (an Aditya Birla company) acquired the cement operations of L&T, which is UltraTech today. That was the initial consolidation in the sector at the top, one that has stuck. The top five cement manufacturers account for about 48% of the industry capacity of about 550 million tonnes and the top 10 about 63%. Their share in production will be higher, as their capacities usually operate at above-industry levels. While the industry has been languishing in the low-60% range, for instance, Ambuja did 86% utilization in calendar 2021 and UltraTech 70% in 2020-21.             "
