article_time,article_title,article_link,article_content
Updated: 01 Nov 2021,The race for ‘most valued listed Indian cement stock’ gets intense,https://www.livemint.com/market/mark-to-market/the-race-for-most-valued-listed-indian-cement-stock-gets-intense-11635750150961.html,"The valuation gap between Shree Cement Ltd and UltraTech Cement Ltd has continued to narrow. With that, the race for India’s most expensive listed Indian cement stock is getting exciting. At a one-year forward EV/Ebitda of around 20 times, Shree Cement has managed to maintain the top spot, at least for now. EV is short for enterprise value. Ebitda is short for earnings before interest, tax, depreciation and amortisation.  UltraTech Cement is trading at a valuation multiple of around 17 times, shows Bloomberg data.  But with September quarter earnings a mixed bag and competitor UltraTech's slew of cost-rationalisation measures, Shree Cement’s tag of most valued listed Indian cement stock is at a greater risk. In the September quarter, Shree Cement’s volumes declined 3.3% year-on-year (y-o-y) to 6.32 million tonne given its higher exposure to eastern India, which is facing a situation of over-supply. On the volume growth front, peers have performed better in the September quarter. Analysts note that Shree Cement’s volumes are lower than industry average, suggesting a marginal reduction in market share for the company. However, a miss on volume was offset by higher blended realisation. Also, a one-time push to operating profit came from that sale of power in the spot market, which contained the decline in Ebitda to 11% y-o-y. Analysts note that Shree Cement maintained a meaningful differential in Ebitda margins over its peers (Ambuja and UltraTech) on back of higher share of cheaper renewable power, indirect tax incentives and logistics advantage.  ""But the gap has contracted significantly over the last one year due to optimisation of realisations and extensive work on rationalisation of freight cost done by the peers. We believe that gap would further narrow down with a multi-fold increase in share of renewable power and further reduction in lead distance coupled with commissioning of new plants,"" analysts at Prabhudas Lilladher Pvt. Ltd said in a report. Apart from its cost leadership, Shree Cement’s net cash position is also among the key factors supporting its premium valuations. But even there, Ultratech is fast catching-up; it is on a debt-reduction spree and continues to strengthen its balance sheet. UltraTech’s net debt increased by 6% sequentially, but declined 47% y-o-y to ₹6,300 crore as of September 2021. Net debt/Ebitda remained stable at 0.5times as of 2QFY22 from 1.3 times in 2QFY21.  ""With strong operational cash flows, we estimate 4-6% free cash flow yield in FY2021-24E despite growth capex and to help Ultratech become net cash positive in FY2022E,"" said analysts at Kotak Institutional Equities. And these factors have started to reflect in their valuations. Analysts at IDBI Capital Pvt Ltd highlight that Shree Cement’s valuation premium to UltraTech is at 45% compared to the highs at 80% and historical average of 40%. Meanwhile, Shree Cement has guided to increase its capacity to 80mtpa from 46.4mtpa by 2030. Mtpa is short for million tonnes per annum. Investors should note that, contrary to its earlier policy of focusing on organic expansion, Shree Cement is actively exploring inorganic opportunities to meet the targeted capacity. On the other hand, in the case of UltraTech, analysts at Kotak point out that the company in the past added leverage for inorganic growth, but given that there is no major cement asset on the block, merger & acquisition is not a likely risk."
Updated: 15 Sep 2021,Shree Cement stock gains 2% as board approves expansion plans,https://www.livemint.com/market/mark-to-market/shree-cement-stock-gains-2-after-board-approves-expansion-plans-11631680045703.html,"Shares of Shree Cement Ltd are in focus on Wednesday after its board approved a slew of expansion plans. The company will increase its clinker capacity by 3.8 million tonne (mt) and cement grinding capacity by 6.5mt. Reacting to this, the stock rose around 2% on the NSE in Wednesday's opening trade. The board also approved a proposal to set up 106megawatt solar capacity at a total capex of Rs4800 crore. This is likely to be commissioned by March 2024. Post this expansion, its domestic grinding capacity would rise from 43.4mt to 53 mt. Investors would reckon that the company aims to achieve 80 mt capacity by FY30 and this expansion is a step towards that. ""Our current forecasts imply a 9% capacity CAGR over FY21-26E and 6.5% thereafter,"" analysts at Emkay Global Financial Services Ltd said in a report on 15 September. CAGR is short for compounded annual growth rate. Furthermore, the company has proposed to set up an integrated cement plant in Rajasthan with clinker and cement capacity of 3.8mt and 3.5mt, respectively. This would be done at a capital expenditure of Rs3500 crore and would be funded through a mix of internal accruals and debt. This plant is expected to be commissioned by March 2024. Shree Cement would also set up a 106 megawatt solar power plant. Analysts say this expansion will help the company enhance the proportion of clean energy usage in total energy consumption, reduce fossil fuel use and help reduce its carbon footprint.  It should be noted that Shree Cement has increased renewable power generation capacity by 10MW year-on-year to 244MW, with the share of green power up by 300 basis points (bps) year-on-year to 48% in FY21. One basis point is one hundredth of a percentage point. ""We build in consolidated volume and Ebitda CAGRs of 12% and 14%, respectively, over FY21-24E,"" added the Emkay report."
Updated: 15 Sep 2021,"Stocks to Watch: RIL, Reliance Infra, Srei Infra, ZEEL, Shree Cement",https://www.livemint.com/market/stock-market-news/stocks-to-watch-ril-reliance-infra-srei-infra-zeel-shree-cement-11631671262427.html,"NEW DELHI: Here are top ten stocks that may be in the news today. Auto stocks: The Union cabinet is likely to consider a production linked incentive (PLI) scheme for specific segments in the automobile sector on Wednesday, a person familiar with the development said. Dish TV: The tussle between Yes Bank and Dish TV board has taken a fresh twist with the proxy advisory firm SES denying support to the resolutions proposed by Yes Bank.  Godawari Power & Ispat: The company announced that its board of directors have approved the proposal of sub-division of shares (stock split) in the ratio of 1:2 to improve the liquidity of the company's share on the stock market and also to facilitate small investors to deal in its shares. Hindustan Aeronautics Ltd: The company and Rolls-Royce (RR) on Tuesday signed an agreement for Make-in-India Adour engine parts to support the latter's international defence customer base. LIC Housing: Life Insurance Corporation of India’s stake in LIC Housing Finance increased to 45.239% from 40.313% from a preferential allotment of 4,54, 00,000 shares. Reliance Infrastructure: The company will receive a sum of ₹7100 cr from the Delhi Metro Rail Corporation Limited (DMRC) which the company will utilise to repay the debt of Reliance Infrastructure and to make the company debt-free, Chairman Anil Ambani said on Tuesday during an Annual General Meeting (AGM) of the company. RIL: The company is in talks with China’s Hualu Engineering and Technology Co. Ltd to make polysilicon, a key ingredient in manufacturing solar panels, two people aware of the matter said. In other news, Jio is getting closer to launching its affordable JioBook laptop as the device was reportedly listed on the Bureau of Indian Standards (BIS) portal for certification.  Shree Cement: The company will invest ₹500 crore in solar power plants with a capacity of upto 106 MWP to meet captive power requirement of cement plants. The cement company will invest ₹3,500 crore in a cement plant in Rajasthan. It also plans to invest ₹750 crore on a clinker unit in Purulia, West Bengal. Srei Infra: Struggling to retain its staff, Srei Infrastructure Finance has suffered yet another blow as its chief executive Rakesh Kumar Bhutoria resigned even as the company is going through the debt resolution process with the lenders, sources said on Tuesday. ZEEL: Leading media firm Zee Entertainment Enterprise Ltd (ZEEL) is embarking on a new path under 'ZEE 4.0', through which it aims to enhance profitability and continue to grow ahead of the industry, its managing director Punit Goenka said.  Meanwhile, Ace investor Rakesh Jhunjhunwala through investment arm Rare Enterprises has picked up nearly 50 lakh shares in ZEEL for ₹110.22 crore in a block deal. Bofa Securities Europe SA also bought 48.65 lakh shares for ₹115 crore.    "
Updated: 11 Aug 2021,Shree Cement tanks on poor operating performance in the June quarter,https://www.livemint.com/companies/news/shree-cement-tanks-on-poor-operating-performance-in-the-june-quarter-11628657619223.html,"Shares of Shree Cement fell over 4% on the BSE yesterday, a day after the company reported its June quarter earnings. The cement major posted a net profit of ₹6.6 bn in the June quarter, a rise of 78.5% from ₹3.7 bn in the year-ago quarter. However, the net profit was 13.8% lower than ₹7.7 bn in the quarter ended March 2021. Its quarterly profit fell as power and fuel costs rose. Still, the earnings beat estimates. Company's performance on operational front Shree Cement's revenue increased 47.9% to ₹34.5 bn from ₹23.3 bn, year on year (YoY), but declined on a sequential basis from ₹39.6 bn. EBITDA stood at ₹11.5 bn in June 2021 up 39.7% from ₹8.3 bn in the same quarter a year ago. Market experts believe that even though the company's results were mostly in line with estimates, the street had expected a beat after its peers like UltraTech Cement, Ambuja Cement, and ACC delivered a 10% to 15% beat on earnings before interest, tax, depreciation, and amortisation (EBITDA). June quarter earnings of Shree Cement were a mixed bag. While realisations were better-than-expected, increased operating cost was a dampener, offsetting benefits of improved realisations. Also, its volume growth on YoY basis was weighed by lower clinker sales. Cement volumes grew 41% YoY to 6.8 m tonnes (MT), while clinker sales, down 62% YoY, pulled down overall volume growth to 39% YoY to 6.8 MT. Shree Cement lagged behind peers in terms of volume growth in the June quarter, with UltraTech Cement, Ambuja Cement, and ACC delivering 47%, 53%, and 44%, respectively. Global brokerage firm cuts target Global brokerage CLSA maintained an 'underperform' rating on the stock and cut the target price on expensive valuation. Shree Cement’s quarter one EBITDA of ₹10.1 bn, down 18% quarter on quarter (QoQ) was in line with CLSA's estimates. Volume declined 17% QoQ and was slightly better than pan-India peers. Shree Cement aims to achieve 80 MT capacity by 2030 (7% CAGR) from 43 MT in March 2021, indicating that its goal of doubling the capacity in five-seven years is progressing at a slower pace than its earlier guidance. With the net cash of ₹64 bn and cumulative EBITDA of ₹155 bn over the next three years, the use of cash will be a key focus, CLSA said. Meanwhile, brokerage firm Nomura believes the company's margins are likely to compress in the next two quarters owing to weaker prices and higher input costs. Equitymaster's technical view on the cement sector We reached out to Brijesh Bhatia, Research Analyst at Equitymaster, and editor of the premium monthly recommendation service Fast Profits Report, for his technical view on the cement sector. Here's what he has to say... The financial market was hit in March 2020 by lockdown and by March 2021, they are up by 100% from the lows. Cement sector outperformed and most of the cement stocks are up by 100% from the lows. The demand in cement is largely lead by government spending on infrastructure and real estate. The commercial office been vacant with work-from-home culture and new housing projects been stalled, can still the cement sector rally from current levels? We created an Equal Weighted Cement Index (EWCI) chart using cements stocks with market cap over 10,000 crores and compared it with Nifty Realty Index. Since the lows in March 2020, EWCI and realty index rallied in a same manner. But since March 2021, we are witnessing divergence between the two sectors (marked red) where cement stocks are trading near high and realty stocks are underperforming against cement stocks. To check the future outperformance of cement stocks, we compared EWCI with Nifty. The ratio chart of EWCI Index vs Nifty above is indicating profit bookings can be on cards for cement stocks and it has reversed from the similar highs made in June 2020. The negative crossover of averages on Moving Average Convergence Divergence (MACD) supports an underperformance of EWCI over Nifty. How the stock markets reacted to Shree Cement’s results Shares of Shree Cement opened the day at ₹28,427.6 on the BSE yesterday and ₹28,195 on the NSE. Yesterday, its share price closed at ₹27,303.8 (down 3.5%) on the BSE and ₹27,299 (down 3.5%) on the NSE. At its current price, it is trading at a P/E of 43. The share touched its 52-week high of ₹32,050 and 52-week low of ₹18,214.4 on 9 April 2021 and 24 September 2020, respectively. Over the last 30 days, the Shree Cement share price is down 1.7%. Over the last one year, the company’s share price is up 25.7%. About Shree Cement Shree Cement is one of India's premier cement makers. It was incorporated in the year 1979. The company's manufacturing operations are spread over north and east India across six states. It has a consolidated cement production capacity of 44.4 million tonnes per annum (MTPA) and a power generation capacity of 742 MW. The company is an energy conscious and environment friendly business organisation. They have three brands under their portfolio, namely Shree Ultra Jung Rodhak Cement, Bangur Cement, and Rockstrong Cement. Their manufacturing units are located at Beawar, Ras, Khushkhera Suratgarh and Jobner (Jaipur) in Rajasthan, Laksar (Roorkee) in Uttarakhand, Aurangabad in Bihar, Panipat in Haryana, Baloda Bazar in Chhattisgarh, and Bulandshahr in Uttar Pradesh. The company is headquartered in Kolkata India. For more details about the company, you can have a look at Shree Cement's factsheet. This article is syndicated from Equitymaster.com"
Updated: 11 Aug 2021,Shree Cement’s tag of ‘most valued cement stock’ is now at greater risk,https://www.livemint.com/market/mark-to-market/shree-cement-stock-down-4-on-poor-operating-performance-in-q1-11628570502738.html,"The Street is upset with the subdued June-quarter earnings performance of Shree Cement Ltd. Its shares fell more than 4% on the NSE on Tuesday; it was the top loser among Nifty50 stocks. And why not! For a stock trading at a premium valuation multiple, lagging peers on crucial operating parameters is unlikely to be tolerated by investors. A key disappointment came from its rising input costs, which offset better-than-anticipated growth in realizations. Consequently, its Ebitda/tonne at ₹1,481 was below the estimated range of ₹1,551-1,553. Ebitda is short for earnings before interest, tax, depreciation and amortization.         "
Updated: 09 Aug 2021,"Stocks to Watch: PNB Housing, L&T, Bank of Baroda, DCB Bank, IDBI Bank",https://www.livemint.com/market/stock-market-news/stocks-to-watch-pnb-housing-l-t-bank-of-baroda-dcb-bank-idbi-bank-11628477093418.html,"NEW DELHI: Shree Cement, AstraZeneca Pharma India, Balrampur Chini Mills, Gati, Indian Hotels, MRF, Venky's (India), among other companies will report their earnings today. Here are top ten stocks that may be in the news today. Bank of Baroda: The lender has posted a standalone PAT of ₹1,208.63 crore as it swung back to profit for the quarter ended 30 June, 2021. The lender had posted a net loss of ₹864 crore in the year-ago period. The lender's net interest income (NII) –the difference between interest earned and interest expended– rose nearly 16% to ₹7,892 crore as against ₹6,816 crore in the year-ago period, BoB said in a regulatory filing. OMC stocks: OMCs are readying expansion plans for the electric vehicle (EV) segment. Officials from these companies said while the consensus was that disruption from the EV segment would at least be a decade away, the pandemic has changed the business environment, forcing them to accelerate plans in the EV charging segment. Gas industry stocks: Prime Minister Narendra Modi will launch Ujjwala 2.0 that provides free cooking gas connections to poor families by handling over domestic LPG cylinder connections at Mahoba in Uttar Pradesh on 10 August. DCB Bank: The lender reported 57% year-on-year drop in net profit in the June ended quarter owing to lower net interest income and higher slippages. The Mumbai-based lender reported net profit of Rs34 crore at the end of June quarter compared to Rs79 crore in the same quarter last year. Banking sector: Informal talks are taking place to deal with the fall-out from two rulings by India's Supreme Court that threaten the repayment of loans totalling nearly ₹50,000 crore ($6.73 billion) to some of India's largest banks, bankers close to the matter say. Happiest Minds Technologies: The Bengaluru-based IT services firm which has been facing rising attrition levels of late, is planning to hire 300 techies in each of the next three quarters, its top management said, according to media reports. PNB Housing Finance: The non bank lender expects to manage its bad loans better from this month onwards, when the deadline of going soft on borrowers provided by the courts ends on August 31, and would ask the borrowers to start repaying if they are capable to do so, a top company official said. IDBI Bank: As many as seven firms, including JM Financial, Ernst and Young and Deloitte, have bid for managing the strategic sale of IDBI Bank. These firms would make a virtual presentation before the Department of Investment and Public Asset Management, which is handling the sale process, on August 10, according to a notice by Dipam. Larsen and Toubro: The company has received shareholders' nod to raise up to ₹4,500 crore through issuance of convertible bonds, according to a regulatory filing. he shareholders' approval was given at the company's annual general meeting (AGM) held on Thursday, L&T said in the BSE filing on Friday. A special Cinema hall stocks: The prolonged closure of movie theatres during the covid-19 pandemic has robbed the box office of collections of around ₹580 crore from the release of 26 Hindi films directly on video streaming platforms since March 2020, according to a recent report by media consulting firm Ormax.resolution for raising the funds was approved with requisite majority. "
Updated: 09 Aug 2021,"Markets likely to be volatile; L&T, IDBI Bank, Shree Cements in focus",https://www.livemint.com/market/stock-market-news/markets-likely-to-be-volatile-l-t-idbi-bank-shree-cements-in-focus-11628477676337.html,"MUMBAI: Markets are likely to be volatile on Monday while trends in SGX Nifty suggest a soft opening of Indian benchmark indices. On Friday, the BSE Sensex ended at 54,277.72, down 215.12 points or 0.39%. The Nifty was at 16,238.20, down 56.40 points or 0.35%. Asian shares wobbled on Monday amid sharp losses in gold and oil prices, while the dollar held near four-month highs after an upbeat US jobs report lifted bond yields. Sentiment was shaken by a sudden dive in gold as a break of $1,750 triggered stop loss sales taking it as low as $1,684 an ounce . It was last down 2.2% at $1,723. Brent sank almost 2% on concerns the spread of the Delta variant would temper travel demand. Holidays in Tokyo and Singapore made for thin trading conditions, leaving MSCI's broadest index of Asia-Pacific shares outside Japan down 0.1%. Japan's Nikkei was shut but futures were trading just below Friday's close. Nasdaq futures slipped 0.5% and S&P 500 futures 0.3%. The US Senate was closer to passing a $1 trillion infrastructure package, though a single Republican lawmaker was holding up a vote on Sunday. Investors were still assessing whether Friday's strong US payrolls report would take the Federal Reserve a step nearer to winding back its stimulus. However, the pace of tapering was still up in the air and would decide when an actual rate hike came, he said. The Fed is currently buying $120 billion of assets a month, so a $20 billion taper would end the programme in six months whilst a $10 billion tapering approach would take a year. The spread of the Delta variant could argue for a longer taper with US cases back to levels seen in last winter's surge with more than 66,000 people hospitalised. Among key companies Shree Cements, MRF, Gujarat State Petronet, Clean Science & Technology, Indian Hotels Company, AstraZeneca Pharma India, Balrampur Chini Mills and Tata Investment Corporation will announce June quarter earnings today. As many as seven firms, including JM Financial, Ernst and Young and Deloitte, have bid for managing the strategic sale of IDBI Bank. These firms would make a virtual presentation before the Department of Investment and Public Asset Management, which is handling the sale process, on August 10, according to a notice by Dipam. L&T has received shareholders' nod to raise up to ₹4,500 crore through issuance of convertible bonds, according to a regulatory filing. The shareholders' approval was given at the company's annual general meeting (AGM) held on Thursday, L&T said in the BSE filing on Friday. In primary markets, shares of Rolex Rings will make stock markets debut. The ₹731 crore initial public offering (IPO) was subscribed 130.44 times subscription during 28-30 July. Yields on US 10-year notes were up at 1.30% in the wake of the jobs report, having hit their lowest since February last week at 1.177%. That jump gave the dollar a broad lift and knocked the euro back to $1.1744 , its lowest since April. The dollar likewise climbed to 110.28 yen and away from last week's trough of 108.71. That took the U.S. currency index up to 92.882 and nearer to the July peak of 93.194. Oil prices eased further after suffering their largest weekly drop in four months amid worries coronavirus travel restrictions would threaten bullish expectations for demand. Brent fell $1.30 to $69.40 a barrel, while U.S. crude lost $1.29 to $66.99. (Reuters contributed to the story)"
Updated: 20 Jul 2021,ACC’s valuations to get a boost from June-quarter earnings,https://www.livemint.com/market/mark-to-market/acc-stock-up-6-on-stellar-operating-performance-in-june-quarter-11626755320072.html,"Cement major ACC Ltd reported a stellar operating performance in the June quarter, sending its stock 7% higher on Tuesday. Higher-than-expected realizations and tight cost-control measures were among the key positive takeaways for investors in this stock. Average realization per tonne rose around 7.5% on a sequential basis, beating expectations of around 5% growth. The outperformance on the realizations front was aided by high cement prices in ACC’s key markets of north and central India, higher sale of premium products and lower discount. Favourable fuel mix, efficient logistics and various cost-efficiency measures under project Parvat helped contain a steep increase in operating costs.  Consequently, ACC’s Ebitda of ₹875 crore for Q2CY21 exceeded Bloomberg’s analysts’ consensus estimate of ₹720 crore. Ebitda is short for earnings before interest, tax, depreciation and amortization. ACC follows the calendar year as its financial year. On a per-tonne basis, Ebitda was at around ₹1,280 per tonne, which according to analysts, is the highest in a decade. Analysts at Jefferies India Pvt. Ltd said ACC’s Ebitda on a two-year CAGR basis was up 6%. CAGR stands for compounded annual growth rate. As far as volumes are concerned, it grew by 43% year-on-year (y-o-y) to 6.84 million tonnes aided by a favourable base. However, it fell around 14% sequentially. Analysts said the sequential fall in volumes despite the second wave of covid and a lean season is lower than feared earlier. The robust earnings performance in a seasonally weak quarter bodes well for its valuations. The ACC stock is trading at a one-year forward EV/Ebitda of around 10 times. EV stands for enterprise value. Peers Shree Cements Ltd and UltraTech Cement Ltd are trading at a valuation multiple of 16 times and 13 times, respectively, shows Bloomberg data. “ACC’s valuation gap versus peers has widened by around 25% in the last three-four months, and the Q2 beat should help close some of the gap,"" said analysts at Emkay Global Financial Services Ltd. ACC has been a laggard among other pan-India cement makers given its capacity constraints. The firm has commenced the capacity expansion project at its Ametha unit in Madhya Pradesh. Its waste heat recovery projects at Jamul and Kymore are on track and are likely to be commissioned by Q2CY22. Analysts are hopeful that the overhang of capacity constraints will soon be behind the company."
