article_time,article_title,article_link,article_content
Updated: 03 Feb 2021,Shree Cement loses some ground to UltraTech in valuation contest,https://www.livemint.com/market/mark-to-market/shree-cement-loses-some-ground-to-ultratech-in-valuation-contest-11612348692344.html,"Shree Cement Ltd reported stellar earnings in the December quarter, exceeding analysts’ estimates on many parameters. Volume growth of 15% year-on-year (y-o-y) was ahead of the Street’s estimated 11-12% growth range. Although Shree’s earnings were better than estimates, close competitor UltraTech Cement Ltd also posted impressive earnings. UltraTech’s volumes grew 14% y-o-y in Q3FY21. But a key highlight of the latter’s earnings announcement was its target to become net debt-free by FY23. UltraTech’s sharpened focus on debt repayment has, among other things, helped its stock bridge the gap with Shree, which is the most expensive cement stock. In the past two months, UltraTech shares have risen around 24%, compared to a mere 4% rise in shares of Shree Cement. Also Read | The Finance Commission doesn’t rock the federal boat Analysts at domestic brokerage IDBI Capital Ltd said Shree’s valuation premium to UltraTech has narrowed to 54%, compared to the highs of 80% seen in the past.  Shree’s cost leadership, timely capacity additions and debt-free status have contributed to its rich valuation multiple. Second, a key catalyst for the Shree Cement stock has been its massive expansion plan. But the recent delay in the commissioning of some units has got analysts a bit worried. “While the management has guided it will double capacity to 80 mtpa by FY27, execution has been slower than anticipated, with only one expansion (of 4 mtpa) having been announced in the east. Therefore, we expect the cash pile to grow further, diluting RoE by 200 bps to 15% over FY21-23E,"" analysts at Motilal Oswal Financial Services Ltd said in a report on 1 February. One basis point is one-hundredth of a percentage point. RoE is return on equity. In a post-earnings call, the Shree Cement management said its grinding units in Maharashtra and Odisha are expected to be commissioned in Q4 FY21 versus December 2020 guided earlier. Many cement companies, including UltraTech, announced expansions in the east. Although demand in the region is recovering, analysts said it is going to be a fight for market share at the expense of margins. Further, the ongoing probes by the Competition Commission of India will keep cement makers from taking steep hikes despite cost pressures. In this backdrop, analysts are uncomfortable with Shree’s valuations. “We remain cautious on near-term cement prices given the regulatory overhang. Moreover, costs are most likely to rise for power, fuel and freight. We believe Shree’s sector-leading returns are fairly factored into its valuation. While the valuation differential to peers is partly bridged, at a 17.5 times FY22 EV-Ebitda, it still looks demanding despite higher returns,"" foreign research house CLSA said in a report on 1 February. EV stands for enterprise value; Ebitda stands for earnings before interest, tax, depreciation and amortization."
Updated: 01 Feb 2021,"Stocks to Watch: ICICI Bank, Tech Mahindra, Shree Cements, Cipla, Vedanta",https://www.livemint.com/market/stock-market-news/stocks-to-watch-icici-bank-tech-mahindra-shree-cements-cipla-vedanta-11612144437410.html,"NEW DELHI : With just a few hours to go before finance minister Nirmala Sitharaman announces the Union Budget for fiscal 2022, here’s a list of stocks that maybe in focus today: ICICI Bank: The Mumbai-headquartered lender on Saturday reported a 17.73 % jump in its December quarter consolidated net profit to ₹5,498.15 crore, helped by a jump in core income but experienced a surge in bad assets from its retail loans. On a standalone basis, ICICI Bank showed a 19.12% rise in the post-tax profit to ₹4,939.59 crore for the reporting quarter, up from ₹4,146.46 crore in the October-December 2019 period. Tech Mahindra: IT services exporter Tech Mahindra reported a 14.3% jump in its December quarter net profit at ₹1,309.8 crore driven largely by improving profit margins while the revenues remained stable. The Mahindra Group company had registered a net profit at ₹1,145.9 crore in the year-ago period and ₹1,064 crore in the preceding September quarter. Shree Cements: The company posted over two-fold jump in consolidated net profit to ₹631.58 crore for the third quarter ended December 31, 2020. It had reported a net profit of ₹311.83 crore in October- December period a year ago, Shree Cements said in a filing to BSE. Bharti Airtel: The board of directors of the company in its meeting scheduled on 3rd February will consider routine financing/ re-financing strategies and any consequent raising of capital through various instruments subject to applicable statutory approvals, Bharti Airtel said in a BSE filing. Amber Enterprises: The company reported a revenue of ₹765 crore in Q3FY21 versus ₹788 in the Q3FY20. Operating EBIDT stood at ₹62 crore in the quarter ended 31 December against ₹52 crore in the same quarter of the previous fiscal. PAT rose marginally to ₹28 crore in the period under review from ₹25 core in Q3FY20. Vedanta: The company on Friday reported a 59% jump in its consolidated profit to ₹4,224 crore for the quarter ended on December 31, 2020. Vedanta Ltd had posted a profit after share in profit/loss of jointly controlled entities and associates of ₹2,665 crore in the year-ago period, Vedanta said in a regulatory filing to the BSE. Cipla: Drug major Cipla reported an over two-fold increase in consolidated net profit to ₹751.61 crore for the quarter ended December 31, 2020 on account of higher revenue from operations. The company had posted a net profit of ₹339.38 crore for the corresponding period of the previous financial year. Happiest Minds Technologies: The company has signed definitive agreements to acquire US-based Pimcore Global Services for $8.25 million (about ₹60 crore). Houston-based Pimcore Global Services is a digital e-commerce and data management solutions company. Coromandel International: Crisil has reaffirmed its rating on the Coromandel’s commercial papers and bank loan facilities worth ₹11,000 crore. The rating agency has maintained ‘A1+’ on commercial papers worth ₹2,000 crore; ‘AA+/Stable’ on long-term loan facilities and ‘A1+’ on short-term loan facilities worth ₹7,000 crore. SJVN: State-owned SJVN Ltd has bagged a 679 MW hydro-electric project in Nepal, the power ministry said in a statement on Saturday."
Updated: 30 Jan 2021,Shree Cements Q3 profit jumps over two folds to ₹632 crore,https://www.livemint.com/companies/company-results/shree-cements-q3-profit-jumps-over-two-folds-to-rs-632-crore-11612006138683.html,"NEW DELHI : Shree Cements on Saturday posted over two-fold jump in consolidated net profit to ₹631.58 crore for the third quarter ended December 31, 2020. It had reported a net profit of ₹311.83 crore in October- December period a year ago, Shree Cements said in a filing to BSE. Revenue from operations was up 12.57 per cent to ₹3,541.38 crore during the quarter under review as against ₹3,146.01 crore in the year-ago period. Total expenses were at ₹2,797.24 crore as against ₹2,801.89 crore. Meanwhile, in a separate filing, Shree Cements said its board has reappointed Hari Mohan Bangur as Managing Director of the company for a further period of five years. His reappointment comes into effect from April 1, 2021 and would be subject to the approval of the shareholders.  The company operates in the market with brands Bangur Cement, Shree Cement, Shree Jung Rodhak and Rockstrong. It also operates in the power sector and produces Autoclaved Aerated Concrete (AAC) blocks."
Updated: 25 Jan 2021,Faster-than-expected debt reduction a shot in the arm for Ultratech stock,https://www.livemint.com/market/mark-to-market/fasterthanexpected-debt-reduction-a-shot-in-the-arm-for-ultratech-stock-11611548754217.html,"Pan-India cement maker Ultratech Cement Ltd reported stellar earnings in the December quarter with volume growth of 14% year-on-year (y-o-y) to 23.9 million tonnes. Analyst say, this growth is higher than the industry and comes along with strong margin growth. Reacting to the earnings, the Ultratech stock hit a fresh 52-week high of ₹5831 on the NSE on Monday. Another key takeaway for investors was sequential net debt reduction of ₹2,696 crore to ₹9,436 crore. On a year-to-date basis in this fiscal year, net debt is down by ₹7,424 crore. Further, its consolidated net debt/Ebitda fell from 1.87 times to 0.84 times y-o-y. Ebitda is short for earnings before interest, tax depreciation and amortization. Also Read | Revenge of the lambs at the Gabbatoir In a post earnings conference call, the Ultratech managements said that it has cash equivalents of ₹13,000 crore which are invested in 100% secure AAA securities. According to analysts, the company had previously highlighted that it aims to become net debt free by fiscal year 2023. They say, the faster-than-expected deleveraging is a sentiment positive and should help the company bridge the gap with peer Shree Cement Ltd. Bloomberg data shows that Ultratech is trading at an EV/Ebitda of 16 times, a discount to Shree Cement's 22 times valuation multiple. EV is short for enterprise value. However, with rising prices of key inputs such as petroleum coke, analysts caution of margin erosion. According to foreign brokerage house CLSA, while Ultratech's Q3FY21 earnings were significantly ahead of estimates, cost pressure looms. It further added that although the demand outlook is strong, cost pressure are likely to weigh on its profitability going ahead."
Updated: 10 Dec 2020,Cement stocks under pressure after CCI initiates probe into cartelisation,https://www.livemint.com/market/stock-market-news/cement-stocks-under-pressure-after-cci-intiates-probe-into-cartelisation-11607590295409.html,"MUMBAI: Shares of cement companies were under pressure in trade on Thursday after fair trade regulator Competition Commission of India (CCI) initiated a probe into possible cartelisation by the firms. Shares of Ramco Cements, Dalmia Bharat, Deccan Cements, UltraTech Cement, India Cements, JK Cement, Ambuja Cement, Shree Cement, ACC, JK Lakshmi Cement, and Heidelbergcement India fell 1.3-4.2%. Also Read: The pandemic push to the silver economy ""The Competition Commission of India (CCI) has initiated an investigation against cement companies in India including ACC regarding alleged anti-competitive behaviour,"" ACC Ltd said in an exchange filing on Thursday. ACC said it is of the firm view that it has acted and continues to act in compliance with competition laws and are cooperating with the investigation and providing all necessary information to the authorities. ""ACC has a long-standing commitment to fair competition as reflected in its Code of Business Conduct,"" the company added. In a separate filing, Ambuja Cements, said also acknowledged the probe and added that, ""Ambuja Cements Limited has a long-standing commitment to fair competition as reflected in its Code of Business Conduct and Ethics."" In the past three months, most cement companies have outperformed the benchmarks, rising as much as 50% against an 18% rise in the BSE Sensex."
Updated: 23 Nov 2020,"Cement makers resume focus on growth capex, with demand recovery continuing",https://www.livemint.com/market/mark-to-market/cement-makers-resume-focus-on-growth-capex-with-demand-recovery-continuing-11606130894760.html,"Cement demand recovery seen in October across India has sustained in November, channel check by brokerages show. “South, where demand was the worst hit in April-August 2020, too, is seeing recovery in October-November, led by Andhra and Telangana,"" Kotak Institutional Equities said in a report. A key highlight of the September quarter for cement manufacturers was their impressive volume growth. The top 15 companies, which have a 75% volume market share, witnessed a 5% year-on-year demand increase in 2QFY21, added the Kotak report published on 19 November. Sales were largely aided by pent-up rural demand ahead of the festive season. Some pick-up in infrastructure and allied-activities also contributed to volume growth in certain markets. Region-wise, North, Central and East reported better growth in volumes than West and South. Further, the commentary on demand outlook by most cement companies was positive. So, companies have reinstated their capital expenditure plans, which were put on hold due to the pandemic. “Given the positive surprise on volume in 2Q and sustained momentum in October 20, managements have upped their volume guidance (flattish growth vs. 10-20% decline expected earlier) for FY21. Growth capex is gradually picking up pace on increasing comfort and visibility on volume growth,"" analysts at JM Financial Institutional Equities Ltd said in a report on 18 November. Among the large players, Ultratech Cement Ltd has guided for a capex of Rs1200-1300 crore for FY21. The company spent ₹450 crore of capex in the first half of FY21. The management of Shree Cement Ltd told analysts that it has restarted growth capex given the demand momentum. With capex focussed on expansion, the management expects its capacity to increase up to 57 million tonnes per annum (MTPA) in three years and up to 80MTPA in six-seven years time. ACC Ltd said it is now going ahead with the 1.1MTPA of grinding expansion in Sindri. Dalmia Bharat Ltd would entail ₹400 crore for capacity expansion at the Murli Industries unit and other initiatives will entail ₹500 crore of capex, the management said. Regional cement makers such as JK Cement Ltd, Orient Cement Ltd and Heidelberg Cement Ltd have also resumed their capex plans. While recovery in demand is sentimentally positive for cement stocks, there are downside risks to profitability growth from rising input costs. Analysts say, although the sector’s top-line will show improvement in quarters to come, operating margins could take a hit in absence of price hikes."
Updated: 12 Nov 2020,Shree Cement’s valuations get a leg up from decent earnings,https://www.livemint.com/companies/news/shree-cement-s-premium-valuation-gets-support-from-its-decent-q2-earnings-11605156990270.html,"The Shree Cement Ltd stock rose nearly 3% on Thursday on NSE, reacting to its September-quarter earnings. The cement major’s volumes grew 14% year-on-year (y-o-y) to 6.5 million tonnes in Q2. In a post-earnings conference call, the management said the demand momentum seen in September sustained in October. It expects near-term demand to remain strong, and foresees a 7-8% volume growth in FY21. The cement sector has surprised the Street with stellar volume growth in Q2, aided by pent-up demand from smaller cities and towns. Peers UltraTech Cement Ltd and Ambuja Cements Ltd saw their volumes grow in mid-single digits in the September quarter. For ACC Ltd, volume growth was flattish in the quarter gone by. Analysts say Shree Cement’s continued focus on capacity expansion has given it an edge over peers on volume growth in the recent past. But apart from that, what provided more comfort to investors is an improved handle on operating cost. In the June quarter, Shree Cement lagged competitors in controlling operating costs, which was a key disappointment for the Street. An analysis by domestic brokerage house Reliance Securities Ltd shows that Shree Cement is leading the pack on this metric in Q2. Its operating cost/tonne stood at ₹3,046 last quarter, lower than Ambuja’s measure of ₹3,831, UltraTech’s ₹3,818 and ACC’s ₹4,417. The management said freight costs declined sequentially, and input costs fell. Further, the management expects the per tonne cost run rate will remain in a similar range going forward. Analysts attribute this as one factor that supports its premium valuation to peers. The Shree Cement stock trades at a one-year forward EV/Ebitda of 20 times—the highest among listed Indian cement companies. EV stands for enterprise value. Ebitda is short for earnings before interest, tax, depreciation and amortization. UltraTech and ACC are trading at much lower multiples of around 15 times and 11 times, respectively. Meanwhile, improved prices in the company’s key market of North along with higher share of premium products aided realizations growth. However, it remains to be seen if prices sustain at higher levels in the North given the intensifying competition."
Updated: 21 Oct 2020,UltraTech’s valuation gap with Shree Cement may narrow post earnings,https://www.livemint.com/market/mark-to-market/ultratech-cement-beats-acc-hands-down-on-volumes-growth-11603275736258.html,"Stellar September quarter earnings by ACC Ltd raised the bar for cement makers. Competitor Ultratech Cement Ltd not only exceeded the Street’s expectations, but also outperformed ACC on key parameters. UltraTech’s cement volumes grew 7% year-on-year (y-o-y) to 20.1 million tonnes. Analysts were pencilling in a low single-digit volume growth. ACC had earlier reported 1% y-o-y volume growth. UltraTech’s rural market penetration has increased in the past year, driving growth. UltraTech’s volumes got a fillip from rural demand and government spending on infrastructure, chief financial officer Atul Daga said in an interview. He expects demand momentum in the rural areas to continue going ahead.  Dealers channel checks have been indicating pent-up demand in the individual home-building segment, especially from smaller towns. Sequentially, realizations declined given the seasonal weakness in prices, but the fall was lower than expected, analysts said. UltraTech’s tight leash on costs continued, with fixed costs declining by 14% y-o-y in the September quarter. Daga pointed out that some of these costs would make a comeback as normalcy resumes. As expected, increased diesel prices pushed its logistics cost higher. Similarly, costlier fly ash resulted in higher raw material cost. Both these components form around 50% of UltraTech’s overall cost structure. The saving grace was energy costs, which declined around 9% y-o-y due to the use of low-cost petroleum coke. However, sequentially, energy cost moved up. Analysts expect higher pet coke prices to impact UltraTech towards the end of Q3FY21. Strong volumes and strict cost control helped UltraTech’s profit and revenues beat Bloomberg’s consensus analysts’ estimates. Another positive was the net debt reduction of ₹2,519 crore in the September quarter. Consolidated net debt now stands at ₹12,132 crore. UltraTech’s elevated debt has been a concern for investors lately. Daga said that the company aims to bring its net debt/Ebitda below 1x by the end of this financial year. Currently, this metric stands at 1.22x. Ebitda stands for earnings before interest, tax, depreciation and amortization. Analysts expect the stock’s valuation to improve, aided by strong volume growth and debt reduction. They expect UltraTech’s valuation gap with Shree Cement to narrow from hereon. On a one-year forward EV/Ebitda basis, UltraTech is trading at a valuation multiple of 15 times. It is the second most expensive listed Indian cement stock after Shree Cement Ltd, which trades at an EV/Ebitda multiple of 19 times. EV is short for enterprise value. Meanwhile, the UltraTech stock ended Wednesday’s session at ₹4,631, up around 2%. The stock is close to reclaiming its 52-week high of ₹4,754 seen in January this year."
Updated: 11 Aug 2020,"Shree Cements’ Q1 miss a worry, as rich valuations leave no room for error",https://www.livemint.com/market/mark-to-market/shree-cement-stock-punished-for-relatively-poor-cost-control-vis-a-vis-peers-11597121463705.html,"At a time when cost rationalization is the mantra for corporates, Shree Cement Ltd’s relatively poor handling of operating expenses came as a disappointment. Driven by higher freight cost and other expenses, Shree Cement’s operating cost per tonne increased 7% on a quarter-on-quarter basis, showed an analysis by Reliance Securities Ltd. This compares with a 2-2.7% sequential decline in the operating cost per tonne of peers ACC Ltd, Ambuja Cements Ltd and Ultratech Cement Ltd. As a result, Shree Cement shares declined 3.80% during the day, making it the top loser among Nifty 50 companies on Tuesday. Note that Shree Cement has the highest valuation multiple among large cement companies. Analysts said it enjoyed this premium valuation for its cost-efficiency, stronger balance sheet and faster market share gains. In this backdrop, rising operating costs have to be closely watched. If they sustain at high levels, then its rich valuations are at risk, said an analyst requesting anonymity.  “We think it is too early to be concerned on Shree Cement’s ability to retain its cost and margin leadership position; nonetheless, margin of safety is low given premium valuations,"" Kotak Institutional Equities analysts said in a report on 10 August. Of course, better realizations can compensate for increasing cost pressures and save any potential margin erosion. But the company’s rising exposure to eastern India, where the pricing outlook is muted due to excessive capacity additions by competitors, could weigh on its realizations. Analysts estimate the eastern region to witness 30-35% capacity expansion by various players over the next two years. Note that Shree Cements, which is aggressively expanding, was looking to double its capacities in six years in its key markets of northern and eastern India. But, the company has pushed back on its large capital expenditure plan due to the current demand uncertainty. As a result, at the end of fiscal 2020, the company had a net cash of nearly ₹3,300 crore. Foreign brokerage house CLSA said Shree Cement’s results indicate the company may have to forego pricing to maintain higher growth. “With the stock trading at a roughly 70% premium to the rest of the coverage, we think high returns and strong balance sheet are more than factored-in,"" it said in a report on 10 August. Both Kotak and CLSA have a sell rating on the stock, citing its expensive valuation. As for the stock’s performance, from its recent high of ₹24,813 in February on the NSE, it is currently around 13% down. Analysts see limited upside in the stock from the current levels unless demand and realizations improve meaningfully."
Updated: 11 Aug 2020,Shree Cement's stock falls 5% on weak Q1 performance,https://www.livemint.com/market/stock-market-news/shree-cement-s-stock-falls-5-on-weak-q1-performance-11597122692810.html,"Mumbai : Shares of Shree Cement Ltd fell as much as 4.71% after it reported a 13.5% drop in consolidated net profit at ₹330.35 crore during the June quarter of FY21 as against a profit of ₹382 crore in the same period last year. At 10:20 am, Shree Cement was trading at ₹21,421.95 down 4.32% from its previous close, while the benchmark index, Sensex gained 0.76% to 38,471.45. The company’s revenue fell around 24% at ₹2,480 crore, as against ₹3,302 crore during the last financial year. Total expenses too came down by 25% at ₹2,163 crore, mainly on the back of lower raw material costs. Shree Cement reported 22% YoY drop in earnings before interest, tax, depreciation and amortization (EBITDA) to around ₹700 crore, while EBITDA per tonne stood at ₹1,422 in the June quarter of FY21. Analysts at Motilal Oswal in a result note said, ""Shree Cement's home market of northern India remains better placed due to consolidated market structure and lower capacity additions, its increasing exposure to the eastern region is expected to result in blended margin decline. A strong balance sheet ₹3,300 crore net cash at FY2020-end and limited capex provide comfort in the current uncertain demand environment on account of covid-19. We value the stock at 16 times FY2022E Enterprise Value on Earnings before interest, tax, depreciation and ammortisation and add the value of the UAE operations at $70 per tonne to arrive at target price of ₹21,500."" The brokerage has a neutral rating on the stock. Shree Cement was able to offset some of the hit due to lower raw material costs. Petcoke prices, a key raw material used to produce cement, were 40% lower during the quarter. Cement prices had also started increasing from May as construction activities restarted. Emkay Global Financial Services in a result note to clients said, ""Cement demand recovery has been much better than our estimates and have increased sales volume assumptions by 14.7%/6.6%/5.5% for FY2021/2022/2023. Historically, Shree Cement has been ahead of most of its peers in capacity expansions, which has helped it to gain market share. The company has aggressive growth plans of doubling its capacities in six years, though there has been some delay due to covid-19-led demand disruption. Capex per ton for Shree Cement is much lower than industry peers and believe that the stock will continue to command premium valuations."" The brokerage has a hold rating on the stock."
