article_time,article_title,article_link,article_content
Updated: 09 Apr 2022,Organized retailers could match pre-covid sales in Q4FY22: Report,https://www.livemint.com/industry/retail/organized-retailers-could-match-pre-covid-sales-in-q4fy22-report-11649502485037.html,"New Delhi: Large, organized retailers are expected to report close to pre-covid sales in the fourth quarter of FY22 led by higher store additions, price hikes, and improved demand in March, according to analysts at ICICI Securities. In an earnings preview released Friday, the brokerage said apparel retailers, for instance, surpassed pre-covid levels in terms of sales as offices and schools resumed and demand increased. The quarter was marked by the third wave of covid led by the Omicron variant. However, as cases receded and mobility increased, demand trends improved too. In March, specifically with offices and schools announcing normal resumption of activities, demand for footwear and clothing picked up. “As per our channel checks, apparel retailers in Q4FY22E on a per store basis have registered a recovery rate in the range of 50-60% in January while February was a month of recovery gaining ground to 80-85% of pre-covid levels. However, March has seen a sharp recovery with most apparel companies being able to surpass the pre-covid levels owing to strong demand driven by opening up of offices, reopening of schools and increased demand due to the wedding season,"" analysts at ICICI Securities said. The brokerage expects retail companies in its coverage universe to report year-on-year revenue growth of 12.9% in Q4FY22. It tracks companies such as Titan Company, Bata India, ABFRL, Trent Ltd, Avenue Supermarts, among others. Despite robust demand, companies took price hikes to mitigate higher input costs. Yarn prices, for instance, have been at an all-time high. Apparel retailers have taken price hikes in the range of 8-12%, according to analyst estimates. Price hikes could support gross margins, they said. “We expect EBITDA margin for our coverage universe to remain flattish at 11.2% with expected EBITDA growth of 13.4% year-on-year,"" the analysts said. During the quarter, retailers continued “calibrated expansion"" of their store network. Retailers such as Trent, Tanishq, V Mart and Avenue Supermarts added several stores during the quarter."
Updated: 06 Apr 2022,Rakesh Jhunjhunwala portfolio: Titan reports muted sales in Q4,https://www.livemint.com/companies/news/titan-q4-update-rakesh-jhunjhunwala-owned-stock-reports-muted-sales-11649243066948.html,"Titan Company Ltd on Wednesday said it finished the March quarter on a satisfactory note, despite partial Omicron-led lockdowns and adverse affect of consumer centiments. The company said sharp increase and volatility in gold prices and uncertainty due to a fragile gee-political situation played spoilsport in March. However, Titan said underlying demand remained strong across all of its businesses with most segments posting year-on-year growth over a very strong Q4FY21 base. Jewellery segment ended the volatile quarter on a flat note and business saw subdued activity in top cities due to the Omicron wave. The segment declined 4% year-on-year, with a net addition of 16 new stores. ""While walk-ins saw minor decline, the customer conversions and ticket sizes grew marginally for the quarter compared to the same period last year. Sales from top 8 cities grew in single digits while the rest of India saw a small decline,"" Titan said. The watches and wearables segment grew 12% year-on-year and 34 new stores were added during the March quarter. Titan said the segment saw good growth momentum amidst a challenging external environment with sales increasing across all offline channels on the back of Titan brand. ""Sales from retail and large format stores (LFS) clocked higher growth followed by trade. West and North regions saw much higher growth amongst geographies. store expansions (net) continued with 24 new stores in Titan World and 10 in Helio,"" it said. The eyecare division rose 5% over last year, led frames and sunglasses. Veteran investor Rakesh Jhunjhunwala and his wife Rekha Jhunjhunwala together hold 5.09% stake in Titan as of December quarter, as per the BSE shareholding pattern."
Updated: 04 Apr 2022,Multibagger stocks: These 3 Tata shares double shareholders' money every 4 years,https://www.livemint.com/market/stock-market-news/multibagger-stocks-these-3-tata-shares-double-shareholders-money-every-4-years-11649046504699.html,"Multibagger stocks: In market rebound post-Covid-19 selloff, a good number of stocks have entered the list of multibagger stocks in India in last two years. This list of multibagger stocks in India include those quality stocks as well that have been giving stellar return to its investors for long. Tata group stocks — Tata Elxsi, Tata Consumer Products and Titan Company — are among those quality stocks. These shares have been giving multibagger return to its shareholders after a gap of 4 years since 2009. Here we list out full details in regard to these multibagger Tata group shares: 1] Tata Elxsi: This multibagger stock has remained a milking cow for its shareholders since 2009. In the beginning of April 2009, Tata Elxsi share price was around ₹45 apiece levels, which surged to around ₹95 levels in April 2013. In April 2017, this multibagger IT stock hit triple digit as it was quoting around ₹1050 per share in the beginning of FY18. In the beginning of April 2021, Tata Elxsi shares were quoting around ₹2775 levels. So, this Tata group stock has given multibagger stock after every foru years since 2009. 2] Titan Company: This multibagger Tata share has also given stellar return to its shareholders since 2009. In April 2009, Titan share price was around ₹40 per share levels that went up to ₹near 300 apiece in April 2013. In October 2017, Titan Company share price went further up at around ₹600 levels, which further scaled up to ₹1460 per share levels April 2021. Hence, this Tata share has been giving multibagger return to its shareholders after every four years since 2009. 3] Tata Consumer Products: This Tata group share was quoting around ₹60 per share in April 2009 that climbed to around ₹130 levels in April 2013. In November 2017, this multibagger stock was quoting around ₹275 per share levels on NSE that further went up to around ₹675 apiece levels in April 2021. Hence, these 3 multibagger stocks have been giving more than 100 per cent return to its shareholders after every 4 years since 2009. However, among these 3 stocks, Tat Elxsi has outperformed other two by big margin."
Updated: 25 Mar 2022,Sebi penalises three individuals for violations in Titan share trades,https://www.livemint.com/market/stock-market-news/sebi-penalises-three-individuals-for-violations-in-titan-share-trades-11648222622990.html,"Capital markets regulator Sebi has slapped monetary penalty on three individuals for violating insider trading norms in shares of Titan Company Ltd. Titan has written to Sebi about contravention of Sebi norms and company’s code of conduct for prevention of insider trading by some of its designated employees. Later, Sebi conducted an investigation in the scrip of Titan and observed several non-compliances of insider regulations during the period April 2018 to March 2019. During their employment with Titan, they had transacted in the securities of Titan Co Ltd but failed to make the requisite disclosures to the firm as required under the prohibition of insider trading norms, as per Sebi. The disclosure requirements were triggered on account of the transactions concerned exceeding the traded value of ₹10 lakh. For violation of the norms, the individuals have been penalised by the regulator."
Updated: 18 Mar 2022,Rakesh Jhunjhunwala earns ₹861 crore from these two stocks in one day,https://www.livemint.com/market/stock-market-news/rakesh-jhunjhunwala-net-worth-rises-rs-861-crore-from-these-two-stocks-in-one-day-11647570936239.html,"Rakesh Jhunjhunwala portfolio: Amid sharp upside movement on Thursday trade session, ace Indian investor Rakesh Jhunjhunwala's net worth grew around ₹861 crore after decent rise in his two portfolio stocks — Titan Company and Star Health Insurance. Titan share price yesterday appreciated from ₹2587.30 to ₹2706 apiece levels, logging ₹118.70 per share rise on Thursday session. Similarly, Star Health share price surged from ₹608.80 to ₹641 apiece levels, ascending ₹32.20 per share on Thursday session. Rakesh Jhunjhunwala share holding According to Titan Company's shareholding pattern for October to December 2021 period, Rakesh Jhunjhunwala and his wife Rekha Jhunjhunwala have invested in the company. Rakesh Jhunjhunwala owns 3,57,10,395 Titan Company shares, which is 4.02 per cent of total issued paid-up capital of the company. Similarly, Rekha Jhunjhunwala holds 95,40,575 Titan shares or 1.07 per cent stake in the company. So, Jhunjhunwala couple together own 4,52,50,970 company shares or 5.09 per cent stake in this Tata Group flagship company. As per the latest exchange communication, Big Bull Rakesh Jhunjhunwala has declared that he holds 10,07,53,935 shares, which is 17.50 per cent of the total issued paid-up capital of the company. Rise in Rakesh Jhunjhunwala's net worth As Rakesh Jhunjhunwala holds 4,52,50,970 Titan Company shares and Titan share price ascended ₹118.70 on Thursday. So, net rise in Rakesh Jhunjhunwala's net worth is around ₹537 crore ( ₹118.70 x 4,52,50,970). Similarly, Rakesh Jhunjhunwala holds 10,07,53,935 Star Health shares that surged ₹32.20 per share on Thursday. Hence, net rise in Rakesh Jhunjhunwala's net worth due to rise in Star Health share price is around ₹324 crore ( ₹32.20 x 10,07,53,935). Therefore, total rise in Rakesh Jhunjhunwala's net worth due to rise in Titan share price and Star Health share price is around ₹861 crore ( ₹537 crore + ₹324 crore)."
Updated: 17 Mar 2022,Rakesh Jhunjhunwala portfolio: Tata stock climbs new all-time high. Do you own?,https://www.livemint.com/market/stock-market-news/rakesh-jhunjhunwala-portfolio-tata-stock-climbs-new-all-time-high-do-you-own-11647498169220.html,
Updated: 16 Mar 2022,Rakesh Jhunjhunwala stock near life-time high. Will it climb to a new peak?,https://www.livemint.com/market/stock-market-news/rakesh-jhunjhunwala-portfolio-titan-share-price-near-to-its-life-time-high-will-it-climb-to-a-new-peak-11647397431077.html,"Rakesh Jhunjhunwala portfolio: Titan Company share price is near to its life-time high of ₹2,687.25 apiece levels. According to stock market experts, the stock is expected to reap margin benefit of recent gold price rally in international market. They said that chances are bright for the jewelry stock to give better Q4 numbers in upcoming result season. They said that Titan share price are in uptrend and may climb to a new life-time high in next one month. Speaking on this Rakesh Jhunjhunwala stock; Sumeet Bagadia, Executive Director at Choice Broking said, ""Titan share price is in uptrend. One can buy and hold the stock at current levels for one month target of ₹2650 to ₹2700 maintaining stop loss at ₹2450."" Sumeet Bagadia of Choice Broking advised positional investors to add this Tata group stock in their portfolio as the stock looks promising for medium and long term as well. Echoing with Sumeet Bagadia's views; Anuj Gupta, Vice President at IIFL Securities said, ""After sharp appreciation in gold price, we may seen a momentum in bullion stocks like Titan shares. These jewelry companies are expected to report margin benefit in upcoming result season as gold prices shot up to the tune of 19-month high of $2070 per ounce levels in international markets. Technically, Titan share price is in positive zone and fundamentally this stock is a profitable statement. So, one can buy and hold the stock for medium to long term time horizon."" He said that the stock may go up to ₹2800 apiece levels in short term. Rakesh Jhunjhunwala shareholding in Titan Company According to Titan Company shareholding pattern for October to December 2021 quarter, Rakesh Jhunjhunwala and his wife Rekha Jhunjhunwala have shareholding in the company. Rakesh Jhunjhunwala owns 3,57,10,395 Titan Company shares, which is 4.02 per cent of total issued paid-up capital of the company. Similarly, Rekha Jhunjhunwala holds 95,40,575 Titan Company shares or 1.07 per cent stake in the company. So, Jhunjhunwalas together own 4,52,50,970 company shares or 5.09 per cent stake in this Tata Group flagship company. Disclaimer: The views and recommendations made above are those of individual analysts or broking companies, and not of Mint."
Updated: 12 Mar 2022,Here are 4 Tata group stocks Rakesh Jhunjhunwala holds. Worth a look?,https://www.livemint.com/market/stock-market-news/here-are-4-tata-group-stocks-rakesh-jhunjhunwala-holds-worth-a-look-11647052913035.html,"Rakesh Jhunjhunwala portfolio is closely followed by retail investors and market observers as it indicates about the direction in which smart money is moving. Big Bull holds around three dozen of listed stocks in his portfolio. However, Tata group stocks have always remained his one of the favourite stocks. Currently, 'Warren Buffett of India' holds 4 Tata group flagship stocks. Those stocks are Titan Company, Tata Motors, Tata Communications and Indian Hotels Company. Here we list out details of Tata group shares in Rakesh Jhunjhunwala portfolio: 1] Titan Company: As per Titan Company shareholding pattern for Q3FY22, Rakesh Jhunjhunwala and his wife Rekha Jhunjhunwala have shareholding in the company. Rakesh Jhunjhunwala owns 3,57,10,395 Titan Company shares, which is 4.02 per cent of total issued paid-up capital of the company. Similarly, Rekha Jhunjhunwala holds 95,40,575 Titan Company shares or 1.07 per cent stake in the company. In last one month, Titan share price has given alpha return to its investors. In last one month Sensex and Nifty have given zero return while this Tata company has delivered 4 per cent return in this period. 2] Tata Motors: According to shareholding pattern of Tata Motros for October to December 2021, Rakesh Jhunjhunwala holds 3,92,50,000 company shares, which is around 1.18 per cent of the total issued paid-up capital of the company. In last one month, the stock has been under selloff heat as it has lost more than 11 per cent in this period whereas key benchmark indices Sensex and Nifty dipped 1.50 per cent and 1.25 per cent respectively. 3] Tata Communications: As per Tata Communications shareholding pattern for third quarter of current fiscal, Rakesh Jhunjhunwala holds 30,75,687 company shares or 1.08 per cent stake in the Tata group company. In last one month, this Rakesh Jhunjhunwala stock has dipped more than 5 per cent whereas in 2022, this stock has lost more than 20 per cent. 4] Indian Hotels Company: This is a Tata group hospitality stock that has been rising on the unlock theme. this Rakesh Jhunjhunwala stock too has generated alpha return in last one month. It has generated 4.30 per cent return in this period whereas in 2022, it has surged around 10.50 per cent in 2022."
Updated: 11 Mar 2022,Titan Co picks up stake in America's lab-grown diamond brand,https://www.livemint.com/companies/news/titan-company-picks-up-stake-in-america-s-lab-grown-diamond-brand-11646988017361.html,"NEW DELHI : Titan Co. Ltd has picked up a 17.5% stake in Stamford, Connecticut-based lab-grown diamond maker Great Heights Inc. for an estimated $20 million through its subsidiary TCL North America Inc., the company said on Friday. The “strategic investment will provide Titan a ring-side view of the fast-growing lab-grown diamond and direct-to-consumer sectors,"" it added. Great Heights is primarily engaged in retailing of lab-grown diamond jewellery via its brand Clean Origin. Set up in January 2019, it has more than doubled its revenues from $11 million in 2019 to $25 million in the year 2021. “TCL North America Inc., a wholly-owned subsidiary of the company has today signed a stock purchase agreement with Great Heights Inc., USA for subscription of shares with voting preferred stock in the capital stock of Great Heights, which would result in TCLNA holding up to 17.5% voting rights in Great Heights,"" Titan said in a stock exchange filing. The deal is expected to close by 15 March. Mint had earlier reported that India is set to become a hub for the production and processing of lab-grown diamonds accounting for 10% of the worldwide diamond market by 2030."
Updated: 11 Mar 2022,Titan Company's arm to acquire 17.5% stake in Great Heights for ₹152 crore,https://www.livemint.com/companies/news/titan-company-s-arm-to-acquire-17-5-stake-in-great-heights-for-rs-152-crore-11646985938338.html,"Tata group firm Titan Company on Friday said its subsidiary has inked a pact to acquire 17.5 per cent voting rights in US-based Great Heights Inc for USD 20 million (around ₹152 crore). TCL North America Inc (TCLNA), a wholly-owned subsidiary of the company, has signed a stock purchase agreement with Great Heights Inc for subscription of shares with voting preferred stock in the capital stock of Great Heights, the jewellery and watch maker said in a regulatory filing. As per the pact, TCLNA would hold up to 17.5 per cent voting rights in Great Heights, it added. ""This is a strategic investment that will provide Titan a ring-side view of the fast growing Lab Grown Diamond (LGD) and Direct-to-Consumer (D2C) sectors,"" the company stated. Great Heights retails LGD jewellery through its brand ""Clean Origin"". The company's gross revenue for the year 2021 stood at USD 25 million. "
Updated: 07 Mar 2022,Rakesh Jhunjhunwala loses ₹400 crore in these two stocks in 5 minutes,https://www.livemint.com/market/stock-market-news/rakesh-jhunjhunwala-loses-rs-400-crore-in-these-two-stocks-in-5-minutes-11646631051513.html,
Updated: 01 Mar 2022,Rakesh Jhunjhunwala portfolio: Tata stock near all-time high. Should you buy?,https://www.livemint.com/market/stock-market-news/rakesh-jhunjhunwala-portfolio-tata-stock-near-all-time-high-should-you-buy-11646111526355.html,
Updated: 24 Feb 2022,Rakesh Jhunjhunwala loses ₹785 crore in these two portfolio stocks today,https://www.livemint.com/market/stock-market-news/rakesh-jhunjhunwala-loses-rs-785-crore-in-these-two-portfolio-stocks-today-11645692562568.html,"Rakesh Jhunjhunwala portfolio: In stock market crash today, a good number of quality stocks have witnessed sharp downside movement. those who believe smart investors always make money in the markets are advised to have a look at the portfolios of the ace investor they follow. Then only, they would come to know that even market magnets lose money when market trades abnormally. Some Rakesh Jhunjhunwala portfolio stocks are glaring example of it. Today Big Bull's favourite stocks Titan Company and Star Health shares have fallen heavily leading to ₹785 crore loss in Rakesh Jhunjhunwala's net worth. In weak stock market today, Titan share price opened on the downside and at the time of news writing (2:15 PM), it was down ₹80 per share. Similarly, Star Health shares today continue to nosedive and hit its 52-week low today. It waas down ₹42 per share (at 2:15 PM on NSE). According to shareholding pattern of Titan Company, Rakesh Jhunjhunwala and his wife Rekha Jhunjhunwala hold hold 4,52,50,970 Titan Company shares or 5.09 per cent stake in the company. Similarly, as per the exchange communication by Rakesh Jhunjhunwala, Big Bull and his wife wife Rekha Jhunjhunwala holds 10,07,53,935 Star Health shares, which is 17.50 per cent of the total issued paid-up capital of the company. Dent to Rakesh Jhunjhunwala's net worth As Rakesh Jhunjhunwala and his wife together hold 10,07,53,935 Star Health shares, net loss to Rakesh Jhunjhunwala's net worth stands around ₹423 crore ( ₹42 x 10,07,53,935). Similarly, Rakesh Jhunjhunwala and his wife hold 4,52,50,970 Titan shares and hence net loss in Rakesh Jhunjhnunwala's net worth stands at ₹362 crore ( ₹80 x 4,52,50,970). So, net slump in Rakesh Jhunjhunwala's net worth after fall in these two stocks stands at ₹785 crore ( ₹423 crore + ₹362 crore). Disclaimer: The views and recommendations made above are those of individual analysts or broking companies, and not of Mint."
Updated: 22 Feb 2022,This Rakesh Jhunjhunwala stock may benefit from new India-UAE trade pact,https://www.livemint.com/market/stock-market-news/this-rakesh-jhunjhunwala-stock-may-benefit-from-new-india-uae-trade-pact-11645503928927.html,"Rakesh Jhunjhunwala portfolio: The Indian gems and jewellery sector is gung-ho after the India-UAE trade agreement signed on Friday. In this tariff rate quota (TRQ) agreement, UAE has reduced its import duty on Indian exports on gems and jewellery from 5 per cent to zero. According to stock market experts, this is going to boost export business of organised gems and jewellery companies that includes Titan Company. They said that it has limited exports but the volume will definitely benefit the company. They advised positional investors to buy the Tata group stock in ₹2300 to ₹2450 range for one year target of ₹3000. Decoding the India-UAE trade pact; Ravi Singhal, Vice Chairman at GCL Securities said, ""This TRQ agreement between India and UAE will help Indian gems and jewellery export growth and organised companies are going to benefit from this. Titan Company, Rajesh Exports and Vaibhav Global are some of the listed companies that will also benefit from this pact. So, in short term, rising gold prices due to Russia Ukraine crisis and in long term, this India UAE pact is going to help Titan share price to surge."" Echoing with Ravi Singhal's views; Anuj Gupta, Vice President at IIF Securities said, ""High risk short term traders can buy Titan Company shares at current price for immediate target of ₹2600 levels. However, investors are advised to maintain strict stop loss at ₹2330 apiece levels."" However, Ravi Singhal of GCL Securities said, ""India-UAE trade pact is going to help Titan Company in long term while rising gold price will boost Titan share price in short term. My suggestion to positional investors is to invest for at least one year. They should buy Titan shares in ₹23000 to ₹2450 range for one year target of ₹3000 maintaining stop loss at ₹2150 apiece levels."" Rakesh Jhunjhunwala share holding in Titan Company According to Titan Company shareholding pattern for October to December 2021 quarter, Rakesh Jhunjhunwala and his wife Rekha Jhunjhunwala have shareholding in the company. Rakesh Jhunjhunwala owns 3,57,10,395 Titan Company shares, which is 4.02 per cent of total issued paid-up capital of the company. Similarly, Rekha Jhunjhunwala holds 95,40,575 Titan Company shares or 1.07 per cent stake in the company. So, Jhunjhunwalas together own 4,52,50,970 company shares or 5.09 per cent stake in this Tata Group flagship company. Disclaimer: The views and recommendations made above are those of individual analysts or broking companies, and not of Mint."
Updated: 19 Feb 2022,Retailer revenues up 30% in December quarter: report,https://www.livemint.com/companies/news/retailer-revenues-up-30-in-december-quarter-report-11645275851741.html,"NEW DELHI : India’s top retailers—across fast food, apparel wear and jewellery reported strong recovery in sales with overall revenues up 30%, according to a report by brokerage Edelweiss Securities. The report mapped December quarter earnings of large, listed companies such as Titan Company Ltd, Jubilant Foodworks, Aditya Birla Fashion Retail (ABFRL), V-Mart Retail, Shoppers Stop, among others. “Third quarter of FY22, on expected lines, was a record quarter for some (Titan, Page and Trent), with a full recovery for others (apparel retailers). Overall, revenues were up 30% year-on-year,"" the brokerage said in a report released Friday. The third quarter of the current fiscal saw demand normalize for several retailers—as the covid wave ebbed and shoppers returned to stores. However, an uptick in cases in the end of December as well as January once again paused recovery for retailers. In the December quarter, Jewellery, for instance, outperformed due to a spike in wedding linked demand. “We believe, while growth ahead may moderate, it will remain robust. Apparel retail saw the highest beat, driven by Trent and ABFRL as festive and marriage seasons turned in better than expected. Trent sustained its outperformance and record showing. Quick service restaurants saw an incremental recovery in dine-in drive with delivery staying stable quarter-on-quarter. Jubilant Foodworks (JFL) was a laggard due to weak dine-in recovery, impacted by omicron,"" it said. Meanwhile, all QSR companies surpassed their pre-covid levels of revenues with incremental recovery driven by dine-in as delivery remained stable. Apparel retailers as well as those selling, innerwear reported stable progress but the brokerage flagged near-term inflationary headwinds. This is especially true for value retailers. “The festive and marriage season became a trigger for apparel retailers also, touching pre-covid revenue run rate, a first. Also, divergence in recovery continued with Trent outpacing peers again. Page Industries continued its robust revenue growth (in-line). Margin pressure remains a key moniterable across players,"" it said. All categories have now achieved normalisation and except for the Omicron impact in January, things are back on the trajectory."
