article_time,article_title,article_link,article_content
Updated: 21 Jun 2022,Rakesh Jhunjhunwala earns ₹590 crore from these two Tata stocks in one day,https://www.livemint.com/market/stock-market-news/rakesh-jhunjhunwala-earns-rs-590-crore-from-two-tata-stocks-titan-company-and-tata-motors-in-one-day-11655815335735.html,"Rakesh Jhunjhunwala portfolio: After Nifty 50 index logging largest one day points gain on Tuesday session since 17th May 2022, Big Bull Rakesh Jhunjhunwala earned ₹590 crore from his two Tata stocks — Titan Company and Tata Motors. Titan share price today ascended ₹118.25 on NSE whereas Tata Motors share price today surged ₹15.40 per share, which helped Rakesh Jhunjhunwala's net worth to surge around ₹590 crore. Rise in Titan share price Titan Company share price today opened with an upside gap and closed at ₹2079.95 levels, ₹118.25 above its close price of ₹1961.70 apiece levels on Monday. Rise in Tata Motors share price Tata Motors share price today opened upside at ₹389 on NSE and closed at ₹398.10 levels, logging ₹15.40 per share rise on Tuesday. Rakesh Jhunjhunwala shareholding in Titan Company As per Titan Company shareholding pattern for January to March 2022, Big Bull owns 3,53,10,395 Titan shares while his wife Rekha Jhunjhunwala owns 95,40,575 Titan shares. So, Jhunjhunwala couple together holds 4,48,50,970 Titan shares. Rakesh Jhunjhunwala holding in Tata Motors According to Rakesh Jhunjhunwala shareholding pattern for Q4FY22, Rakesh Jhunjhunwala holds 3,92,50,000 shares or 1.18 per cent stake in Tata Motors. Rise in Rakesh Jhunjhunwala's net worth As Rakesh Jhunjhunwala and his wife Rekha Jhunjhunwala holds 4,48,50,970 Titan shares that surged ₹118.25 today. Rise in Rakesh Jhunjhunwala's net worth due t o rise in Titan Company shares is around ₹530 crore ( ₹118.25 x 4,48,50,970). Similarly, Rakesh Jhunjhunwala owns 3,92,50,000 Tata Motors shares that surged ₹15.40 per share on Tuesday. So, net rise in Rakesh Jhunjhunwala's net worth due to rise in Tata Motors share price is around ₹60 crore ( ₹15.40 x 3,92,50,000). So, exact rise in Rakesh Jhunjhunwala's net worth after rise in these two Tata group stocks is ₹590 ( ₹530 crore + ₹60 crore)."
Updated: 17 Jun 2022,These 3 stocks pull down Rakesh Jhunjhunwala's net worth by ₹900 cr in 15 mins,https://www.livemint.com/market/stock-market-news/these-3-stocks-titan-company-star-health-metro-brands-pull-down-rakesh-jhunjhunwala-s-net-worth-by-rs-900-crore-in-15-minutes-11655444899564.html,"Rakesh Jhunjhunwala net worth: Amid India stock market extending the sell-off trend on sixth straight session on Friday morning deals, Big Bull Rakesh Jhunjhunwala has lost around ₹900 crore within 15 minutes of the opening bell today. This could happened due to the profit-booking in three Rakesh Jhunjhunwala portfolio stocks — Titan Company, Metro Brands and Star Health & Allied Insurance Company Ltd. Dip in Titan share price Titan Company share price today opened lower and hit ₹1997 apiece levels by 9:30 AM, logging ₹63.95 per share dip from its yesterday's close of ₹2060.95 levels on NSE. Dip in Star Health share price Star Health share price today opened lower and went on to hit ₹609.05 apiece levels by 9:30 AM. As the stock had closed at ₹664.15 levels on Thursday, it logged ₹55.10 dip within 15 minutes of stock market opening today. Dip in Metro Brands share price Like two other Rakesh Jhunjhunwala stocks, Metro Brands share today opened with a downside gap and went on to hit ₹535.35 by 9:30 AM, logging ₹14.30 per share within 15 minutes of opening bell. Dip in Rakesh Jhunjhunwala's net worth As per shareholding pattern of Titan Company for Q4FY22, Rakesh Jhunjhunwala holds 3,53,10,395 company shares while his wife Rekha Jhunjhunwala owns 95,40,575 titan shares. So, Jhunjhunwala couple together holds 4,48,50,970 Titan shares. As Titan share price dipped 63.95 in 15 minutes of stock market opening today, net slide in Rakesh Jhunjhunwala's net worth due to slide in this Tata stock is around ₹287 crore ( ₹63.95 x 4,48,50,970). Likewise, Rakesh Jhunjhunwala holds 10,07,53,935 Star Health shares that dipped ₹55.10 per share in 15 minutes after the stock market opening b ell today. So, net dip in Rakesh Jhunjhunwala's net worth due to dip in this Rakesh Jhunjhunwala portfolio stock is around ₹555 crore ( ₹55.10 x 10,07,53,935). Rakesh Jhunjhunwala has invested in Metro Brands through his wife Rekha Jhunjhunwala. As per the shareholding pattern of Metro Brands for January to March 2022 quarter, Rekha Jhunjhunwala holds 3,91,53,600 shares of the company that has dipped ₹14.30 per share today in 15 minutes of market opening today. So, net dip in Rakesh Jhunjhunwala's net worth is ₹56 crore ( ₹14.30 x 3,91,53,600). Therefore, Rakesh Jhunjhunwala lost around ₹900 crore in 15 minutes of market opening after sell-off in Titan Company, Star Health and Metro Brands shares."
Updated: 10 Jun 2022,"₹4 to ₹2138: Rakesh Jhunjhunwala stock gives 53,000% return in 20 years",https://www.livemint.com/market/stock-market-news/rs-4-to-rs-2140-multibagger-rakesh-jhunjhunwala-portfolio-stock-titan-company-gives-53-000-return-in-20-years-11654823488064.html,"Rakesh Jhunjhunwala portfolio: Money is not in buying and selling of stocks but in hold. According to market magnet Warren Buffett, one should buy and hold a stock as long as one can. To understand the benefit of this stock market investment strategy, one needs to look at Rakesh Jhunjhunwala-backed Titan Company shares. In last 20 years, Titan share price has shot up from ₹4.03 (close price on 12th June 2002 on NSE) to ₹2138 levels today, ascending to the tune of near 53,000 per cent in the last two decades. Titan share price history This Tata group stock has remained sideways with negative bias throughout 2022. In YTD time, it shed near 15 per cent, which looks obvious after the recent stock market sell-off post-Russia-Ukraine war. In last one year, this Rakesh Jhunjhunwala stock has surged from ₹1738 to ₹2138, appreciating to the tune of 23 per cent in this period. In last 5 years, this Rakesh Jhunjhunwala portfolio stock has delivered multibagger return to its shareholders. This multibagger stock has surged from ₹516 to ₹2138 levels in last 5 years, delivering whopping 315 per cent return to its shareholders. Likewise in last 10 years, Titan share price has ascended from around ₹221 to ₹2138 apiece levels, logging around 870 per cent risen in last one decade. Similarly, in last 20 years, this multibagger stock has ascended from ₹4.03 to ₹2138 levels, surging around 530 times in the last two decades time. ₹10,000 would have turned to ₹53 lakh in 20 years Taking cue from Titan share price history, if an investor had invested ₹10,000 in this Rakesh Jhunjhunwala stock 5 years ago, its ₹10,000 would have tuned to ₹41,500 today. If an investor had invested ₹10,000 in this stock 10 years ago and had remained invested in this multibagger stock throughout this period, its ₹10,000 would have turned to ₹97,000 today. Similarly, if an investor had invested ₹10,000 in this multibagger Rakesh Jhunjhunwala stock 20 years ago, its ₹10,000 would have turned to ₹53 lakh today. Rakesh Jhunjhunwala share holding in Titan Company According to Titan Company's shareholding pattern for Q4FY22, Rakesh Jhunjhunwala and his wife Rekha Jhunjhunwala have investments in this Tata group company. Rakesh Jhunjhunwala owns 3,53,10,395 shares or 3.98 per cent stake in the company whereas his wife Rekha Jhunjhunwala holds 95,40,575 shares, which is 1.07 per cent of total paid-up capital of the company. So, Jhunjhunwala couple holds 5.05 per cent stake in Titan Company."
Updated: 19 May 2022,Rakesh Jhunjhunwala's this Tata stock is a hot pick. 4 key trigger points,https://www.livemint.com/market/stock-market-news/rakesh-jhunjhunwala-s-this-tata-stock-is-a-hot-pick-4-trigger-points-for-future-performance-11652959427028.html,"Big Bull, Rakesh Jhunjhunwala is known for making notable gains from a diversified pool of stocks that he holds. In his portfolio, Jhunjhunwala's majority of assets in value terms is in Tata Group-backed Titan Company. In the gems and jewellery sector, Titan is seen to hold a significant position and its growth outlook remains strong. Due to high growth visibility in earnings, Titan stock has the potential for robust upside going forward. Jhunjhunwala who is often referred to as the 'Warren Buffet of India' have stayed with Titan shares since 2015. He has modified his shareholding in Titan on numerous occasions since then. As of March 31, 2022, Rakesh holds 35,310,395 equity shares or 3.98% in Titan, while his wife Rekha Jhunjhunwala holds 9,540,575 equity shares or 1.07% in the company. Rakesh manages his and his wife's portfolio. Together, the couple holds 44,850,970 equity shares or 5.05%. On Wednesday, Titan shares corrected tracking a broader bearish markets tone, and also stayed on the downside. On BSE, the shares closed at ₹2110.80 apiece down by 2.57%. Despite the dive in today's market price, Titan still has given nearly double-digit returns in percentage terms to its investors in a year. On Dalal Street, Titan shares have skyrocketed by nearly 39% in a year. On May 19 last year, Titan shares stood at ₹1521.85 apiece. As per Trendlyne data, as of today, Jhunjhunwala's total portfolio values to around ₹28,767.48 crore. Of which, his holding values to ₹9,599 crore in just Titan - making it the most valued stock in his portfolio. Analysts are optimistic about Titan stock ahead due to its robust balance sheet and strong market presence. On Titan's upside ahead, Jhunjhunwala too will add notable gains in his portfolio. Despite disruptions in Q1 and as well as Q4, Titan managed to deliver a solid all-around performance for the financial year FY22. The company's total income for FY22 was at ₹26,411 crore, registering a growth of 36% compared to ₹19,426 crore in FY21 (excluding bullion sales). Titan posted a profit of ₹2,983 crore (before taxes and exceptional items) for the fiscal year in comparison to, ₹1,370 crore in FY21, a growth of 118%. For the fourth quarter of FY22, Titan stated that Q4 FY22 ended with a satisfactory performance despite partial lockdowns, volatility in gold prices, and uncertainty in a fragile geopolitical situation. Why Titan is a hot pick Bharat Chhoda and Cheragh Sidhwa Research Analysts at ICICI Direct in their note said that Titan has been an exceptional performer in the discretionary space with stock price appreciating at ~36% CAGR in the last five years. In the analyst meet, ICICI Direct analysts cited that Titan's management listed out growth pillars for its core business (jewellery & watches) and emerging concepts (ethnic, wearables and international business). It expects to grow jewellery revenues by 2.5x by FY27 (implied CAGR: 20%). Huge headroom for growth with a current market share less than 6% in ₹4 lakh crore market. Further, the management targets high growth for wearable categories (~6x) with the ambition to grow the watches division to ₹10,000 crore in FY26 with 18% EBIT margins. Also, they believe the new initiative to achieve sizeable revenues by FY27 ( ₹1000+ crore). In Q4FY22, the company's Jewellery business registered an income of ₹6,132 crore compared to ₹6,397 crore in Q4 FY21 (excluding bullion sale), a decline of 4%. Watches & Wearables business reported an income of ₹622 crore with 12% growth in Q4 FY22 compared to ₹555 crore in Q4 FY21. EyeCare business reported an income of ₹134 crore with 6% growth in Q4 FY22 compared to ₹127 crore in Q4 FY21. Other businesses comprising of Indian dress wear and Fragrances & Fashion accessories reported an income of ₹42 crore in Q4 FY22 compared to ₹35 crore in Q4 FY21, a growth of 20%. On future outlook, CK Venkataraman, Managing Director of Titan in the financial audit report had stated, ""The Company is well prepared and looking forward to an exciting Q1 with all its stores ramped up for a much-awaited Akshaya Tritiya festival this year. With the international expansion in GCC markets and the first Tanishq store coming up in the US, we are gearing up to touch new horizons in FY23."" ""We continue to remain structurally positive on the stock as high growth visibility justifies premium valuations and maintain a BUY on the stock,"" the duo said. The analysts highlighted four triggers for future price performance in Titan. These are: 1. Robust balance sheet and asset-light distribution model has enabled it to outpace peers in terms of store addition (to add 40+ Tanishq stores and 100+ watches store in FY23). 2. Tanishq’s penetration is still at a very nascent stage in the Indian jewellery market (< 6% market share). This provides immense opportunity for Titan to enhance its market share. Mandatory gold hallmarking would further enhance market share gains from unorganised space. 3. Thrust on wedding space is bearing fruit with wedding jewellery becoming a critical growth driver while its share in overall jewellery revenue has increased meaningfully. 4. ICICI Direct analysts bake in revenue, earnings CAGR of 20%, 30%, respectively, in FY22-24E. Thereby, the analysts mentioned above have set a Buy recommendation with a target price of ₹2725 i.e. 66x FY24E EPS."
Updated: 07 May 2022,Rakesh Jhunjhunwala earns ₹70 crore from dividend announced by these 3 stocks,https://www.livemint.com/market/stock-market-news/rakesh-jhunjhunwala-earns-rs-70-crore-from-dividend-announced-by-these-3-dividend-paying-stocks-11651907503085.html,"Rakesh Jhunjhunwala portfolio: A stock market investor not just gain from the rise in one's portfolio stocks but from the dividends announced by the company as well. Recently, three Rakesh Jhunjhunwala stocks — Titan Company, Canara Bank and Federal Bank, have announced dividend for their respective shareholders. As per the exchange communications by these three Rakesh Jhunjhunwala portfolio stocks, Titan Company has announced dividend of ₹7.5 per share, Canara Bank has announced dividend of ₹6.50 per share whereas Federal Bank has announced ₹1.80 dividend per share for its respective shareholders.  From this announcement by these three dividend paying stocks, Rakesh Jhunjhunwala's net worth would grow by around ₹70 crore. Rakesh Jhunjhunwala shareholding As per Titan Company's shareholding pattern for Q4FY22, Rakesh Jhunjhunwala and his wife Rekha Jhunjhunwala have shareholding in this Tata group company. Rakesh Jhunjhunwala holds 3,53,10,395 Titan shares, which is around 3.98 per cent of total paid-up capital of Titan Company. His wife Rekha Jhunjhunwala holds 95,40,575 Titan shares, which is around 1.07 per cent of total paid-up capital of the Tata group company. So, Jhunjhunwala couple holds 4,48,50,970 Titan shares or 5.05 per cent stake in the company. As per Federal Bank shareholding pattern for January to March 2022 quarter, Rakesh Jhunjhunwala and his wife Rekha Jhunjhunwala holds 7,57,21,060 Federal Bank shares or 3.65 per cent stake in the south Indian bank. Similarly, according to Canara Bank's shareholding pattern for recently ended March 2022 quarter, Big Bull holds 3,55,97,400 Canara Bank shares or 1.96 per cent stake in the public sector bank Rise in Rakesh Jhunjhunwala's net worth As Big Bull and his wife Rekha Jhunjhunwala hold 4,48,50,970 Titan shares and Titan Company has announced ₹7.50 dividend for each shares, rise in Rakesh Jhunjhunwala's net worth after this dividend announcement is around ₹34 crore. Similarly, Rakesh Jhunjhunwala and his wife Rekha Jhunjhunwala hold 7,57,21,060 Federal Bank shares and the south India bank has announced ₹1.80 dividend per share, rise in Rakesh Jhunjhunwala's net worth would be around ₹13 crore. Likewise, as Big Bull holds 3,55,97,400 Canara Bank shares and the PSU bank has announced ₹6.50 dividend per share, rise in Rakesh Jhunjhunwala's net worth after the dividend announcement by Canara Bank falls around ₹23 crore. So, net rise in Rakesh Jhunjhunwala's net worth after dividend announcement by these Rakesh Jhunjhunwala portfolio stocks is around ₹70 crore ( ₹34 crore + ₹13 crore + ₹23 crore)."
Updated: 06 May 2022,₹1185 crore wiped off Rakesh Jhunjhunwala portfolio after dip in this stock,https://www.livemint.com/market/stock-market-news/rakesh-jhunjhunwala-bleeds-rs-1185-crore-this-year-after-dip-in-this-tata-stock-11651807082292.html,"Rakesh Jhunjhunwala portfolio: Titan Company is one of the favourite stocks of Big Bull Rakesh Jhunjhunwala. However, the 'Warren Buffett of India' dropped a surprise when he trimmed his stake in this flagship Tata group company from 5.09 per cent to 5.05 per cent in January to March 2022 quarter. But, if we look at Titan share price history then ace investor's decision would look correct. Titan share price in year-to-date time i.e. in 2022 has tumbled by near ₹264 per share leading to around ₹1185 crore loss in Rakesh Jhunjhunwala's net worth in 2022. Titan share price history As mentioned above, in YTD time, Titan shares have dipped from around ₹2524 apiece levels to ₹2260 mark, losing near ₹264 apiece. In fact, this Rakesh Jhunjhunwala stocks has been under consolidation phase for around 6 months. In last 6 months, this Tata stock has delivered zero return as it dipped more than 10 per cent in this period. Rakesh Jhunjhunwala shareholding in Titan Company As per Titan Company's shareholding pattern for January to March 2022 quarter, Rakesh Jhunjhunwala and his wife Rekha Jhunjhunwala have stake in this flagship Tata group company. Rakesh Jhunjhunwala holds 3,53,10,395 Titan shares or 3.98 per cent stake in the company. Big Bull's wife Rekha Jhunjhunwala holds 95,40,575 Titan shares or near 1.07 per cent of total paid-up capital of the company. So, Jhunjhunwala couple holds 4,48,50,970 shares or 5.05 per cent stake in this Tata company. Impact on Rakesh Jhunjhunwala's net worth As Rakesh Jhunjhunwala and his wife holds 4,48,50,970 Titan shares and the stock has dipped to the tune of ₹264 in 2022, net loss to Rakesh Jhunjhunwala's net worth in 2022 due to Titan share price dip is around ₹1185 crore ( ₹264 x 4,48,50,9700)."
Updated: 05 May 2022,Rakesh Jhunjhunwala earns ₹34-cr from dividend announced by this Tata company,https://www.livemint.com/market/rakesh-jhunjhunwala-net-worth-grows-rs-34-cr-from-dividend-announced-by-this-tata-company-11651727242168.html,"Rakesh Jhunjhunwala portfolio stock Titan Company has announced ₹7.50 per share dividend to its investors. The Tata group company made this announcement despite 7 per cent fall in its net profit in Q4FY22. Titan company made the announcement in regard to dividend through exchange communication in which it said that the Board of Directors of the Company at its meeting held on 3rd May 2022 has recommended a dividend of ₹7.50 per equity share. After the announcement of ₹7.50 dividend per share, Big Bull Rakesh Jhunjhunwala's net worth and his wife Rekha Jhunjhunwala's net worth is expected to grow by around ₹34 crore. Rakesh Jhunjhunwala shareholding in Titan Company As per Titan Company shareholding pattern for January to March 2022 period, Big Bull and his wife Rekha Jhunjhunwala have shareholding in this Tata company. Rakesh Jhunjhunwala holds 3,53,10,395 Titan shares, which is around 3.98 per cent of total paid-up capital of Titan Company. His wife Rekha Jhunjhunwala holds 95,40,575 Titan shares, which is around 1.07 per cent of total paid-up capital of the Tata group company. Jump in Rakesh Jhunjhunwala net worth As Rakesh Jhunjhunwala holds 3,53,10,395 Titan shares and the jewelry company has announced ₹7.50 dividend for one share, net rise in Rakesh Jhunjhunwala net worth would be around ₹26.50 crore ( ₹7.5 x 3,53,10,395). Similarly, his wife Rekha Jhunjhunwala holds 95,40,575 Titan Company shares and Dividend announced is ₹7.50 per share. Thus, Rekha Jhunjhunwala net worth is expected to grow by around ₹7.15 crore ( ₹7.50 x 95,40,575). So, the Jhunjhunwala couple earned around ₹34 crore from the dividend announced by this Tata company. Titan Company has announced ₹7.50 per share dividend through exchange communication citing, ""Titan Company Ltd has informed BSE that the Board of Directors of the Company at its meeting held on May 03, 2022, inter alia, has recommended a Dividend of Rs. 7.50 per Equity Share of Rs. 1 each of the Company which shall be paid/dispatched on or after the seventh day from the conclusion of the 38th Annual General Meeting subject to the approval of the shareholders of the Company. Pursuant to the Finance Act, 2020, with effect from April 01, 2020, Dividend Distribution Tax is abolished and dividend income is taxable in the hands of the shareholders. In view of the same, the dividend payments will be subject to deduction of tax at source, as may be applicable."""
Updated: 30 Apr 2022,Sebi imposes penalty on Titan’s employees for non-compliance of PIT regulations,https://www.livemint.com/market/sebi-imposes-penalty-on-titan-s-employees-for-non-compliance-of-pit-regulations-11651317495001.html,"MUMBAI : The Securities and Exchange Board of India (Sebi) has imposed a penalty of ₹1 lakh each on six employees of Titan Company Ltd for non-compliance of the market regulator's Prohibition of Insider Trading (PIT) regulations. According to Sebi’s order, the six employees of Titan include Siva Kumar C, Hamendra Sharma, Chandrakant Kalauni, Mathalai Manikandan, Sarath Kumar Mulugu, and Mahesh S. The case pertains to the period 2018-19, as per Sebi’s order. This comes after the company informed Sebi about the contravention of Sebi’s PIT, regulations and company’s code of conduct for prevention of insider trading by its employees. Following which the markets regulator carried out an investigation in the stock of Titan, wherein it witnessed several non-compliances of its PIT Regulations during the period 1 April, 2018 to 31 March, 2019. Sebi found that, on multiple occasions, the total value traded in securities by all the mentioned six employees exceeded ₹10 Lakhs. For which the employees did not make any disclosures as per the company’s code of conduct. As per Sebi’s section 7 (2)PIT Regulations, it is clearly mandated that every promoter, employee and director of every company shall disclose to the company the number of such securities acquired or disposed of within two trading days of such transaction if the value of the securities traded, whether in one transaction or a series of transactions over any calendar quarter, aggregates to a traded value in excess of ten lakh rupees or such other value as may be specified. However, even the company confirmed that no such disclosures were made by these 6 employees. Sebi noted “In terms of Regulation 7(2)(a) of PIT Regulations, being employees of the company, they were required to make disclosures to Titan, for each of the transactions within 2 working days. However, there is no evidence available on record to show that employees had made any disclosures in terms of the aforesaid regulation for the aforesaid transactions"". Sebi has directed the employees to pay the penalty amount of ₹1 lakh each within 45 days."
Updated: 22 Apr 2022,This Rakesh Jhunjhunwala stock doubles shareholders' money every 4 years,https://www.livemint.com/market/stock-market-news/this-rakesh-jhunjhunwala-stock-titan-company-doubles-shareholders-money-every-4-years-11650589058852.html,"Rakesh Jhunjhunwala portfolio is closely followed by retail investors as single change in ace investor's portfolio works as major Rakesh Jhunjhunwala tips for them. Out of near 3 dozen stocks hold by the ""Warren Buffett of India,"" there are some particular convictions that works as major reason for Big Bull to remain invested in these stocks. Titan Company shares are one such stock, which has been doubling shareholders' money since 2009. So, those retail investors and market observers who want to know the reason for this Tata stock being one of the favourite stocks of Rakesh Jhunjhunwala, this can be an interesting fact for them. Titan share price history This Rakesh Jhunjhunwala portfolio stock has been giving stellar return to its shareholders since 2009. In April 2009, Titan share price was around ₹40 apiece levels that went up to around ₹300 levels in April 2013. In October 2017, Titan Company share price went further up to ₹600 per share levels, which further shot up northward at around ₹1460 per share levels in April 2021. Hence, this Tata group share in Rakesh Jhunjhunwala portfolio has been giving multibagger return to its shareholders after every four years since 2009. Rakesh Jhunjhunwala holding in Titan Company As per shareholding pattern of Titan company for recently ended March 2022 quarter, Rakesh Jhunjhunwala and his wife Rekha Jhunjhunwala have shareholding in this Tata group company. Rakesh Jhunjhunwala holds 3,53,10,395 Titan shares or 3.98 per cent stake in the company whereas Rekha Jhunjhunwala owns 95,40,575 Titan Company shares or 1.07 per cent stake in the company."
