article_time,article_title,article_link,article_content
Updated: 09 Jul 2022,3 bluechip stocks to BUY as suggested by Sharekhan,https://www.livemint.com/market/stock-market-news/3-bluechip-stocks-to-buy-as-suggested-by-sharekhan-11657363784346.html,"The shares of Titan Company, TCS, and Mahindra & Mahindra Ltd. have been given a buy call rating by the brokerage company Sharekhan. Since the brokerage has set a target price of Rs. 2,900 for Titan, Rs. 3,650 for Tata Consultancy Services Ltd., and Rs. 1,390 for Mahindra and Mahindra Ltd (M&M), all of these blue-chip stocks offer tremendous potential upside from the current market price.  Sharekhan has said in a note that “Titan Company Limited’s (Titan) pre-quarter update outlined a good start to FY2023 with strong growth of 3.0x in revenue and robust growth across key businesses and subsidiaries. We expect revenue to be at Rs. 9,180 crore at a consolidated level (and ~Rs. 8,650 crore at a standalone level). Revenue of the jewellery business (excluding bullion sales in the base quarter) grew by 3x y-o-y i.e. to ~Rs. 7,570 crore. Despite near-term headwinds of high inflation, the company is confident of maintaining good growth momentum in the quarters ahead because of market share gains, network expansion, and shift to trusted brands. The company aims to achieve consistent double-digit revenue growth over the next five years by strengthening core businesses such as watches, jewellery, and eyecare through efficient capital allocation plans. Further, profitability is expected to consistently improve with consistent growth in the jewellery business and scale-up in new ventures."" “Titan is aiming to generate revenue CAGR of over 20% revenue during FY2022-FY2027 on back of its ambitious growth plan in the medium term. This along with consistent margin improvement will help cash flows to improve strongly in the coming years. FY2023 will be a strong year for the company due to low base in core businesses. The stock has corrected by ~15% in the past three months, in-line with substantial correction in the broader indices. The company’s strong growth outlook, industry tailwinds in the medium term, and strong balance sheet make it a best play in the retail space. Hence, we maintain our Buy recommendation on the stock with an unchanged price target (PT) of Rs. 2,900,"" said the brokerage.  The brokerage has said that “TCS reported steady revenue growth with strong client addition across large revenue buckets and healthy deal wins, while margins lagged our expectations owing to wage revisions, supply-side challenges and rising discretionary expenses. Constant currency (CC) revenue grew by 3.5%/15.5% y-o-y in Q1FY2023, in-line with our estimates, led by continued strong growth in North America and broad-based growth across verticals with strong growth in Retail & CPG. Deal TCVs remained healthy at $8.2 billion (including two large deals worth of $400 million+) during Q1FY23, up by 1.2% y-o-y, but it was down 27% q-o-q. The book-to-bill ratio stood at 1.21x, in-line with its long term average book-to-bill ratio. EBIT margin declined by 190 bps q-o-q to 23.1%, lagged our estimates. TCS continues see strong traction across cloud adoption, operating model transformation, vendor consolidation, growth and transformation (G&T) programs. We believe the company is well positioned to gain most from market opportunities even in case deteriorating macro concerns given its strong marquee clientele, strong capabilities and solid execution capability."" “We believe that TCS has a robust business model which would leverage both G&T opportunities and operation transformation program given its strong capabilities and end-to-end service capabilities. We expect the company’s US Dollar revenues and earnings to clock a 10%/11% CAGR over FY2022-24E. At CMP, the stock trades at valuation of 28x/25x its FY2023E/FY2024E earnings, in-line with 5-year average 1-year forward PE multiple. We continue to prefer TCS considering its better supply-management capability, best-in-class execution, deep expertise, full-service model and excellent payout ratios. Further, the stock price correction of around 14% on a YTD basis offers good entry opportunity for long-term investment. Hence, we maintain a Buy on TCS with a revised PT of Rs. 3,650,"" said Sharekhan.  As per the brokerage “Mahindra and Mahindra Ltd (M&M) and British International Investment (BII) have executed a binding agreement to invest Rs. 1,925 crore ($250 million) each into M&M’s wholly owned subsidiary that will be incorporated soon to spin its passenger electric vehicle (EVCo) business. BII is a UK government development finance institution and a leading impact investor with focus on climate change and ESG. BII is expected to acquire 2.75-4.76% stake in M&M’s subsidiary EVCo at a valuation of US$ 5.1-8.8 billion (Rs. 40,441-70,070 crore). Promoters, along with investors to infuse ~Rs. 10,000 crore in the new EVCo between FY22 to FY27, to launch five electric vehicle models. The company targets its Electric SUV penetration to be 20-30% of its overall SUV portfolio by FY2027 and expects EV volumes at ~200,000 per annum in best case scenario. The EVCo will be asset light and leverage M&M’s ecosystem of suppliers, dealers and financers."" “M&M will provide manufacturing support, design, product development, technology and sourcing services on arm’s length. We firmly believe that M&M is on track with its growth roadmap. Besides its aggressive plans for the farm equipment and ICE passenger car segments, the company is taking leap towards making strong product portfolio for passenger electric vehicles. In the ICE segment, M&M has become No.1 in SUV revenue market share in H2FY22 with 16.8% market share. We expect Scorpio-N to further consolidate its share in the SUV market. Successful new launches will continue to help M&M to increase its market share in the SUV and LCV segments. M&M has guided for strengthening of the SUV segment through product launches of 13 new products by FY2027E, including EV launches. Further, the management continues to focus on the farm equipment segment and maintained its guidance to achieve a 10x revenue growth by FY2027E. M&M has maintained its FY25E guidance to deliver an 18% RoE and 15-20% EPS growth,"" said Sharekhan. The brokerage has further claimed that “We expect M&M to benefit from its leadership status in the tractor segment, strengthening position in the LCV segment and regaining its market share in the highly competitive SUV segment. M&M is on track with its growth roadmap. The company plans its farm business to grow 10x by FY2027E, while strengthen its SUV segment by adding 13 new products by FY2027E, including EV launches. The investment commitment of US$ 250 million by impact investor, British International Investment (BII), in M&M’s passenger electric vehicle arm is a positive development and would help M&M in attracting additional sources of private capital into EVCo venture. The EVCo business add Rs. 132 per share to our SOTP based PT. Further, M&M continues to benefit from the turnaround of loss-making subsidiaries, scaling up of digital platforms and strong performance of its listed entities, which would improve the company’s FCF going forward. We expect standalone earnings to post a 22.5% CAGR during FY22-FY24E, driven by a 16.7% revenue CAGR and 190 bps rise in EBITDA margins. We reiterate Buy rating on the stock with a revised PT of Rs. 1,390. The stock trades at a P/E multiple of 17.6x and EV/EBITDA multiple of 11x its FY24E estimates."" The views and recommendations made above are those of individual analysts or broking companies, and not of Mint."
Updated: 08 Jul 2022,Tata group share turns ex-dividend stock today. Key things you should know,https://www.livemint.com/market/stock-market-news/tata-group-share-titan-company-turns-ex-dividend-stock-today-key-things-you-should-know-11657262386798.html,"Dividend paying stock: One of the flagship Tata group companies, Titan Company has turned ex-dividend stock today. The board of directors of the jewelry brand has recommended dividend ₹7.50 per equity share for the financial year 2021-22. The record date for payment of dividend has been fixed on 11th July 2022. As stock market remains closed on Saturday and Sunday, leading fashion stock turned ex-dividend on Friday session. Company will pay this dividend after the 38th Annual General Meeting of the company, which is scheduled on 26th July 2022. Informing Indian exchanges about the recommendation of dividend payment, Titan Company's exchange communication says, ""Titan Company Ltd has informed BSE that the Board of Directors of the Company at its meeting held on May 03, 2022, inter alia, has recommended a Dividend of Rs. 7.50 per Equity Share of Rs. 1 each of the Company which shall be paid/dispatched on or after the seventh day from the conclusion of the 38th Annual General Meeting subject to the approval of the shareholders of the Company."" Later in other exchange communication, the Tata group company said that 38th AGM of the company will take place on 26th July 2022 citing, ""Pursuant to Regulation 30 read with paragraph A of Part A of Schedule III of the SEBI (Listing Obligations & Disclosure Requirements) Regulations, 2015 (Listing Regulations), attached herewith is the Notice and the Explanatory Statement of the 3 8th Annual General Meeting of the Company to be held on Tuesday, 26th July 2022 at 10.30 a.m. (1ST) via two-way Video Conference/ Other Audio Visual Means. The said Notice forms part of the Annual Report 2021-22 and is being sent through electronic mode to the shareholders of the Company."" Here we list out key details in regard to Tian Company's dividend for the financial year 2021-22: 1] Titan Company dividend 2022: Tata group company has announced a dividend of ₹7.50 per equity share. 2] Titan Company dividend record date: The board of directors of the fashion brand has fixed 11th July 2022 as record date for finalising eligible shareholders for dividend payment. 3] Dividend payment: This ₹7.50 dividend shall be paid/dispatched on or after the seventh day from the conclusion of the 38th Annual General Meeting. 4] 38th AGM date: The board members and shareholders are going to approve this dividend recommendation in company's 38th AGM scheduled on 26th July 2022. As per the Q1FY23 numbers, the dividend paying company recorded a whopping 205 per cent jump in sales compared to the corresponding period last year. However, this jump is sales can be attributed to the low base. Apart from this, the Tata group company registered a 3-year CAGR of 20.5 per cent over Q1FY20, the only non-disrupted first quarter in the last 3 years."
Updated: 07 Jul 2022,Rakesh Jhunjhunwala portfolio: Brokerage says to buy this Tata group stock,https://www.livemint.com/market/stock-market-news/rakesh-jhunjhunwala-portfolio-brokerage-says-to-buy-this-tata-group-stock-11657200198512.html,"With a market valuation of ₹188,876 crore, Titan Company Limited is a large-cap company that operates in the gem and jewellery industry. Being a TATA product, Titan is the largest and most reputable brand in India for accessories including jewellery, watches, and eyeglasses. When compared to the same period the previous year, Titan Company's first quarter ended in June 2022 (Q1FY23) sales increased by an astounding 205 per cent. Additionally, Titan's 3-year CAGR over Q1FY20 reached 20.5 per cent. As a result, brokerage firm Emkay Global is bullish on the stock and has given it a buy recommendation with a target price of ₹2,530.  Commenting on the performance of the company, Emkay Global has said in a note that excluding bullion sales, Jewelry revenues almost tripled YoY, led by growth in the number of buyers/walk-ins. The avg. ticket size remained stable. On a 3-Yr CAGR basis, growth in the jewelry segment accelerated to 23% in Q1 vs. 18-21% in the previous three quarters. TITAN attributed the strong trends to uninterrupted operations, the regionalization strategy and strong traction during the Akshay Tritya festival in May’22. The studded mix improved slightly from the previous year and was back to pre-Covid levels (~25%) in Q1. Tanishq’s network was expanded by 7 stores, including one in Dubai. “Watches/Eyewear posted a slower 3-Yr CAGR of 2%/8%, helped by a 6%/12% store count CAGR. Encouragingly, wearables growth quintupled on a low base, and the momentum remains intact in the second half. Store additions, however, have been particularly strong in both Eyewear/Watch segments, with 56/39 new store additions in Q1. The pick-up in store additions is encouraging and in line with Titan’s expansion outlook for these categories,"" said the research analysts of Emkay Global. As per the brokerage, TITAN Company’s “Caratlane maintained its strong growth trajectory with a 3-year CAGR of ~55%. Growth has been driven by a ~30% store count CAGR, launch of new merchandise, marketing campaigns and unlocking of markets. Other businesses (Taneira, Fragrances and Accessories) grew 29%, aided by high operational stores and new launches. TEAL’s revenue performance remained flat on a 3-year basis."" “Titan accelerated network expansion with the addition of 125 net stores across segments (vs. ~100 in Q3/Q4FY22), with 39/56 additions in watches and eyewear segments. In our view, a strong Q1 should drive an upgrade to consensus estimates. However, we do not see material changes to our estimates given near-term volatilities due to a recent customs duty increase and higher inflation. We currently have a Buy rating on TITAN with a TP of Rs2,530 (51x Jun’24E EPS),"" said Emkay Global. Rakesh Jhunjhunwala holds 3,53,10,395 Titan shares, or 3.98 per cent of the company, according to the Titan Company shareholding pattern for Q4FY22, which is publicly accessible on the BSE, while his wife Rekha Jhunjhunwala owns 95,40,575 shares or 1.07 per cent of the company's total paid-up capital. The Jhunjhunwala family jointly holds 4,48,50,970 shares in Titan. The Q1FY23 shareholding pattern is yet to come.  The views and recommendations made above are those of individual analysts or broking companies, and not of Mint."
Updated: 07 Jul 2022,7 stocks to turn ex-dividend tomorrow: Check if you own any,https://www.livemint.com/market/stock-market-news/7-stocks-to-turn-ex-dividend-tomorrow-check-if-you-own-any-11657197933666.html,"Investors interested in dividend stocks should pay close attention to the shares of Pressman Advertising, Jubilant FoodWorks, Sundaram Finance, Onward Technologies, Titan Company Limited, Lumax Auto Technologies Limited, and Lumax Industries Limited as they will go ex-dividend tomorrow. All of these companies have set 11th July as the record date to determine the eligibility of the shareholders for the purpose of dividend. As the market will remain closed on Saturday and Sunday, the ex-dividend date for the stocks is falling tomorrow on 8th July 2022 which means that the stocks will trade tomorrow without the amount of the upcoming dividend payment.   Pressman Advertising has announced a 50.00 per cent equity dividend at a face value of ₹2, or ₹1 per share, for the fiscal year ending March 2022. The dividend yield at the present share price of ₹40.45 is 2.47 per cent. As per the BSE exchange filing “The Company has fixed Monday, July 11, 2022 as the 'Record Date' for determining entitlement of Members to final dividend for the financial year ended March 31, 2022. The final dividend, if approved by the Members at the AGM, will be paid subject to deduction of tax at source."" The stock gained 3.98 per cent from its previous close of Rs. 38.90 and closed today at Rs. 40.45. The stock has climbed 20.57 per cent year-to-date (YTD) in 2022 so far.  On 17th June 2022, the company informed BSE by saying that “Pursuant to the Regulation 42 of Listing Regulations, the Company has fixed Monday, July 11, 2022 as the Record Date for the purpose of determining the names of Members eligible for Dividend of ₹1.20/- (i.e. 60%) per equity share of face value of Rs. 2/- each for the Financial Year 2021-22."" Jubilant FoodWorks shares closed today at ₹570.85 level apiece, up by 1.40% from its previous close of ₹562.95. In the year 2022, the stock has fallen 21.89% so far according to YTD data.  The company has said in stock exchange filings that “The Board of Directors has recommended a final dividend of ₹10/-per share (100%) for the financial year ended 31st March 2022, on the paid-up capital of ₹111.10 cr. This, together with the interim dividend of ₹10/-per share (100%) paid on 4th March 2022 will make a total dividend of ₹20/-per share (200%) for the financial year ended 31st March 2022. The dividend, if approved by the shareholders, will be paid on or after 28th July 2022 to those shareholders whose names stand on the Register of Members of the Company as on 11th July 2022."" The shares of Sundaram Finance closed today at ₹1,879 a piece, up by 2.70% from its previous close. On a YTD basis, the stock has fallen 23.67% so far in 2022.  Onward Technologies has announced a 30.00 per cent equity dividend at a face value of ₹10, or ₹3 per share, for the fiscal year that ended March 2022. The dividend yield at the current share price of ₹286 is 1.04 per cent. For the purpose of dividend, the company has said in BSE exchange filing that “The Members who hold shares as on the record date i.e. Monday, July 11, 2022 shall be entitled for dividend subject to the approval of the Members in 31st AGM and voting (including remote e- voting) for the AGM."" The shares of Onward Technologies closed today at ₹286 level, up by 2.90% from its previous close of ₹277.95.  The company has informed stock exchanges by saying that “The Board has recommended a Dividend of ₹7.50 per Equity Share of ₹1 each of the Company which shall be paid/dispatched on or after the seventh day from the conclusion of the 38th Annual General Meeting subject to the approval of the shareholders of the Company."" The company has fixed 11th July as the record date and hence the stock shall turn ex-dividend tomorrow. The stock closed on the NSE at ₹2,129.95 level today, up by 5.78% from its previous close of ₹2013.55.  Lumax Auto Technologies has announced a 175.00% equity dividend at a face value of ₹2, or ₹3.5 per share, for the fiscal year that ended March 2022. The dividend yield at the current share price of ₹205.80 is 1.70 per cent. As per the BSE exchange filing “The Company has fixed Friday, July 15, 2022 as the ""Cut-off Date/Record Date"" for the purpose of determining the members eligible to vote on the resolution(s) as set out in the Notice of the AGM or to attend the AGM and Further, Monday, July 11, 2022 has been fixed for ascertaining shareholders eligible for payment of Dividend for the Financial Year 2021-22."" The stock closed today at ₹205.80 up by 9.24% from its previous close of ₹188.40. YTD, the stock has surged 27.19% so far in 2022.  For the fiscal year that concluded in March 2022, Lumax Industries Limited has announced an equity dividend of ₹13.5 per share. At the present share price of ₹1390, the dividend yield is 0.97 per cent. “The Company has fixed Friday, July 15, 2022 as the ""Cut-off Date/Record Date"" for the purpose of determining the members eligible to vote on the resolution(s) set out in the Notice of the AGM or to attend the AGM and Monday, July 11, 2022 for ascertaining the list of shareholders eligible for Dividend for the Financial Year 2021-22,"" the company has said in BSE filing. The stock closed at ₹1,390 up by 0.98% from its previous close. YTD, the stock has surged 16.87% so far in 2022."
Updated: 02 Jul 2022,Rakesh Jhunjhunwala's net worth dips ₹1000 crore this week in these two stocks,https://www.livemint.com/market/stock-market-news/rakesh-jhunjhunwala-s-net-worth-dips-rs-1000-crore-this-week-in-these-two-stocks-titan-company-star-health-11656747982927.html,"Rakesh Jhunjhunwala portfolio: Amid fear of soaring inflation and looming slowdown concerns, Indian stocks witnessed heavy beating last week. The sell-off triggered in some quality stocks as well. Despite backing from ace investor Rakesh Jhunjhunwala, shares of Titan Company and Star Health and Allied Insurance Company were hit badly this week. Due to heavy sell-off in these Rakesh Jhunjhunwala stocks, Big Bull lost over ₹1,000 crore in 5 sessions last week. Dip in Rakesh Jhunjhunwala portfolio stocks In 5 trade sessions last week, Titan share price slide from ₹2,053.50 to ₹1,944.75 apiece levels, recording ₹108.75 per share dip in last week trade. Similarly, other Rakesh Jhunjhunwala stock Star Health share price slipped from ₹531.10 to ₹475.90 apiece levels, logging ₹55.20 per share dip last week. Rakesh Jhunjhunwala shareholding According to Titan Company for January to March 2022 period, Rakesh Jhunjhunwala holds 3,53,10,395 shares while his wife Rekha Jhunjhunwala owns 95,40,575 Titan shares. So, Jhunjhunwala couple together owns 4,48,50,970 Titan shares. Similarly, Rakesh Jhunjhunwala holds 10,07,53,935 Star Health shares. Dip in Rakesh Jhunjhunwala's net worth As Rakesh Jhunjhunwala and his wife Rekha Jhunjhunwala holds 4,48,50,970 Titan shares that dipped ₹108.75 per share last week, dip is Rakesh Jhunjhunwala's net worth due to Titan share tumble is around ₹485 crore. Similarly, Rakesh Jhunjhunwala holds 10,07,53,935 Star Health shares that dipped ₹55.20 per share last week. Hence, net loss in Rakesh Jhunjhunwala's portfolio due to dip in Star Health shares last week is around ₹555 crore. So, exact dip in Rakesh Jhunjhunwala's net worth due to slide in Titan share price and Star Health shares last week is more than ₹1,000 crore (or around ₹1,040 crore). Shares of Tata Motors, Indian Hotels Company, Rallis India, National Aluminium Company or NALCO, Canara Bank, etc. were among the major Rakesh Jhunjhunwala portfolio stocks that ended lower last week"
Updated: 22 Jun 2022,Rakesh Jhunjhunwala portfolio: Tata stock gives 35% CAGR over 20 years,https://www.livemint.com/market/stock-market-news/rakesh-jhunjhunwala-portfolio-tata-stock-titan-company-gives-35-cagr-over-20-years-rs-1-lakh-turns-rs-5-5-crore-11655865728553.html,"Rakesh Jhunjhunwala portfolio: Amid speculations about market making its bottom, retail investors are busy scanning quality stocks available at discounted price. For such investors, Titan Company shares can be a good stock to look at. This Rakesh Jhunjhunwala stock is currently trading at around ₹2,080 per equity share, which is around 25 per cent lower from its 52-week high of ₹2,769 per share mark. This Tata group stock has a history of giving stellar return to its shareholders as in last 20 years, Titan share price has ascended from ₹3.79 per equity share to ₹2079.95 levels, delivering CAGR (compound average growth rate) of more than 35 per cent over these 20 years. Titan share price history After ascending to 52-week high in March 2022, Titan Company share price has been nosediving continuously and currently it has retraced around 25 per cent from its 52-week high. Prior to this base building phase, Titan share price remained sideways from mid October 2021 to late March 2022. However, this Rakesh Jhunjhunwala-backed company has delivered staggering return to its shareholders in long term. In last one year, Titan share price has given near 20 per cent return to its shareholders whereas in last 5 years, it has given whopping 305 per cent return to its shareholders. In last 10 years, Titan Company shares have ascended from ₹221 to ₹2080 levels, delivering around 840 per cent return to its share investors. This Rakesh Jhunjhunwala holding company has given CAGR of near 25 per cent over 10 years. Similarly, in last 20 years, Titan share price has zoomed from ₹3.79 apiece levels to ₹2079.95 per share mark, registering around 550 times rise in this time horizon. Impact on investment If an investor had invested ₹1 lakh in this Rakesh Jhunjhunwala stock 5 years ago, its ₹1 lakh would have turned to ₹4.05 lakh today. If an investor had invested ₹1 lakh in Titan shares 10 years ago, its ₹1 lakh would have become ₹9.40 lakh today. However, if an investor had invested ₹1 lakh in this Tata group stock 20 years ago, its ₹1 lakh would have turned to ₹5.50 crore today. Rakesh Jhunjhunwala shareholding in Titan Company According to Titan Company shareholding pattern for Q4FY22, Big Bull owns 3,53,10,395 Titan shares or 3.98 per cent stake in the company while his wife Rekha Jhunjhunwala owns 95,40,575 Titan shares, which is 1.07 per cent of total paid-up capital of the company. So, Jhunjhunwala couple together holds 4,48,50,970 Titan shares."
