article_time,article_title,article_link,article_content
Updated: 14 Jan 2022,Tanishq to expand lightweight jewellery,https://www.livemint.com/companies/news/tanishq-to-sell-more-light-weight-jewellery-11642072560613.html,"NEW DELHI : Tanishq, India’s largest jewellery retailer, will convert at least 50% of its gold jewellery in-stores into “lightweight"" pieces over the next 12 months, giving shoppers an option to spend less per piece as India sees a unusual spike in prices of the precious metal. “This was necessitated because of the sharp rise in gold and customers actually feeling the pinch. We were also sensitive to the fact that we don't know how the pandemic will play out. So we wanted to make lightweight a big mantra in our system,"" Ajoy Chawla, CEO, jewellery division, Titan Company, said in an interview. The jewellery pieces, internally tagged as Hi-Lites, were rolled out across the retailer’s 368 stores in the December quarter after a team of 40 people spent six months re-engineering and designing pieces to lower the grammage. In all, 3,500 pieces, only gold, not studded jewellery, have been “light-weighted"" in what is the most extensive exercise undertaken by the company to counter higher gold prices and safeguard consumer demand. On an average, Tanishq has undertaken 15-25% reduction in weight on jewellery pieces, including bangles, jewellery sets, rings, earnings etc set in 22 karat gold. Price of the yellow metal has jumped significantly since the early days of the pandemic, moving up to ₹46,650 as on 13 January 2022 from ₹38,070 per 10 grams for 22 carats on 1 January 2020. “With gold prices having gone up significantly over the last couple of years—over two years it's a 20%+ kind of a swing—we heard a lot of customers come back and tell us that their budget can't stretch so much but they’d like to own a certain product and design,"" Chawla said. The 3,500 pieces that have been redesigned as part of this exercise, together made for 30% of gold inventory at Tanishq stores in the December quarter. In the December quarter, sale from such pieces contributed close to 26% of the total jewellery business. The company used different ways to create light weight jewellery. It included design re-construction and technology, that is, the way it manufactures. ""Some of the products are machine made, so we did some changes in the way we are looking at manufacturing them so they use lesser gold. And third, we looked at some material innovation. We came out with a patented material, a hard alloy, which makes the same 22 karat gold harde, so people still get 22 carat but we can use lesser of the material to give the same dimension and stability,"" Chawla said. He added the move is helping Tanishq convert more walk-ins to shoppers. “We are expecting to serve at least a million customers in the next 12 months on the back of this initiative,"" he said. Inflationary pressure has prompted consumers to look for what's affordable, said market watchers. “Also, consumers want options for daily wear. In the last 2-3 years, gold prices have almost doubled which makes it very high for large sections of consumers,"" said Abneesh Roy, executive vice president, Institutional Equities at Edelweiss Securities. This kind of pricing and product will also work well especially on e-commerce, he added. In the December quarter, the company that also retails watches and perfumes, witnessed strong demand across its consumer businesses clocking 36% growth over the festive quarter last year, the company said in a quarterly update to the exchanges on 6 January. “Buoyancy in jewellery demand driven by festive purchases in October and November helped the division achieve significant revenue uplift for the quarter,"" it said. Both walk-ins and customer conversions were significantly higher compared to last year. New buyer growth was higher than total buyer growth, driven partly by Tanishq's regionalisation strategy of winning in focus markets. While ticket sizes were stable, they were 15% higher than pre-pandemic levels, the company added."
Updated: 10 Jan 2022,Rakesh Jhunjhunwala portfolio: Experts recommend buy on this Tata stock,https://www.livemint.com/market/stock-market-news/rakesh-jhunjhunwala-portfolio-experts-recommend-buy-on-this-tata-stock-11641786032962.html,"Rakesh Jhunjhunwala portfolio: Titan Company shares are one of the favourite portfolio stocks of Big Bull Rakesh Jhunjhunwala. The 'Warren Buffett of India' and has wife Rekha Jhunjhunwala have investments in this Tata group company that surprised market observers after reporting a robust growth momentum, indicating healthy market share gains. According to stock market experts, Titan Company share price is already in 'uptrend' and after this robust third quarter business update, they are expecting sharp upside move in this Rakesh Jhunjhunwala stock. Speaking on this Rakesh Jhunjhunwala portfolio stock; Sumeet Bagadia, Executive Director at Choice Broking said, ""Titan Company share is looking bullish on chart pattern. It may go up to ₹2700 per share levels in immediate short term whereas in short term it may go up to ₹2900 per share levels. So, my suggestion to positional investors is to buy this Tata group share at current market price maintaining stop loss at ₹2525 levels."" Highlighting the strong fundamentals coming out of Titan Company's Q3FY22 business update; Ashit Desai, Senior Research Analyst at Emkay Global Financial Services said, ""Titan's Q3 business update highlights a robust growth momentum, indicating healthy market share gains. The Jewelry division reported strong 37 per cent growth (ex-bullion sales) with a 2-year CAGR of 26 per cent,"" adding, ""Excluding bullion sales of ₹3.4bn in the base quarter, the Jewelry segment grew 37 per cent in Q3 and posted a healthy 2-year CAGR of 26 per cent. The strong sales CAGR were driven by a near 15 per cent jump in ticket size against pre-pandemic levels, higher footfalls/conversions and around 9 per cent CAGR in the store count. Management attributed the strong trends to buoyant jewelry demand during the festive season as well as new customer acquisitions, aided by its regionalization strategy. The studded mix improved slightly vs. the previous year. Enrollments in the Golden Harvest Scheme (GHS) recorded strong double-digit growth. Tanishq's network was expanded by 14 stores, including two new stores at prime locations in Dubai."" Ashit Desai of Emkay Global Financial Services also suggested Titan Company shareholders to further hold the counter for its next short to medium term target of ₹3,000 levels. Rakesh Jhunjhunwala shareholding in Titan Company According to Titan Company's shareholding pattern for September 2021 quarter, Rakesh Jhunjhunwala and his wife Rekha Jhunjhunwala hold stake in the Tata group company. Rakesh Jhunjhunwala holds 3,37,60,395 shares or 3.80 per cent stake whereas Rekha Jhunjhunwala holds 95,40,575 shares or 1.07 per cent stake in the company. So, Jhunjhunwalas together hold 4.87 per cent stake in the company or 4,33,00,970 company shares. Titan Company's shareholding pattern for October to December 2021 quarter is still awaited. Disclaimer: The views and recommendations made above are those of individual analysts or broking companies, and not of Mint."
Updated: 07 Jan 2022,"Titan’s Q3 update shows jewellery glitters, taking shares to a new 52-week high",https://www.livemint.com/market/mark-to-market/titans-q3-update-shows-jewellery-glitters-taking-shares-to-a-new-52-week-high-11641535617014.html,"Titan Co. Ltd’s shares rose more than 3% in early trade on Friday on the NSE, hitting a new 52-week high. Even as most of the gains were wiped out later, the jewellery retailer’s December quarter (Q3FY22) update brings cheer, setting the tone for robust financial results. The company saw strong growth momentum continue in Q3 with revenues rising by 36% year-on-year. Titan’s mainstay jewellery business, which accounted for more than 85% of revenues for the half-year ending September, continues to shine. The segment’s revenues, excluding bullion sales, increased by 37% year-on-year.  According to Titan, this time around, jewellery demand was robust led by festive season sales in October and November. Further, the proportion of studded jewellery in the overall pie has slightly improved year-on-year. For perspective: this measure stood at 26% in Q3FY21. The company’s watch business revenues increased by 28%, helped partially by a softer base. In Q3FY21, watch revenues had declined by 12%. The company said multi brand channels, both online and offline, saw handsome growth last quarter. Overall, the strong revenue trends are likely to aid margin improvement. “The operating margin is likely to improve year-on-year in Q3FY22, led by a higher year-on-year contribution from the studded jewellery business. The strong topline growth would also drive Ebitda growth,"" said analysts from Motilal Oswal Financial Services. As things stand, many analysts are upbeat on growth prospects. Nonetheless, restrictions owing to the fresh surge in covid-19 cases are worth tracking. “Going ahead, we expect the jewellery division to continue to register strong performance, with stability in gold prices. However, the threat of new lockdowns given the rise in covid-19 cases remains to be a key monitorable,"" said analysts from Dolat Capital Market Pvt. Ltd in a note. Needless to say, investors will have to closely follow management commentary on demand trends when the December quarter results are announced. Note that the Titan stock has appreciated as much as 65% over the past year, rendering valuations pricier. Based on Motilal Oswal’s estimates, Titan’s shares now trade at 80 times estimated earnings for financial year 2023. The stock’s stellar returns and expensive valuations may well limit significant upsides in the near future.  "
Updated: 06 Jan 2022,Titan says seen strong demand across businesses with 36% growth in Q3,https://www.livemint.com/companies/news/titan-says-seen-strong-demand-across-businesses-with-36-growth-in-q3-11641464950923.html,"Titan Company Ltd on Thursday said it has witnessed strong demand across its consumer businesses and clocked 36% growth for the quarter ending December (Q3FY22) over the festive quarter last year. Segment wise, buoyancy in jewellery demand driven by festive purchases in October and November helped the division achieve revenue uplift for the quarter, rising 37% over last year same period. Both walk-ins and customer conversions were significantly higher compared to last year, Titan said, adding that new buyer growth was higher than total buyer growth driven partly by Tanishq's regionalization strategy of winning in focus markets. ""While ticket sizes were stable, they were 15% higher than pre-pandemic levels. The contribution from Tier-1 towns continued to improve and were close to pre-pandemic levels,"" it said. Tanishq recorded a network expansion of 14 stores (net) including 2 new stores in Dubai at prime locations of Dubai mall and Al Barsha. The watches and wearables division saw strong growth momentum with multi brand channels, both online and offline, growing handsomely in the quarter, mainly on the back of Titan brand. The segment grew by 28% with 20 new store additions in the third quarter. Overall, Titan Company's standalone business clocked a revenue growth of 36% during the quarter under review. On Thursday, Titan shares rose 0.77% to close at ₹2,595.95 on NSE."
Updated: 01 Jan 2022,Rakesh Jhunjhunwala earns ₹1540 crore from this stock in 3 months. Do you own?,https://www.livemint.com/market/stock-market-news/rakesh-jhunjhunwala-earns-rs-1540-crore-from-this-stock-in-3-months-do-you-own-11641010621276.html,"Rakesh Jhunjhunwala portfolio: Titan Company is one of the favourite portfolio stocks of Rakesh Jhunjhunwala. Big Bull has displayed strong conviction towards this Tata group share as he remained invested in the scrip even during the challenging times of Covid. This paying dividends to the 'Warren Buffett of India' now. In last 3 months, Titan share price has shot up from ₹2161.85 (close price on NSE on 30th September 2021) to ₹2517.55 (close price on NSE on 31st December 2021) apiece levels, helping Rakesh Jhunjhunwala's net worth to grow by near ₹1540 crore in this period. Rakesh Jhunjhunwala share holding in Titan Company As per Titan Company's shareholding pattern for July to September 2021, Rakesh Jhunjhunwala and his wife Rekha Jhunjhunwala have investments in the Tata company. Rakesh Jhunjhunwala holds 3,37,60,395 shares or 3.80 per cent stake in the company whereas his wife Rekha Jhunjhunwala holds 95,40,575 shares or 1.07 per cent stake in the company. So, Jhunjhunwalas together hold 4.87 per cent stake or 4,33,00,970 Titan Company shares. Tita share price history As per Titan Company share price history, the Tata group share had closed at ₹2161.85 apiece levels on NSE on 30th September 2021 whereas it closed at ₹2517.55 per share levels on NSE on 31st December 2021. So, in last 3 months, Titan share price has shot up ₹355.70 per equity share. Impact on Rakesh Jhunjhunwala's net worth As Rakesh Jhunjhunwala and his wife holds 4,33,00,970 Titan Company shares and the stock has risen ₹355.70 apiece, rise in Rakesh Jhunjhunwala's net income from this stock in last 3 months is around ₹1540 crore ( ₹355.70 x 43300970). Titan share price outlook According to stock market experts, Titan share rally is expected to continue in short-term and investors can buy and hold the counter at current levels. Advising investors to buy Titan Company shares; Sumeet Bagadia, Executive Director at Choice Broking said, ""One can buy and hold Titan Company shares at current levels. It may go up to ₹2700 levels in next 15-25 days."" Disclaimer: The views and recommendations made above are those of individual analysts or broking companies, and not of Mint."
Updated: 31 Dec 2021,Day trading guide for Friday: 4 stocks to buy or sell today — 31st December,https://www.livemint.com/market/stock-market-news/day-trading-guide-for-friday-4-stocks-to-buy-or-sell-today-31st-december-11640913061588.html,"Day trading guide for Friday: The consolidation movement continued in the market for the second consecutive session on Thursday. Nifty 50 went off 9 points and closed at 17,203 whereas BSE Sensex shed 12 points and closed at 57,794 levels. Bank Nifty added 18 points and closed at 35,063 levels. According to stock market experts, current market pattern indicates an impending warning signal for trend reversal. Day trading guide for stock market today Stock market experts said that Nifty is now placed at the crucial overhead resistance of around 17,250 to 17,300 levels, which is likely to be a new lower top formation (with swing high of 17,285 of 29th December). But, the market is not showing any sharp weakness from near the key hurdle. Hence, such consolidation movements just below the important resistances more often results in a decisive upside breakout of the hurdle. Speaking on day trading guide for Nifty today; Nagaraj Shetti, Technical Research Analyst at HDFC Securities said, ""The short term trend of Nifty remains choppy. The lack of selling participation at the crucial overhead resistance could give chance for bulls to make a sharp come back from the lows in the near term. Hence, the said consolidation movement could continue for the short term. Immediate support for NSE Nifty is placed at 17,120 levels."" Echoing with Nagraj Shetti's views; Ruchit Jain, Lead Research at 5paisa.com said, ""As per our analysis, until the Nifty surpass its hurdle of 17,300 and Bank Nifty crosses its resistance of 35,500, there is a probability of a small correction, which would lead the Nifty to mark a higher low and Bank Nifty to complete its last leg of the correction. Hence, traders should look to book some profits on long positions here and form aggressive longs only if the indices give breakout above the mentioned resistances."" Day trading stocks to buy today Sharing day trading stocks for today, stock market experts — Sumeet Bagadia, Executive Director at Choice Broking and Mudit Goel, Senior Research Analyst at SMC Global Securities — recommended 4 stocks to buy today. Sumeet Bagadia's day trading stocks 1] Titan Company: Buy at CMP, target ₹2500 to ₹2525, stop loss ₹2380 2] Britannia: Buy at CMP, target ₹3675 to ₹3700, stop loss ₹3500 Mudit Goel's day trading stocks for today 3] HDFC Ltd: Buy at CMP, target ₹2610, stop loss ₹2550 4] HDFC Bank: Buy at CMP, target ₹1490, stop loss ₹1450. Disclaimer: The views and recommendations made above are those of individual analysts or broking companies, and not of Mint."
Updated: 30 Dec 2021,Day trading guide for Thursday: 4 stocks to buy or sell today — 30th December,https://www.livemint.com/market/stock-market-news/day-trading-guide-for-thursday-4-stocks-to-buy-or-sell-today-30th-december-11640790218860.html,"Day trading guide for Thursday: After showing a sustainable upside move in the last couple of sessions, Indian stock market slipped into minor weakness amidst volatility on Wednesday and closed in negative territory. Nifty 50 went off 19 points and closed at 17,213 whereas BSE Sensex shed 90 points and closed at 57,806 levels. Nifty Bank index lost 138 points and closed at 35,045 levels. According to stock market experts, current market pattern indicates lackluster type movement at the crucial overhead resistance. This could hint at a possibility of downward correction in the market from the highs. Day trading guide for stock market today Speaking on day trading guide for Nifty today; Nagaraj Shetti, Technical Research Analyst at HDFC Securities said, ""The market seems to have placed at the crucial overhead resistance and lacking its strength to surpass above the hurdle. There is a higher possibility of further consolidation or downward correction in the next 1-2 sessions before showing further upside bounce again from the lows. Immediate support for NSE Nifty is placed at 17,100 levels."" On day trading strategy for Nifty Bank index; Ruchit Jain, Lead Research at 5paisa.com said, ""As per our analysis, until the Nifty surpass its hurdle of 17,300 and Bank Nifty crosses its resistance of 35,500, there is a probability of a small correction, which would lead the Nifty to mark a higher low and Bank Nifty to complete its last leg of the correction. Hence, traders should look to book some profits on long positions here and form aggressive longs only if the indices give breakout above the mentioned resistances."" Day trading stocks for today Sharing day trading stocks to buy today; stock market experts — Sumeet Bagadia, Executive Director at Choice Broking and Avinash Gorakshkar, Head of Research at Profitmart Securities — recommended 4 stocks to buy today. Sumeet Bagadia's day trading stocks 1] Indusind Bank: Buy at CMP, target ₹900 and ₹940, stop loss ₹840 2] Maruti Suzuki India Ltd or MSIL: Buy at CMP, target ₹7500 and ₹7600, stop loss ₹7150 Avinash Gorakshkar's day trading stocks to buy 3] Titan Company: Buy around ₹2400, target ₹2470, stop loss ₹2370 4] ICICI Bank: Buy around ₹736, target ₹765, stop loss ₹721. Disclaimer: The views and recommendations made above are those of individual analysts or broking companies, and not of Mint."
Updated: 27 Dec 2021,"Sebi fines two employees of Mindtree, two others of Titan Company",https://www.livemint.com/market/stock-market-news/sebi-fines-two-employees-of-mindtree-two-others-of-titan-company-11640615385651.html,"Markets regulator Securities and Exchange Board of India (Sebi) imposed a monetary fine of ₹1 lakh each on two employees of Mindtree Ltd and Titan company Ltd for violating insider trading norms. Mindtree had informed Sebi regarding instances of the violation of the code of conduct framed by the company under the Prohibition of Insider Trading (PIT) norms by two of its employees. The investigation was carried out during January-March 2019. Praveen Udhayasuriyan and G V D Prasad Rao had failed to make the requisite disclosures within the stipulated time for their transactions in the firm's scrip, in terms of PIT norms. Sebi in separate orders noted that their violations affect multiple stakeholders and have an impact on the entire securities market. The regulator has levied a fine of ₹1 lakh each on them. Separately, Sebi has slapped a fine of ₹1 lakh each on two employees of Titan Company Ltd. The market regulator said both the employees Pooja Chauhan and Rajesh Chamy failed to make discloures as traded value of transactions exceeded ₹10 lakh Sebi conducted an investigation during April 2018-March 2019. The regulator had received a letter from Titan, wherein the company intimated about violation of PIT regulations and the company's code of conduct for the prevention of insider trading by some of its designated persons/employees. The said employees of both the companies have 45 days to pay the fine amount to Sebi. In any event of failure, recovery proceedings may be initiated for realization of the penalty amount along with interest by attachment and sale of movable and immovable properties."
Updated: 22 Dec 2021,Sebi imposes fine on Titan's employee for insider trading norms violation,https://www.livemint.com/companies/news/sebi-imposes-fine-on-titan-s-employee-for-insider-trading-norms-violation-11640186620135.html,"NEW DELHI : Markets regulator Sebi on Wednesday imposed a fine on an employee of Titan Company Ltd for violation of insider trading norms. The order came after a probe conducted by Sebi between April 2018 and March 2019. The regulator had received a letter from Titan wherein the company intimated about violation of Prevention of Insider Trading (PIT) regulations and the company's code of conduct for the prevention of insider trading by some of its designated persons/employees. Subsequently, the regulator conducted an investigation in the scrip of Titan and observed several non-compliances with PIT Regulations during the period April 2018-March 2019 by employees and designated persons including one Patil Basavaraj Mallikarjun. ""Noticee, being an employee of the company, was required to make disclosures to Titan, for each of the aforesaid transactions within two (2) working days,"" Sebi said. However, there is no evidence to show that he made any such disclosures, Sebi added. While in employment of Titan, Mallikarjun had transacted in securities of Titan on two occasions in April and May 2018. The cumulative values of trades on both the occasions exceeded ₹10 lakh, thereby necessitating disclosure of such transactions in terms of PIT norms. However, he failed to do so and violated PIT norms on two occasions. Therefore, Sebi has levied a fine of ₹1 lakh on him.  Separately, Sebi imposed fine of ₹5 lakh each on Shukla Packging Industries Pvt Ltd, Surendra Kumar Gupta HUF and Balbhadra Trading Pvt Ltd for fraudulent and manipulative trading in illiquid stock options segment on the BSE. The fraudulent trades conducted by the entities are in violation of provisions of the Prohibition of Fraudulent and Unfair Trade Practices (PFUTP) norms, Sebi noted in separate orders.  This story has been published from a wire agency feed without modifications to the text."
