article_time,article_title,article_link,article_content
Updated: 15 Dec 2021,How to apply for your home loan online: The process,https://www.livemint.com/brand-post/how-to-apply-for-your-home-loan-online-the-process-11639559517553.html,"Homebuying is a serious financial commitment as it is an exciting milestone in one’s life. Most of us require external financing to support our dream to own property, and home loans today make it that much easier. With leading lenders now offering more relaxed and customer-centric borrowing terms and rates, availing of a home loan not only aids your home buying journey but also helps accelerate your tax savings. Given the impact of this financial decision, home loan aspirants must be cautious about which lender they choose to borrow from and the home loan application process itself. While the application process is not very complex, one must ensure they’re following it to the T and meeting the prescribed eligibility criteria, which is unique to each lending institution. However, thanks to the digital transformation of the mortgages industry – any information you need about your home loan is available online, allowing you to research and carry out your due diligence before you apply. And not just that, industry leaders such as Bajaj Housing Finance Limited even offer online applications — taking the entire home loan borrowing journey online, with very little physical interaction at a time where social distancing is the need of the hour. Individuals applying through the lender’s online home loan application form can also get a digital sanction letter. The whole form takes about 10 minutes to complete and requests only basic details. In this article, we tell you everything you need to know before making your home loan application online. Home Loan Eligibility Criteria The first thing any home loan aspirant must look at closely is their home loan eligibility. Every lender has a set list of asks that they expect applicants to meet, following which they can approve of their loan request. The parameters include one’s age, credit score, repayment capacity, income, and obligation, among others. Applicants are advised to check their eligibility beforehand to see how they measure up against the lender’s criteria and only then apply. This can help one find the home loan best suited to their repayment capacity and enhance their chances of getting approved. Applicants must note that their credit rating is also hampered if their home loan application stands rejected — so one must be certain of their chances of being approved before they apply. Home Loan Interest Rate Another important point to factor in while you’re looking for the right home loan is the applicable interest rate. The interest rate is fundamental in determining how expensive your home loan can be and how you can plan your finances. Lenders offer two types of interest rates on home loans to eligible applicants, namely fixed and floating. 1. Fixed interest rate: If one opts for a fixed interest rate, they insulate their home loan EMIs from market fluctuations. As the name suggests, the interest rate remains the same throughout the tenor or till a reset date. However, fixed interest rate is typically a little higher than floating interest rate. 2. Floating interest rate: As the name suggests, this interest rate is linked to an internal/external benchmark and is subject to change depending on the market. This rate is not only lower than the fixed interest rate, it also passes the borrower the benefit of favourable market conditions – translating to lower interest rates and smaller EMIs. Reputed lenders such as Bajaj Housing Finance offer salaried and professional applicants floating interest rate home loans from 6.70%* p.a., basis eligibility. Calculate Home Loan EMI Every home loan aspirant must take stock of their repayment capacity and calculate their possible home loan EMI to see if it is an amount they can comfortably repay over a long period of time. Having a tentative repayment schedule in place is important as it helps you plan your long-term financial goals, as well as track your EMI outflow – reducing any chances of defaulting. The first step of planning your repayment is to determine the loan amount you need from your lender. An applicant can typically get a sizable value if they have a strong financial, income, and credit profile and can meet the eligibility criteria as mandated. After you’ve decided on your loan sum, you will need to fix the loan tenor over which you will repay the loan. There are several considerations to take into account, such as your age at the time of borrowing, your EMI to income ratio, and your financial profile. Using a Home Loan Calculator makes it easier for you to forecast your possible home loan EMIs. The Bajaj Housing Finance Home Loan Calculator is a free and easy-to-use digital tool that allows borrowers to adjust their loan amount, loan tenor, and interest rate as they please, to get a realistic idea of what their EMIs could shape up to be – which in turn shows them if they can afford the home loan they desire. How to Apply for Your Home Loan Online The online home loan application journey hosted by market leaders, such as Bajaj Housing Finance Limited, is easy to follow and efficient – allowing you to save both time and effort while you make your home loan application. Here is how to apply for your home loan online: - Visit the website of your loan provider and go to their online home loan application - Select the loan product that you are interested in - Provide basic details as asked for on the form – your name, income details, ID proof, address proof, and co-applicant details (if needed) - Adjust the loan amount, tenor, and preferred interest rate as per your needs - Check for pre-approved offers and special benefits tailored for you - Upload other necessary paperwork and documents before finally completing the application Many lenders also provide on call assistance, with a customer care consultant who can assist you through the process. Toll-free phone numbers are also available to make the process easier for the borrower. Conclusion In the post-pandemic world, taking the home loan application online has been extremely beneficial for borrowers and lenders alike. This move towards digitalization also gives the borrower full control over their application and makes their borrowing experience hassle-free. If you’re in the market for a home loan, consider opting for the Bajaj Housing Finance Limited Online Home Loan – designed for maximum affordability and convenience. One can complete the form in just 3 steps and get a Digital Sanction Letter in as little as 10 minutes. Disclaimer: This content is distributed by Bajaj Finserv. No HT journalist is involved in creation of this content. "
Updated: 09 Dec 2021,Day trading guide for Thursday: 9 stocks to buy or sell today — 9th December,https://www.livemint.com/market/stock-market-news/day-trading-guide-for-thursday-9-stocks-to-buy-or-sell-today-9th-december-11639012520743.html,"Day trading guide for Thursday: After showing a sharp upside bounce from the lows on Tuesday, the strong upside momentum continued in the Indian stock market on Wednesday. Nifty 50 index surged 293 points and closed at 17,469 levels while BSE Sensex shot up 1016 points and closed at 58,649 levels. Bank Nifty index appreciated 666 points and closed at 37,284 mark. According to stock market experts, this upside move in last two sessions has erased the negative sentiment emerged on last Friday and this Monday. On a day when the volumes on the NSE were higher than the recent average; realty, metals, auto, telecom, IT and bank indices surged the most. BSE Small-cap and Mid-cap indices underperformed the Nifty rising 1.4 per cent and 1.5 per cent respectively. Day trading guide for Nifty 50 today Unveiling day trading guide for Thursday; Nagaraj Shetti, Technical Research Analyst at HDFC Securities said, ""The bulls have gained upside momentum in the last two sessions and the market is now placed at the important juncture. A decisive move above 17,550 to 17,600 levels on NSE Nifty could open further sharp upside towards 18,000 levels in a quick period of time. Any failure to sustain above this area is likely to trigger weakness from the highs towards the low of 17,250 to 17,200 levels on NSE Nifty in the near term."" Day trading stocks to buy today Listing out day trading stocks for today's trade session, stock market experts — Sumeet Bagadia, Executive Director at Choice Broking; Ravi Singhal, Vice Chairman at GCL Securities, Ravi Singh, Head of Research & Vice President at ShareIndia, Manoj Dalmia, Founder & Director at Proficient Equities Limited and Parth Nyati, Founder at Tradingo — recommended 9 stocks to buy or sell today. Sumeet Bagadia's day trading stocks 1] Hindustan Zinc: Buy at CMP, target ₹380 to ₹400, stop loss ₹340 2] Glenmark Pharmaceuticals: Momentum buy at CMP, target ₹520 to ₹530, stop loss ₹494 Ravi Singhal's stock of the day 3] Bajaj Finserv: Sell around ₹17800, target ₹17017, stop loss ₹18111 Ravi Singh's stocks to buy today 4] Bharti Airtel: Buy at ₹714, target ₹735, stop loss ₹708 5] DLF: Buy at ₹396, target ₹410, stop loss ₹392 Manoj Dalmia's day trading stocks for Thursday 6] Polyplex: Buy at ₹2002, target ₹2370, stop loss ₹1903 7] Gufic BioSciences: Buy at ₹222, target ₹259, stop loss ₹209 Parth Nyati's stock picks for Thursday 8] Sundram Fasteners: Buy at ₹868, target ₹900, stop loss ₹850 9] Biocon: Buy around ₹383, target ₹393, stop loss ₹377. Disclaimer: The views and recommendations made above are those of individual analysts or broking companies, and not of Mint."
Updated: 06 Dec 2021,Day trading guide for Monday: 6 stocks to buy or sell today — 6th December,https://www.livemint.com/market/stock-market-news/day-trading-guide-for-monday-6-stocks-to-buy-or-sell-today-6th-december-11638714325699.html,"Day trading guide for Monday: After showing massive upside bounce on Thursday, Indian stock market reversed down sharply on Friday and closed in red zone. Nifty-50 Index nosedived 204 points and closed at 17,196 levels whereas BSE Sensex crashed 764 points and closed at 57,696 levels. Bank Nifty also went down 311 points and closed at 36,197 levels. According to market experts, recent upside bounce of the last few trade session seems to have completed and the market has turned down from the highs. Day trading guide for Nifty-50 Unveiling intraday trading strategy for Monday; Nagaraj Shetti, Technical Research Analyst, HDFC Securities said, ""The near term trend of Nifty continues to be down and the recent pullback rally of a down trend seems to have completed. There is a possibility of further weakness on NSE Nifty down to 16,800 levels by next week. Immediate resistance for Nifty-50 is placed at 17,300 to 17,350 levels."" Also Read: 5 stocks with zero debt, high alpha to invest in Day trading stocks to buy today Sharing Day trading stocks for today, stock market experts — Sumeet Bagadia, Executive Director at Choice Broking; Ravi Singhal, Vice Chairman at GCL Securities, Manoj Dalmia, Founder & Director at Proficient Equities Limited and Parth Nyati, Founder at Tradingo — listed out 6 day trading stocks for Monday. Sumeet Bagadia's day trading stocks 1] United Phosphorus Ltd or UPL: Buy at CMP, target ₹725 to ₹730, stop loss ₹700 2] NMDC: Momentum buy at CMP, target ₹150 to ₹155, stop loss ₹140 Ravi Singhal's stock of the day 3] Bajaj Finserv: Sell around ₹17,500, target ₹17,000, stop loss ₹17,777 Manoj Dalmia's stock pick of the day 4] Jindal Poly Films: Buy at ₹1102, target ₹1244, stop loss ₹1044 Parth Nyati's day trading stocks for today 5] Clean Science and Technology or CLEAN: Buy at CMP, target ₹2600, stop loss ₹2410 6] Aegis Logistics: Buy at around ₹247.50, target ₹255, stop loss ₹242.75. Disclaimer: The views and recommendations made above are those of individual analysts or broking companies, and not of Mint."
Updated: 02 Dec 2021,Finserv MARKETS positions itself as One Marketplace with new brand campaign,https://www.livemint.com/brand-post/finserv-markets-positions-itself-as-one-marketplace-with-new-brand-campaign-11638446003336.html,"Finserv MARKETS, an initiative by Bajaj Finserv, has launched its brand campaign #AbChoicesHueAasaan. This campaign has been launched in response to a rising need for a single destination where people can avail Financial Services as well as purchase Lifestyle products. The digital campaign is directed towards making the lives of consumers easier by simplifying the decision-making process for all of their financial and lifestyle needs. The campaign #AbChoicesHueAasaan showcases the core proposition of Finserv MARKETS – Choices & Convenience. The brand offers a range of products across financial categories like Loans, Cards, Insurance, Investments, and Payments besides offering a wide assortment of lifestyle products that can be bought at No Cost EMI. Finserv MARKETS offers these categories through partnerships with India’s leading financial and lifestyle brands. Finserv MARKETS delivers the promise of One Marketplace through a very intuitive user experience on Web & App.  Finserv MARKETS, an initiative by Bajaj Finserv, has launched its brand campaign #AbChoicesHueAasaan. This campaign has been launched in response to a rising need for a single destination where people can avail Financial Services as well as purchase Lifestyle products. The digital campaign is directed towards making the lives of consumers easier by simplifying the decision-making process for all of their financial and lifestyle needs. The campaign #AbChoicesHueAasaan showcases the core proposition of Finserv MARKETS – Choices & Convenience. The brand offers a range of products across financial categories like Loans, Cards, Insurance, Investments, and Payments besides offering a wide assortment of lifestyle products that can be bought at No Cost EMI. Finserv MARKETS offers these categories through partnerships with India’s leading financial and lifestyle brands. Finserv MARKETS delivers the promise of One Marketplace through a very intuitive user experience on Web & App. |#+| The brand film #AbChoicesHueAasaan starring Sumeet Raghavan talks about a middle-class man who’s stuck in a whirlpool of never-ending responsibilities. The daily slice of life situations served with a light dose of humour has been able to create an instant connect with the audience. The campaign has proved to be a great example for making people understand that the responsibilities of one’s daily life should in no way disrupt their manner of living if they rely on a one-stop destination like Finserv MARKETS. Finserv MARKETS is powering a revolutionary shift in the financial and lifestyle domain by offering these products under one single roof. Disclaimer: This is a company press release. No HT journalist is involved in creation of this content. "
Updated: 30 Nov 2021,"Sensex Zooms 700 Pts, Nifty Tops 17250; Bajaj Finserv, Tech Mahindra Top Gainers",https://www.livemint.com/market/stock-market-news/sensex-zooms-700-pts-nifty-tops-17250-bajaj-finserv-tech-mahindra-top-gainers-11638248100765.html,"Asian share markets are trading in positive territory as investors became cautiously optimistic the new Omicron variant might not cause a widespread global economic disruption to worsen the coronavirus pandemic. The Nikkei advanced 0.7% while the Shanghai Composite added 0.2%. The Hang Seng, on the other hand, lost 1.3%. In US stock markets, Wall Street indices closed higher on Monday, regaining some of the ground they lost in Friday's sell-off, as investors were hopeful that the Omicron coronavirus variant would not lead to lockdowns after reassurance from US President Joe Biden. The Dow Jones gained 0.7% while the Nasdaq Composite zoomed 1.9%. Back home, Indian share markets have opened on a strong note. Riding on positive global momentum, benchmark indices advanced over 1% in early trade.                                      "
Updated: 22 Nov 2021,Investors poorer by over ₹8.21 lakh cr as markets go into tailspin,https://www.livemint.com/market/stock-market-news/investors-poorer-by-over-8-21-lakh-cr-as-markets-go-into-tailspin-11637594472447.html,"NEW DELHI : Investors' wealth eroded by a massive ₹8,21,666.77 crore on Monday as the market saw a massive sell-off not seen in many months. The BSE benchmark Sensex plunged 1,170.12 points or 1.96% to close at 58,465.89. This is the worst single-day drop for the gauge in over seven months. This was also the fourth straight session of decline for the Sensex. During the day, the index tumbled 1,624.09 points. Following the weak trend, the market capitalisation of BSE-listed companies tumbled by ₹8,21,666.77 crore to ₹2,60,98,530.22 crore. ""Indian market witnessed a sharp sell-off in today's trading session amid stable global cues. Heavyweight Reliance puts pressure on the market while withdrawal of Farm laws bills and poor performance of Paytm IPO are some excuses for a long-awaited correction. FIIs are selling continuously in the Indian market as they feel valuations are stretched however they still have a long-term bullish view on India,"" said Santosh Meena, Head of Research, Swastika Investmart Ltd. Bajaj Finance, Bajaj Finserv, Reliance Industries, NTPC, Titan and SBI were the biggest laggards, falling up to 5.74%. Reliance Industries tumbled over 4%, after the company shelved a proposed deal to sell a 20% stake in its oil refinery and petrochemical business to Saudi Aramco for an asking of $15 billion. ""Subdued listing and continuation of weak trading of Paytm, India’s largest new generation fintech, is a big sentimental setback to the domestic market, which was thriving on the strong primary market. It will impact the inflow of money from the retail segment, which has been a key player during the year. FIIs are also a seller due to fear of overvaluation of India compared to peers. ""Weak inflow from FIIs will possibly get higher due to the withdrawal of three agriculture farm acts which brings a stoppage to governments reformist agendas in context to coming state elections next year. It was a key factor for India to trade at a premium to EMs during the year,"" Vinod Nair, Head of Research at Geojit Financial Services said. One97 Communications, Paytm’s parent company, tumbled over 13% to close at 1,360.30 a share on the BSE. In the broader market, the midcap and smallcap indices fell up to 2.96%. ""Cancellation of Reliance-Aramco deal, withdrawal of agriculture farm acts, persistent selling by FIIs and disappointment from Paytm’s listing dented market sentiments and led to free fall in the market,"" according to Siddhartha Khemka, Head - Retail Research, Motilal Oswal Financial Services Ltd. "
Updated: 18 Nov 2021,Avail of an instant personal loan without leaving your home,https://www.livemint.com/brand-post/avail-of-an-instant-personal-loan-without-leaving-your-home-11637231250808.html,"You may need money for a planned expense or may urgently need cash for something that arises out of the blue. In either case, you don’t have to spend a couple of hours planning your next step. A personal loan is the simplest solution as you can avail of it easily and in just a few minutes. Before you apply, all you need to know is the loan amount you will need and the preferred tenor. With this information, you can find lenders. Many have lenient criteria so that you can qualify without any issues and in just a few minutes. Meet simple terms and avoid risking an asset Personal loans are unsecured offerings – this means you can qualify for one without pledging your assets. As such, you only need to have a suitable profile to get approval. Moreover, top lenders have simple requirements that mainly assess five main categories, which are: - Age - Annual income - Citizenship - CIBIL score - Employment type As an unsecured instrument, Bajaj Finserv Personal Loans are much easier to avail and quicker too! You also get to enjoy hassle-free loan processing as lenders don’t have to evaluate and verify assets. This is a key benefit, as you may not have the time to do the legwork required to secure loan approval. Get a large sanction and tick off your wish list Expenses come in all shapes and sizes, and you need the freedom to spend as you’d like. A personal loan caters to this as it doesn’t have any restrictions on usage. You can use the sanction to renovate your home, buy new appliances, purchase gifts for family, host a wedding, or book travel tickets. Besides leisure spending, this loan can also help you tackle big-ticket financial obligations too. You can use it to consolidate debt or handle medical or business expenses. A personal loan offers unlimited freedom, and you can address almost any expense on your wish list without restrictions. Avail of same-day disbursal and meet urgent expenses with ease In case of any emergency expenses, you can opt for a personal loan and rely on it in your time of need. Top lenders now have fully digital provisions, through which you can get funds almost instantly. In fact, in certain cases, you enjoy the benefit of instant approval and have the full sanction disbursed to you within 24 hours. This is a useful feature to look for in a personal loan as it guarantees funds if you’re ever in a pinch. Spend as per your budget and repay comfortably The pressure of the debt obligation brought on by availing of a personal loan is a common concern. However, new-age lenders address this problem by offering a flexible tenor. This means you can opt to repay comfortably, based on your capabilities, without having to worry about an overly expensive monthly instalment. In many cases, you can opt for a repayment plan that lasts up to five years. This allows you to calculate personal loan EMI options that not only suit your budget but also help you save on interest. For true flexibility and convenience, opt for the Bajaj Finserv Personal Loan. Here you can get a sanction of up to Rs. 25 lakh and a long repayment tenor of up to 60 months. Bag a low-interest personal loan by meeting the simple eligibility criteria and submit only a few documents. To get started, check your pre-approved offer, and apply online. *Conditions Apply Disclaimer: This content is distributed by Bajaj Finserv. No HT journalist is involved in creation of this content."
Updated: 08 Nov 2021,"Sensex Ends 478 Points Higher; Titan, IOC and Bajaj Finserv Rally 4%",https://www.livemint.com/market/stock-market-news/sensex-ends-478-points-higher-titan-ioc-and-bajaj-finserv-rally-4-11636369498340.html,"Indian share markets witnessed volatile trading activity today and ended on a strong note. Benchmark indices recovered early losses and ended higher for the second consecutive session supported by the power, metal and oil & gas stocks. At the closing bell, the BSE Sensex stood higher by 478 points (up 0.8%). Meanwhile, the NSE Nifty closed higher by 152 points (up 0.9%). IOC and Titan were among the top gainers today. IndusInd Bank and Divi's Laboratories, on the other hand, were among the top losers today. The SGX Nifty was trading at 18,126, up by 209 points, at the time of writing.                                       "
