article_time,article_title,article_link,article_content
Updated: 17 May 2022,Private investment cycle to pick up once geopolitical uncertainty abates,https://www.livemint.com/economy/private-investment-cycle-to-pick-up-once-geopolitical-uncertainty-abates-11652787267773.html,"NEW DELHI: A little more pick up in capacity utilisation at factories, which are now running at over 70%, and a reasonable resolution to the Russia-Ukraine war will create the right tailwind for the private investment cycle to pick up, according to Bajaj Finserv Ltd. chairman and managing director and Confederation of Indian Industry (CII) president Sanjiv Bajaj. According to Bajaj, businesses in the formal sector, especially technology firms, are steadily hiring people. A normal monsoon will help tame food price inflation, while tax cuts could help moderate energy price inflation, Bajaj said in an interview, adding that businesses are expecting clues from the Reserve Bank of India (RBI) on the roadmap for the expected monetary tightening. Edited excerpts: Retail price inflation has surged to an eight year high in April. What is the impact on industry and will it drag down consumption? Multiple factors are impacting the economy now. There are uncertainties around the war (in Eastern Europe), besides the disruption in the global supply chain. Hopefully, the pandemic is less of an uncertainty now, but we never know. We have seen that companies have been absorbing part of their input costs. You will see some of it getting transmitted outside. From a common man’s point of view, two big costs are the cost of food and fuel. On fuel, we recommend that both the Centre and states in a collaborative manner cut taxes so that it benefits individuals immediately. Secondly, many parts of India are facing heatwave and early signs are that we may see again a good normal monsoon. If that happens, food price inflation will abate. We have also seen in the last couple of quarters, reasonably strong growth on consumer demand. It may moderate a bit, but we are not overly concerned about it at this juncture. As long as we address fuel and food inflation, we should be in a reasonably okay situation. To cool food inflation, what more can be done by the government? Other than the measures taken, we are waiting for the monsoon. The government will have to be nimble on policies so that action is taken as required because so many factors—external and internal, which keep varying. We also believe that rural India, those that are linked to agriculture are seeing better minimum support price (MSP), so with the harvest season coming, they should be doing okay, but in non-agriculture sector, the rural population will need some amount of fiscal support. That is something the government will have to continue to do. When do you expect private investment to take off? In the last two-three years, we did not see significant increase in new investment in the private sector because demand was down and there were uncertainties during the pandemic. If there are uncertainties and people do not have confidence, then we do not see people raising money. We have now seen large amount of deleveraging of balance sheets. In the last year, we have seen some sectors starting new investment cycles, not only in commodities and chemicals, but also in real estate and housing and in transportation. Overall, capacity utilisation has crossed 70% and when it starts crossing 75-80%, you will see the new investment cycle. What we need now is a boost of confidence and we believe that as long as there is nothing more on the pandemic side and the Ukraine war comes to a reasonable resolution or to an acceptable situation, such that confidence comes back, that will create the additional tail wind for the private sector investment. How will the policy rate increases by the RBI impact businesses and the non-bank lending sector? Given where inflation is, and keeping in mind that in the few years to the pandemic, central banks all over the world expanded liquidity and lowered rates. It is a reversal of that cycle. It is a sensible and expected action. To that extent, we may see a few more rate hikes. What we hope to see in RBI’s next policy review is some kind of roadmap of triggers they are watching out for to help them decide the extent and timing of the rate hikes. Because if the industry understands the roadmap, we can align ourselves to that. We are still far away from the normalisation of rates. You will see some impact. I do not think we do not have to be too worried about growth. Is the NBFC sector out of the woods? The pressure mainly again came through the pandemic and the disruptions it created. That is why the central bank has been very supportive with some of the direct lines it opened up to the NBFCs and encouraged banks to lend to NBFCs as well. Now things are getting normalized. You are actually seeing many NBFCs coming out with strong results. A number of them are becoming as strong as mid-sized banks. Recognising that, the RBI has brought in a tighter regulatory structure for NBFCs, which also makes a lot of sense. You are seeing NBFCs as almost a stepping stone to becoming a bank. This is something that the RBI should think more proactively as we need to increase banking services in the country. Unemployment is still a pain point. Are businesses hiring? In the formal sector, we are seeing steady hiring now. In the technology sector, there is a huge demand for people. Attrition levels are high and there are a large number of vacancies. But we believe the change in geopolitics in the last few years has opened up two big windows of opportunity for India. One is for us to become the manufacturing hub for the world for all the things we end up buying from overseas. That is where polices of the Centre on land, labour and energy can make a very big difference in setting the right foundation for the industry to grow. Government has offered production linked incentives and we will recommend a few more sectors where we can be world leaders, for this incentive. Also, employment linked incentives can be given in sectors such as footwear, furniture, leather products and tourism which can employ tens of millions of people. Also, as we have seen in the case of GST, the Centre and states can come together for policy making in land, energy and labour."
Updated: 17 May 2022,Centre-state tie-up can cut fuel taxes: Bajaj,https://www.livemint.com/companies/people/centrestate-tie-up-can-cut-fuel-taxes-bajaj-11652723673334.html,"Central and state governments should collaborate to cut taxes on petrol and diesel in order to moderate inflation, said Sanjiv Bajaj, chairman and managing director of Bajaj Finserv and newly elected president of Confederation of Indian Industry (CII). The industry body expects the economy to grow in the range of 7.4-8.2% in FY23, “with the outlook critically hinging on the trajectory of global crude oil prices,"" said a statement from CII quoting Bajaj. “An immediate measure to moderate inflation could be to moderate taxes on fuel products, which constitute a large share of the retail pump prices of petrol and diesel... CII would encourage Centre and state governments to collaborate in reducing these duties,"" the statement said quoting Bajaj. The appeal to cut taxes on petrol and diesel comes in the context of retail inflation measured by consumer price index (CPI) surging to an eight-year-high in April at 7.79%, led by a surge in food and fuel prices. It raised expectations that the central bank may favour more aggressive rate hikes in June to cool prices. According to Bajaj, global headwinds and inflation will have to be countered with policy reforms to unlock the growth potential of the economy. “Tailwinds that are supportive of growth in the short-term include government capital expenditure, private sector investment which is showing an uptick aided by strong demand in some sectors and the production linked incentive push in the others, good agriculture season on the back of the expectations of a good monsoon and positive export momentum,"" Bajaj said. He said the Indian economy has the potential to reach $40 trillion by 2047, with milestones at $5 trillion by 2026-27 and $9 trillion by 2030-31. The finance ministry said last week that the April update of the World Economic Outlook (WEO) of the IMF implied that the cost of restraining inflation will be slowing global growth. The multilateral agency projected growth of global output to decline from 6.1% in 2021 to 3.6% in 2022 as well as 2023. If global inflation does not sufficiently decline despite aggressive monetary tightening sharply slowing growth, it points at the persistence of supply-demand imbalances that only coordinated action by world leaders can resolve, the ministry said last week in its monthly economic review. IMF expects India’s economy to grow at 8.2% in 2022-23. The government’s optimism stems from scaled-up capital spending, tax buoyancy and some other high frequency indicators like electricity consumption. Bajaj suggested that both central and state governments should scale up their expenditure on public health and education to make these services accessible to all. “This will drive inclusive and equitable growth, improve workforce productivity, and make the economy more resilient. This will also drive consumption demand, the biggest engine of the economy, by reducing out of pocket expenses on these two essentials leaving people with more to spend,"" the statement said quoting Bajaj. He also suggested that providing universal coverage in health and education will create good quality jobs at scale. He said the country should extend the production linked incentive scheme to more sectors, especially those which are labour intensive such as leather, footwear and toys, and sectors where imports are high. He said employment linked incentive schemes should be launched for select services sectors with high growth potential."
Updated: 13 May 2022,Bajaj Finserv’s Sanjiv Bajaj takes over as CII president,https://www.livemint.com/companies/news/sanjiv-bajaj-takes-charge-as-president-of-cii-11652363247504.html,"NEW DELHI : Sanjiv Bajaj, Chairman and Managing Director for Bajaj Finserv Limited, took charge on Thursday as the President of  Confederation of Indian Industry (CII) for 2022-23. Sanjiv has previously engaged with CII at the state, regional and national level. He was the President-Designate for 2021-22 and the Chairman of the Western region during 2019-20. He has also led CII National Committees on Insurance and Pensions and CII taskforce on Fintech. Bajaj is an alumnus of the Harvard Business School, USA and a Member of the Board of Indian School of Business (ISB), Member of the International Advisory Board (IAB), Allianz SE and the International Technology Advisory Panel (ITAP) of Monetary Authority of Singapore (MAS) and Regional Stewardship Board for India and South Asia 2019-2020 of the World Economic Forum. Sanjiv will take over from T V Narendran, CEO and Managing Director, Tata Steel Limited as the head of the newly constituted council. His recent affiliations include AIMA’s Managing India Award’s Entrepreneur of the year 2019, ET’s Business Leader of the year 2018, Financial Express’ Best Banker of the year 2017-18, Ernst & Young’s Entrepreneur of the year in 2017 and Transformational Leader award at the 5th Asia Business Responsibility Summit in 2017. Pawan Munjal, Chairman and CEO for Hero MotoCorp Ltd., assumed office as the CII President-Designate for 2022-23. Mujal has been closely associated with CII for almost 30 years and has been the chairman of CII northern region during 1996-97. He has led several CII National Committees including sports, environment, and technology and innovation. R Dinesh, Executive Vice Chairman for TVS Supply Chain Solutions, took charge as the Vice President. He has been the Chairman of CII Southern Region during 2018-19 and has held several positions in CII as Chairman of National Committees on Logistics, CII Family Business Network India Chapter Council, CII Tamil Nadu State Council, and CII Institute of Logistics Advisory Council."
Updated: 05 May 2022,"Sensex up 500 pts as auto & IT stocks rally; Bajaj Finserv, Infosys top gainers",https://www.livemint.com/market/stock-market-news/sensex-up-500-pts-as-auto-it-stocks-rally-bajaj-finserv-infosys-top-gainers-11651726050894.html,"Asian share markets advanced today after the Federal Reserve lifted interest rates but played down any chance of a huge 75 basis-point lift in the near future. The Nikkei is flat while the Hang Seng rallied 1.4% before erasing some gains. The Shanghai Composite is up 1.1%. In US stock market, Wall Street indices closed sharply higher on Wednesday after the Federal Reserve raised its benchmark overnight interest rate by half a percentage point and said it would begin trimming its bond holdings next month as a further step in the battle to lower inflation. The Dow Jones rallied 2.8% while the Nasdaq zoomed 3.2%. The Federal Reserve yesterday delivered the biggest hike in interest rates since 2000 and announced it would start shrinking its massive balance sheet next month, deploying the most aggressive tightening of monetary policy in decades to combat inflation.                                             "
Updated: 28 Apr 2022,Bajaj Finance revises FD interest rate up to 7.35% p.a for senior citizens,https://www.livemint.com/brand-stories/bajaj-finance-revises-fd-interest-rate-up-to-7-35-p-a-for-senior-citizens-11651143636063.html,"The fixed deposit interest rates at Bajaj Finance, India's second-largest non-banking finance company, have been raised by 60 basis points. The most significant rise is for the 22-month period, where an investor who previously earned 5.90% p.a. will now be able to earn 6.50% p.a. It will now pay 7.35% p.a. for a 44-month deposit, up from 7.05% p.a. previously. After April 25, 2022, all FD investments will be subject to the new fixed deposit rates. For senior citizens, it is essential to prioritise health and family while also paying close attention to their finances. To enjoy their golden years without any stress, one must prepare for them ahead of time. With the latest revised rates, Bajaj Finance Fixed Deposit is a stable option which provides profitable returns. It is when a fixed deposit can be a prudent decision as it is a secured instrument. It can be the most reliable option you need to ensure your post-retirement years. Let us look at some benefits that make Bajaj Finance an ideal option for senior citizens to invest in their retirement corpus. 1. Increased FD rates: Fixed deposits have been seen as a relatively slow investing strategy. It is not the case with Bajaj Finance Fixed Deposits, though. Bajaj Finance provides a greater return than most other banks, with an FD rate of up to 7.35% p.a.  2. Special FD interest rates: Apart from the regular interest rate revision, Bajaj Finance Fixed Deposits has also included special interest rates for senior customers. It will help in higher growth and profitable returns on investments. With special interest rates, one can now choose specific tenors to enjoy interest rates up to 7.35% p.a. 3. High FD rates secure your golden years Retirement is a time to relax and focus on the essential aspects of life. At this stage, your finances should not be a stressor. To ensure that, you can start making well-planned investments and using your savings efficiently. Here, investing in the Bajaj Finance FD can be a wise choice due to its high FD rates. While non-senior citizens get interest rates up to 7.10% p.a., senior citizens get 7.35% p.a. Due to interest compounding, this difference matters and can help you earn generously through the years. The above figures are computed using the Fixed Deposit Interest Rate Calculator. 4. Multiple payout options can help you set up a secondary source of income You can book either cumulative or non-cumulative Bajaj Finance FDs, and the latter can come in handy when you need a steady stream of funds. With this option, you can choose to receive interest payouts at your convenience and create a secondary income stream. The options include monthly, quarterly, half-yearly, or annual payout modes, and you can pick any based on your needs. Do note that the interest rate applicable on non-cumulative FDs varies. Ensure to use the fixed deposit interest rate calculator to know the rate applicable and the interest you will earn for the different payout options. 5. Small monthly investments Bajaj Finance also offers a Systematic Deposit Plan that allows customers to start their investment journey with small monthly instalments as low as Rs. 5,000. These small monthly deposits can create a large corpus over time and help you earn generously through the different tenor options available. Bajaj Finance also offers special interest rates for senior citizens on monthly deposits. 6. 100% online process: Bajaj Finance online FD offers an end-to-end online application process. The 5-step process takes less than 10 minutes and can be completed on laptops, mobile phones, or tablets. While existing customers only need to verify their details, new customers can save considerable time thanks to the online KYC process. Subsequently, payments can also be made using net banking or UPI. With all these benefits of the Bajaj Finance FD for senior citizens at your disposal, this is an ideal instrument during your golden years. To get started with this FD and avail of some of the best-fixed deposit rates in India, you no longer have to visit a branch physically. All you have to do is invest online in just a few clicks and book the deposit via net banking or UPI. The process is quick, easy, and time-efficient! Disclaimer: This content is distributed by Bajaj Finserv. No HT journalist is involved in creation of this content. "
Updated: 26 Apr 2022,Bajaj Finance FD interest rate increases by 60 basis points up to 7.35% pa,https://www.livemint.com/brand-stories/bajaj-finance-fd-interest-rate-increases-by-60-basis-points-up-to-7-35-pa-11650960831799.html,"Bajaj Finance, India’s second-largest non-banking finance company, has increased its deposit rates by 60 basis points. The sharpest increase is for the 22 month period, where an investor who earned 5.65% p.a. earlier will not be able to enjoy 6.25% p.a. For a 44-month deposit, it will now pay 7.1% p.a. as against 6.8% p.a. earlier. Senior citizens get an additional 0.25% higher interest rate than the specified rates. The new fixed deposit rates are valid for all FD investments done after 25th April 2022. The FD interest rate has been increased for all categories of investors and tenures, resulting in quicker growth of one’s investment. The rise in the interest rate is applicable on all deposits made on or after 25th April 2022. Take a quick look at all the features a Bajaj Finance Fixed Deposit investment offers. 1. Increased FD rates: In recent years, fixed deposits have been considered a relatively slow investment instrument. However, this isn’t the case with Bajaj Finance Fixed Deposits. Bajaj Finance promises a higher return with an FD rate of 7.35% than most other banks. Customers below 60 years can earn 6.40% for 24-35 months and 6.90% if they choose a tenor of 36-60 months.  The rate change also impacts the senior citizens, who can now earn up to 7.15%p.a. for 36-60 months and 6.65% p.a. for 24-35 months.  2. Special FD interest rates: Bajaj Finance Fixed Deposits has also included special interest rates for all customers. With special interest rates, one can now choose specific tenors to enjoy interest rates up to 7.35% p.a. For a tenure of 44 months, customers below 60 years of age can enjoy an interest rate of 7.1% p.a., while senior citizens can earn up to 7.35% p.a. For senior citizens, the applicable special interest rates are: 3. Invest safely: While some other forms of investments promise better returns, they come with a serious caveat of market fluctuations. A fixed deposit, however, is a considerably secure mode of investment. Moreover, Bajaj Finance also flaunts a high safety rating with the FAAA and MAAA certifications by CRISIL and ICRA, respectively. 4. 100% online process: Bajaj Finance online FD offers an end-to-end online application process. The 5-step process takes less than 10 minutes and can be completed on laptops, mobile phones, or tablets. While existing customers only need to verify their details, new customers can save considerable time thanks to the online KYC process. Subsequently, payments can also be made using net banking or UPI. 5. Periodic payouts: Bajaj Finance allows one to opt for regular payouts of the accrued interest. Investors can choose from four payout options – monthly, quarterly, half-yearly or yearly. Senior citizens who need funds periodically benefit hugely from this feature. 6. Periodic savings: Bajaj Finance also offers a Systematic Deposit Plan (SDP) for those who prefer to save small and periodic amounts to meet larger financial goals. Bajaj Finance also provides a Systematic Deposit Plan (SDP). Unlike a regular fixed deposit, where one must invest a lump sum amount, an SDP gives the freedom of making stable monthly savings. Customers can invest a minimum of ₹5,000 every month for 6 to 48 months. About Bajaj Finance Limited Bajaj Finance Limited, the lending company of the Bajaj Finserv group, is one of the most diversified NBFCs in the Indian market, catering to more than 44 million customers across the country. Headquartered in Pune, the company’s product offering includes Consumer Durable Loans, Lifestyle Finance, Digital Product Finance, Personal Loans, Loan against Property, Small Business Loans, Home loans, Credit Cards, Two-wheeler and Three-wheeler Loans, Commercial lending/SME Loans, Loan against Securities and Rural Finance which includes Gold Loans and Vehicle Refinancing Loans along with Fixed Deposits. Bajaj Finance Limited prides itself on holding the highest credit rating of FAAA/Stable for any NBFC in the country today. To know more, please visit: https://www.bajajfinserv.in Disclaimer: This content is distributed by Bajaj Finserv. No HT journalist is involved in creation of this content."
