article_time,article_title,article_link,article_content
Updated: 16 Feb 2022,NSE Indices launches Nifty Housing Index,https://www.livemint.com/market/nse-indices-launches-nifty-housing-index-11645001656541.html,"NSE Indices Limited launched a new index, Nifty Housing Index. The index aims to track the performance of portfolio of stocks that broadly represent the housing theme within basic industries like cement and cement products, paints, housing finance, banks, home appliances and housewares etc. This is different from Nifty Realty Index, which is designed to reflect the performance of real estate companies that are primarily engaged into construction of residential and commercial properties. The index comprises of a maximum of 50 companies. Stocks part of the Nifty 500 at the time of review are eligible for inclusion in the index. Top constituents of the Nifty Housing Index by weightage as on January 31, 2022 include Larsen & Toubro Ltd (9.92%) Asian Paints Ltd. (8.70%) HDFC Bank Ltd. (6.64%), ICICI Bank Ltd (5.59%), Tata Steel Ltd. (5.28%) UltraTech Cement Ltd. (5.10%), Housing Development Finance Corporation (4.65%), Adani Green Energy Ltd. (4.14%) NTPC Ltd. (4.13%) Grasim Industries Ltd. (3.97%). The stocks are selected based on their 6-month average free-float market capitalization as on the cut-off dates at the end of January and July. In terms of sector weightage, top sectors exposure of the index include financial services (25.83%), consumer goods (17.30%), cement & cement products (16.11%), construction (13.28%), power (11.38%), metals (10.93%), oil & gas (5.18%). While sector weights are capped at 25% each, stocks weights are capped at 10% each. The Index is reconstituted semi-annually along with Nifty broad-based indices. The index is expected to act as a benchmark for asset managers and be a reference index tracked by funds in the form of exchange traded funds (ETFs), index funds and structured products. The base date for the index is April 01, 2005 and base value is 1,000.   "
Updated: 09 Feb 2022,L&T construction arm bags order in Bangladesh,https://www.livemint.com/companies/news/lt-construction-arm-bags-order-in-bangladesh-11644401122049.html,"NEW DELHI: Larsen & Toubro (L&T) on Wednesday said its construction subsidiary has bagged a ""significantorder to construct hi-tech IT parks at eight locations across Bangladesh. This project is being funded by the Indian EXIM Bank and is the first IT and office space order that L&T has secured in the neighbouring country. L&T classifies orders worth between ₹1,000 crore and ₹2,500 crore as significant. The scope of the work for the project comprises procurement and construction of seven-storied structural steel buildings at all eight locations, with a built-up area of 1.2 million sq.ft. It also includes lift, electrical, fire fighting system and public health engineering among others. The eight locations are - Rangpur, Natore, Jamalpur, Mymensingh, Dhaka, Khulna, Gopalganj, and Barishal districts of Bangladesh. The project is scheduled to be completed within stringent timelines, as per a company statement."
Updated: 09 Feb 2022,L&T's construction arm bags significant orders in Bangladesh,https://www.livemint.com/companies/news/lts-construction-arm-bags-significant-orders-in-bangladesh-11644400382424.html,"Engineering and infrastructure major Larsen & Toubro's construction arm has secured significant orders to construct Hi-Tech IT Parks in Bangladesh, according to an exchange filing. The construction arm of L&T has secured an order from the Bangladesh Hi-Tech Park Authority to construct Hi-Tech IT Parks at 8 locations (2 packages at 4 locations each) across Bangladesh, the company said in a filing. This project, funded by the Indian Exim Bank, and is the first IT and office space order that L&T has secured in Bangladesh. The major scope of work for the project comprises procurement and construction of seven storied structural steel buildings at all 8 locations with BUA of 1.2 million sq. ft. including civil, finishes, facade and electromechanical works with LEED Gold rating. The scope also includes HVAC, Lift, Electrical, Fire Fighting System, Public Health Engineering, Networking &. Security System, Building Management System, Site Development, Road, Boundary wall, Landscaping, Arboriculture etc. - The project locations are in Rangpur, Natore, Jamalpur, Mymensingh, Dhaka, Khulna, Gopalganj and Barishal districts of Bangladesh. The project is scheduled to be completed within stringent timelines."
Updated: 28 Jan 2022,"L&T’s net profit declines 17% to ₹2,055 cr; misses estimate",https://www.livemint.com/companies/news/lts-net-profit-declines-17-to-2-055-cr-misses-estimate-11643391763240.html,"MUMBAI : Larsen & Toubro Ltd on Friday said its consolidated net profit in the December quarter (Q3FY22) fell 17% from a year earlier to ₹2,055 crore, missing analysts’ estimates. The decline is largely due to the higher base in the year-ago quarter, which included the sale of commercial property in the realty business, and gains on divestment from discontinued operations of the electrical and automation business, the country’s largest infrastructure company said in a statement. Costlier fuel and raw materials also hurt the company. “During the quarter in question, we also had to deal with worrisome inflation. We also had to adjust to the new supply-chain protocols and the logistics constraints in the pandemic. And while these were challenges that the company was dealing with, there were opportunities as well in the form of rising demand, particularly post-festive season,"" said R. Shankar Raman, chief financial officer. L&T, however, reported an 11% yearly growth in consolidated revenues to ₹39,563 crore during the December quarter. “The increase reflects an improving project execution momentum and robust growth in the IT&TS (information technology and technology services) portfolio,"" the statement said. The company won new orders worth ₹50,359 crore during the quarter, down 31% from the previous year, but still above the highest analyst estimates of ₹45,000 crore. L&T said its order book at the end of the quarter stood at a record ₹3.4 trillion. The company, Raman added, is trying to stagger purchases of commodities to maintain margins as it has around 25% exposure to commodities that is subject to price volatility. The group sees an order pipeline of about ₹4 trillion at the end of the current quarter and is “trying to stay as close to"" to its low-to-mid-teen growth guidance for order inflows for FY22, Raman said. The infrastructure segment, the biggest contributor to the company’s revenues, saw sales rise 15.9% from a year earlier to ₹18,345 crore. Operating margin widened 90 basis points to 7.2%, indicating higher operating leverage. The power segment also reported strong growth for the reported quarter at 19% to ₹1,066 crore, while the segment’s operating margin expanded 220 basis points to 4.2%. The hydrocarbon segment, L&T’s third-biggest contributor to revenues, saw a growth of 11% to ₹ 4,880 crore. “With consumer confidence gradually returning, the aggregate demand conditions point towards a sustained recovery,"" the company said, and added that growth could be marred by higher commodity prices and intermittent supply-side constraints. “The global macroeconomic environment is likely to slow down with vaccine inequality and rapid spread of the Omicron variant. The world’s largest economies are expected to see a delay in the recovery process with deceleration in activity, diminished fiscal support, rising inflation, and lingering supply bottlenecks,"" the company said. Shares of Larsen & Toubro ended 0.7% lower at ₹1,897.90 on the National Stock Exchange."
Updated: 28 Jan 2022,L&T subsidiary secures contract to develop ONGC’s 350 km sub-sea pipelines,https://www.livemint.com/companies/news/lt-subsidiary-secures-contract-to-develop-ongc-s-350-km-sub-sea-pipelines-11643354684376.html,"NEW DELHI: L&T Hydrocarbon Engineering, a subsidiary of engineering major Larsen & Toubro, has secured an order valued between ₹2,500 crore and ₹5,000 crore to develop ONGC’s 350 km sub-sea pipelines in India’s west coast. The contract involves engineering, procurement, construction, installation and commissioning of the sub-sea pipelines and related offshore works as part of ONGC’s seventh development phase of its Pipeline Replacement Projects. “The EPCIC contract involves Engineering, Procurement, Construction, Installation and Commissioning of ~ 350 kms sub-sea pipelines and related offshore works spread out across India’s west coast offshore fields of ONGC,"" L&T said Organised under Offshore, Onshore, Construction Services, Modular Fabrication and Advanced Value Engineering & Technology (AdVENT) verticals, L&T Hydrocarbon Engineering offers integrated design-to-build solutions across the hydrocarbon sector to domestic and international customers, L&T said in a statement.  L&T shares traded 1.2% higher at ₹1,933.85 apiece on the BSE."
Updated: 19 Jan 2022,"Stocks to Watch: RIL, Bajaj Fin, Airtel, Axis Bank, ICICI Prudential Life",https://www.livemint.com/market/stock-market-news/stocks-to-watch-ril-bajaj-fin-airtel-axis-bank-icici-prudential-life-11642534691542.html,"Here is the list of the top 10 stocks that are likely to be in focus on Wednesday: Reliance: Reliance Industries Ltd’s retail arm has purchased a 55.7% stake in Addverb Technologies, a Noida-based robotics company, for $132 million. Post the transaction, Reliance Retail Ventures Ltd (RRVL) will have four directors on the board of Addverb of a total of nine directors, according to Sangeet Kumar, co-founder and chief executive of Addverb Technologies. Meanwhile, the Indian retailer has called for tighter regulation of marketplace e-commerce platforms to ensure such websites treat all sellers equally, four sources had told Reuters. Bajaj Finance: Consumer financier Bajaj Finance Ltd on Tuesday reported an 85% year-on-year (y-o-y) rise in consolidated net profit to ₹2,125 crore for the three months to December, owing to higher interest income. Net interest income (NII) increased 40% to ₹6,000 crore in the December quarter of FY22, as against ₹4,296 crore in Q3 of the previous financial year. Interest income reversal for the quarter was ₹241 crore as compared to ₹450 crore in Q3 FY21. To be sure, the company said that the financials are not strictly comparable on a year-on-year (y-o-y) basis due to dislocation caused by the pandemic last year. Axis Bank: Axis Bank’s subsidiary has demanded promoters of Zee Entertainment to repay its loans, failing which it has threated to drag them to court and also write to the market regulator. This latest salvo from Axis Finance comes after Zee and Sony are looking at regulatory bodies to stamp their approval on the proposed merger. Bharti Airtel: Reliance Jio has added mobile subscribers in the month of November, while Vodafone Idea continued to lose its subscriber base, according to the data released by Telecom Regulatory Authority of India (Trai). Reliance Jio has added 20 lakh mobile subscribers in November, taking the total base to 42.8 crore at the end of the month. Meanwhile, Bharti Airtel has gained 13 lakh subscribers for the reporting month and its total customer base stood at 35.5 crore. Max Healthcare: Max Healthcare Institute Ltd, India’s second-largest hospital chain operator, plans to invest $450 million ( ₹3,346 crore) over the next four years as it gears up to add capacity after the country’s health care system last year was overwhelmed by the covid-19 pandemic. AU Small Finance Bank: Small Industries Development Bank of India (Sidbi) on Tuesday said it has sanctioned financial assistance of ₹650 crore to AU Small Finance Bank and Jana Small Finance Bank. The idea is to reach out, through the SFBs, to small-sized non-banking financial companies (NBFCs), microfinance institutions (MFIs) who in turn provide financial assistance to the small businesses and micro entrepreneurs. ICICI Prudential Life: The company on Tuesday reported a marginal two per cent year-on-year growth in its net income to ₹311 crore for the December 2021 quarter, on higher sales of policies. The company has reported a 20 per cent growth in the value of the new business to ₹515 crore, while margins rose to 26.7 per cent in the quarter. Dixon Tech: Contract manufacturer Dixon Technologies (India) Ltd has entered into an equal joint venture with Imagine Marketing Pvt. Ltd, the owner of the boAt brand, to design and make wireless audio devices as the company boosts local production ahead of its initial public offering. The joint venture is targeting a revenue of ₹1,000 crore in the next four years, said top executives at the two companies. The move will help Imagine Marketing shift a significant part of its production base from China to India. Trident Ltd: Textiles company Trident Ltd today reported an 88% jump in consolidated net profit at ₹211 crore for the third quarter ended in December 2021. It was ₹112 crore in the same quarter of last year. The company's consolidated total income during the period under review stood at ₹1,983 crore as against ₹1,308 crore in the same quarter a year ago. Tata Elxsi: The company on Tuesday said its net profit increased 43.5 per cent to ₹151 crore in December quarter 2021-22. The company is among the world’s leading design and technology services providers across industries, including Automotive, Broadcast, Communications, Healthcare, and Transportation. It had registered a net profit of ₹105.2 crore in the year-ago period, Tata Elxsi said in a regulatory filing."
Updated: 17 Jan 2022,L&T dispatches critical reactors to US for renewable diesel project,https://www.livemint.com/companies/news/lt-dispatches-critical-reactors-to-us-for-renewable-diesel-project-11642422006264.html,"The heavy engineering arm of Larsen & Toubro has flagged off five critical renewable diesel reactors to North America’s largest renewable diesel producer Diamond Green Diesel (DGD), two weeks ahead of the delivery date. DGD is a joint venture of Darling Ingredients Inc. and Valero Energy Corporation in Texas, US. L&T is executing additional three such green diesel projects for the US and European clients at its fully integrated, state-of-the-art, digitally-enabled heavy engineering complex located at Hazira in Gujarat. The reactors manufactured by L&T will process biomass (recycled animal fats, used cooking oil and inedible corn oil) to make green diesel. Renewable diesel can be used without modifications to existing diesel engines. It will reduce greenhouse gas emissions by up to 80% compared with conventional diesel fuel, a company statement said. Anil Parab, member – L&T Executive Committee, senior VP & head, heavy engineering said, “We thank DGD for entrusting L&T with this opportunity to supply these critical Reactors. India was hit hard with the second wave of COVID19 during the execution of this fast-track delivery project. Despite the problems, we adhered to on-time delivery."" This critical technology is expected to open new opportunities and help the client to meet the objective of low-carbon emissions. The successful execution of such renewable energy projects is a part of L&T’s strategy to widen its green business portfolio, guided by its ESG (Environment, Social and Governance) framework."
Updated: 14 Dec 2021,L&T Infotech opens new delivery centre in Hyderabad for digital solutions,https://www.livemint.com/companies/news/lt-infotech-opens-new-delivery-centre-in-hyderabad-for-digital-solutions-11639475266094.html,"Mid-sized IT services company Larsen & Toubro Infotech Ltd (LTI) has set up a new delivery centre in Hyderabad, designed and equipped to house over 3,000 employees and support the company’s global operations. The centre will focus on delivering digital, data, and cloud solutions to global clients. “The facility hosts new-age amenities related to the safety, security, and overall wellbeing of employees,"" the company said in a statement. “The city of Hyderabad has a special place in the global technology space that is further complemented by the vast talent pool and encouraging support by the government. LTI’s new centre in the city will strengthen our operations and play a critical role in our growth aspirations,"" said Nachiket Deshpande, chief operating officer, LTI. LTI also signed a memorandum of understanding (MoU) with the Indian School of Business, Hyderabad, to conduct research on Digital Readiness. This Digital Readiness Index will serve as a tool to assess the state of digitization in enterprises. With operations in 33 countries, LTI helps clients accelerate their digital transformation with Mosaic, its integrated digital platform encompassing mobile, social, analytics, internet of things (IoT) and cloud."
Updated: 12 Dec 2021,L&T Infotech stock: Priced to perfection,https://www.livemint.com/market/mark-to-market/lt-infotech-stock-priced-to-perfection-11639329750550.html,"Larsen & Toubro Infotech Ltd (LTI), a mid-cap information technology services provider, foresees robust demand conditions driving broad-based growth for the company over the next few years. The next leg of revenue growth will be driven by cloud, data and digital services, the management said at its recent analyst meeting. LTI’s cloud offering aLTIus is already seeing strong traction, according to the company’s management. More than 40% of LTI’s portfolio comprises cloud, data and digital products. Over the past five years, LTI’s cloud segment has seen eight-fold growth. The company is hopeful of meeting the $1 billion revenue target from the cloud business.           "
Updated: 10 Dec 2021,"LTI stock down 1.6% as management cautious of near-term, supply-side pressures",https://www.livemint.com/market/mark-to-market/lti-stock-down-1-6-as-management-cautious-of-near-term-supply-side-pressures-11639112268490.html,"Midcap stock Larsen & Toubro Infotech (LTI) is once again on the radar screens of investors after its management said that it remains confident of cloud, data and digital services to drive revenue growth, at a recently held analyst meet. Sharing its growth plan, the management aims to boost its revenues by mining existing clients and investing in new high potential verticals and markets, among other measures. Demand continues to be strong across all verticals, markets and service lines with a new large deal pipeline at USD 2.07 billion, a growth of 9% year-on-year (y-o-y), the management said. The management added that demand is shifting towards medium-sized short cycle deals, which is driven by discretionary spends. Further, the LTI retained its margin guidance at 14-15% and said that the company continues to focus on reinvesting to capture incremental market share rather than the margin uptick. “We see this as an indication of the company’s willingness to absorb pricing pressure, unlike peer commentary on price hikes,"" analysts at Motilal Oswal Financial Services Ltd said in a report. While the demand outlook remains robust, the shortage of talent is still a pain point for the sector and the company. It should be noted that despite massive hiring in the recent quarters, the company’s management cautioned that the supply side is a near-term concern and it expects the situation to ease over the next four-six quarters. This could be one reason why shares of the company fell around 1.6% on the NSE in Friday's opening trade. Meanwhile, in the last year, the LTI stock’s price has almost doubled with 99% returns, comfortably beating the Nifty IT index, which is up nearly 57% in the same span. Analysts say, the sharp uptick in the stock captures most positives and has led to a sharp valuation re-rating. At a one-year forward price-to-earnings, the LTI stock is trading at a multiple of around 45 times. The stock is much more expensive than some largecap technology peers such as Tata Consultancy Services Ltd."
Updated: 08 Dec 2021,L&T inks deal with Aramco for mfg facility,https://www.livemint.com/companies/news/aramco-l-t-in-pact-to-develop-manufacturing-capabilities-in-saudi-arabia-11638868674100.html,"Larsen and Toubro (L&T) has signed an initial agreement with the Saudi Arabian Oil Company (Aramco) to develop manufacturing capabilities in Saudi Arabia. Under the plan, Larsen will build the region’s first Heavy Wall Pressure Vessels facility at Saudi Arabia’s strategically located Jubail Industrial City, the companies said in a joint statement on Tuesday. The pact is in line with the Aramco Namaat programme, started in September, which aims to tap into the vast opportunities in Saudi Arabia to create value, and also drive economic expansion and diversification. “This manufacturing facility, once completed, will provide a large number of skilled job opportunities for Saudi youth, localize the “know-how"" of heavy wall vessels in the Kingdom, and deploy the latest manufacturing technologies to serve the Kingdom and MENA region. We expect this facility to help Aramco and others in the Kingdom to increase localization and optimize capital cost,"" said Ahmed Sa’adi, Aramco’s senior vice-president of technical services. L&T will now start building the new facility, with production expected to commence by the third quarter of 2022. Spread over 120,000 sq. m., the facility aims to produce critical equipment for several industries such as power and oil and gas. “We believe this is another significant milestone for L&T in the Kingdom and a strong testimony to our commitment to the development of the region. We wish to express our gratitude to Saudi Aramco for their guidance and support in the Kingdom,"" said S.N. Subrahmanyan, L&T’s chief executive."
Updated: 08 Dec 2021,L&T inks deal with Aramco for mfg facility,https://www.livemint.com/companies/news/aramco-l-t-in-pact-to-develop-manufacturing-capabilities-in-saudi-arabia-11638868674100.html,"Larsen and Toubro (L&T) has signed an initial agreement with the Saudi Arabian Oil Company (Aramco) to develop manufacturing capabilities in Saudi Arabia. Under the plan, Larsen will build the region’s first Heavy Wall Pressure Vessels facility at Saudi Arabia’s strategically located Jubail Industrial City, the companies said in a joint statement on Tuesday. The pact is in line with the Aramco Namaat programme, started in September, which aims to tap into the vast opportunities in Saudi Arabia to create value, and also drive economic expansion and diversification. “This manufacturing facility, once completed, will provide a large number of skilled job opportunities for Saudi youth, localize the “know-how"" of heavy wall vessels in the Kingdom, and deploy the latest manufacturing technologies to serve the Kingdom and MENA region. We expect this facility to help Aramco and others in the Kingdom to increase localization and optimize capital cost,"" said Ahmed Sa’adi, Aramco’s senior vice-president of technical services. L&T will now start building the new facility, with production expected to commence by the third quarter of 2022. Spread over 120,000 sq. m., the facility aims to produce critical equipment for several industries such as power and oil and gas. “We believe this is another significant milestone for L&T in the Kingdom and a strong testimony to our commitment to the development of the region. We wish to express our gratitude to Saudi Aramco for their guidance and support in the Kingdom,"" said S.N. Subrahmanyan, L&T’s chief executive."
Updated: 07 Dec 2021,L&T inks deal with Aramco for mfg facility,https://www.livemint.com/companies/news/aramco-l-t-in-pact-to-develop-manufacturing-capabilities-in-saudi-arabia-11638868674100.html,"Larsen and Toubro (L&T) has signed an initial agreement with the Saudi Arabian Oil Company (Aramco) to develop manufacturing capabilities in Saudi Arabia. Under the plan, Larsen will build the region’s first Heavy Wall Pressure Vessels facility at Saudi Arabia’s strategically located Jubail Industrial City, the companies said in a joint statement on Tuesday. The pact is in line with the Aramco Namaat programme, started in September, which aims to tap into the vast opportunities in Saudi Arabia to create value, and also drive economic expansion and diversification. “This manufacturing facility, once completed, will provide a large number of skilled job opportunities for Saudi youth, localize the “know-how"" of heavy wall vessels in the Kingdom, and deploy the latest manufacturing technologies to serve the Kingdom and MENA region. We expect this facility to help Aramco and others in the Kingdom to increase localization and optimize capital cost,"" said Ahmed Sa’adi, Aramco’s senior vice-president of technical services. L&T will now start building the new facility, with production expected to commence by the third quarter of 2022. Spread over 120,000 sq. m., the facility aims to produce critical equipment for several industries such as power and oil and gas. “We believe this is another significant milestone for L&T in the Kingdom and a strong testimony to our commitment to the development of the region. We wish to express our gratitude to Saudi Aramco for their guidance and support in the Kingdom,"" said S.N. Subrahmanyan, L&T’s chief executive."
