article_time,article_title,article_link,article_content
05:53 AM IST,TCS Q1 profit misses estimates on costs,https://www.livemint.com/companies/news/tcs-q1-profit-misses-estimates-on-costs-11657301814159.html,"Tata Consultancy Services Ltd (TCS) reported a 5.2% rise in quarterly profit from a year earlier, missing analysts’ estimate, as rising employee costs squeezed earnings even as demand remained robust. The Mumbai-based company’s net profit rose to ₹9,478 crore in the quarter ended 30 June from ₹9,008 crore in the year ago. However, that trailed the ₹9,907 crore consensus profit estimate in a Bloomberg survey. Revenue for the June quarter grew 16.2% from a year ago to ₹52,758 crore on the back of broad-based growth, in line with the consensus Bloomberg estimate of ₹52,491 crore. “We are starting the new fiscal on a strong note, with all-round growth and strong deal wins across all our segments. Pipeline velocity and deal closures continue to be strong, but we remain vigilant given the macro-level uncertainties. Looking ahead, we remain confident in the resilience of technology spending and the secular tailwinds driving our growth,"" said Rajesh Gopinathan, chief executive officer and managing director of TCS. The macro-level uncertainties that Gopinathan refers to relate to possible recessions in the US and Europe, where central banks are raising interest rates aggressively to tame red-hot inflation. Indian software services companies, which generate more than 90% of their revenues from these regions, may see sharp cuts in IT spending by clients located in these nations if the rate hikes tips their economies into a recession. If clients indeed scale back spending, it will come after two pandemic years of robust demand for digital and cloud computing services as companies scrambled to digitize their operations. Some analysts fear peak revenue growth for IT services companies is likely behind them, and the momentum is expected to start softening from the second half of the fiscal year because of fewer large deals and clients postponing spending. In addition, margins are under pressure due to wage hikes, higher hiring costs, and increased travel, visa, and other discretionary expenses. However, researcher Gartner expects IT spending to remain strong in the second half of the calendar year. “Gartner projects that overall IT services spending will grow at 6.2% in 2022. Despite the macroeconomic uncertainties, Gartner believes that overall IT demand will remain robust for the second half of 2022,"" said Naveen Mishra, senior director analyst at Gartner. TCS’s operating margin contracted to 23.1% from 25.5% in the year-ago period due to “annual salary increase, the elevated cost of managing the talent churn, and gradually normalizing travel expenses,"" said Samir Seksaria, chief financial officer, TCS. He told reporters that TCS would use better workforce utilization, growth, and other operational efficiencies to get back to the optimum level of margins. The dollar revenue for the June quarter grew 15.5% in constant currency terms from a year earlier to $6.8 billion amid an order book worth $8.2 billion. In terms of industries, growth was led by retail and consumer packaged goods (25.1%), followed by communications and media (19.6%), manufacturing (16.4%), and technology and services (16.4%). The banking, financial services and insurance (BFSI) sector, the largest vertical for TCS, grew 13.9%, while life sciences and healthcare grew 11.9%. Analysts believe TCS is likely to be one of the key beneficiaries of the medium-term uptrend in technology spending. “We expect TCS to gain market share on the back of vendor consolidation and captive monetization efforts. However, moderation in Ebit margin and lower order book would reduce the pace of earnings growth going ahead and may lead to a downward revision to valuation multiple,"" said Mitul Shah, head of research at Reliance Securities. On a trailing 12-month basis, the attrition rate increased to 19.7% in the June quarter from 8.6% in the year-ago period, indicating a growing demand for tech talent in the industry, especially in digital skills. The company added 14,136 employees during the quarter, taking the total headcount to 606,331. TCS declared its earnings after the end of trading on Friday. Ahead of its results, the shares fell 0.67% to ₹3,264.85 on BSE."
Updated: 30 Jun 2022,Can Indian IT giants avoid the breakups done by IBM and Atos?,https://www.livemint.com/industry/infotech/can-indian-it-giants-avoid-the-breakups-done-by-ibm-and-atos-11656555677672.html,"A breakup is one outcome for those in an unhappy relationship. Businesses too separate when they struggle to grow. Earlier this month, more than two decades after it was founded by a string of mergers, Atos Se, the French technology services firm, decided to carve out its profitable big data and cyber security division from its mainstay IT infrastructure business. Atos will oversee the legacy business, which ended with €5.4 billion in revenue last year while the fast-growing, digital business, with €4.9 billion in revenue will be clubbed under a new company, Evidian. Atos is not the first technology services firm that has been forced to restructure its business. In 2017, Computer Sciences Corp. and Hewlett-Packard Enterprises’ agreed to merge and form a new company, DXC Technology Co. It had $25.4 billion in revenue.                       "
Updated: 25 Jun 2022,"TCS invites application for 2022 Internship Program. Eligibility, link here",https://www.livemint.com/news/india/tcs-invites-application-for-2022-internship-program-check-eligibility-direct-link-other-details-here-11656163228170.html,"IT service provider Tata Consultancy Services (TCS) has invited applications for internship in the field of research for Computer Sciences. The TCS Internship 2022 Program has been announced and is currently accepting applications for the same.  The company in its official statement for TCS Internship 2022 Program has said, “If you have a consistent, shining academic record, coupled with a passion for R&D, come join us to conduct research in an industrial R&D environment and solve industry-scale problems under the supervision of senior researchers."" TCS is recognized as a Global Exchange Partner of AIESEC. ACE Program provides career development opportunities for more than 200 AISEC interns annually. Check further details to apply for the internship here Eligibility Students or scholars pursuing Ph.D, MS, M Tech or are in the final year of BE or B Tech with an aptitude for research in any area of computer science can apply.  Master’s and Ph.D. students from premier institutes in the fields of psychology, sociology, economics, mathematics, game design, and organisational behavior may also apply. Where to apply If you are interested, please Click Here and fill the form, or for any queries write to careers.research@tcs.com Internship period The internships can vary from six to eight weeks (short internships) or 16 to 18 weeks (long internships), with an option of tailoring the duration in certain cases. The areas of responsibility for Interns Include; -Creation of R&D-related assets -Define research problems and design solutions for them -Develop prototype solutions by applying industry-scale data -Publish research papers in top-tier conferences and journals -Research Execution -Perform literature survey and identify opportunities and challenges -Execute proofs of concept -Contribute to the development of tools and products -Learning and Development -Learn about emerging trends and technologies in industrial research -Define the challenges involved in applied research -Articulate research problems and systematically design solutions  "
Updated: 24 Jun 2022,"Top largecap, midcap, smallcap Indian IT stock picks as suggested by brokerages",https://www.livemint.com/market/stock-market-news/stocks-to-buy-here-are-top-largecap-midcap-smallcap-indian-it-stock-picks-recommended-by-brokerages-11656063308791.html,"Indian IT stocks have recently been under pressure amid the current market selloff. Recession fears leading to possible reductions in IT spending by clients has also dampened the sentiment of the investors. Recently, various global brokerage and research firms have downgraded Indian IT sector, and also trimmed earnings estimates for FY23. Domestic brokerage and research firm Edelweiss in its latest report on IT said that it prefers HCL Tech, Infosys and Tata Consultancy Services (TCS) among the large-caps and Coforge, LTI and Mindtree among midcap IT stocks. Among small caps, it prefers Zensar Tech, Birlasoft and Firstsource Solutions. Accenture’s strong performance and solid commentary supports brokerage Edelweiss' thesis of a robust tech upcycle. “Its outsourcing growth remains high and bookings also remain strong, which bodes well for Indian IT services companies,"" it said in a note. Analysts at brokerage JM Financial said that Accenture’s results confirm the ‘All’s well for now’ thesis for Indian techs despite increasing concerns of hit on IT spending given a weak macro set up. “Our channel checks also suggest that demand is holding up well for Indian techs for now with the likely macro set up expected to benefit offshore techs, albeit with a lag."" Infosys and HCL Tech are the brokerage's top stock picks amongst Tier I techs, while Mphasis, Persistent Systems amongst Tier II ‘s and Zen Tech and Firstsource amongst small caps. “While supply-side challenges remain a point of concern, with elevated attrition and lower headcount addition, Accenture's margin guidance implies a stable margin performance in FY23. While strong revenue growth and commentary on the pipeline is positive for the IT Services sector, weak employee addition (lowest in the last six quarters) and moderation in deal bookings (-13% QoQ) should dampen the demand outlook,"" said another brokerage Motilal Oswal. The brokerage has maintained its positive stance on the IT sector as it expects sustained growth with stable margin. Infosys, HCL Tech, and TCS remain its preferred stock picks within the Tier I IT space. The views and recommendations made above are those of individual analysts or broking companies, and not of Mint."
Updated: 20 Jun 2022,Fired TCS employee gets back his job after 7-year battle,https://www.livemint.com/news/india/fired-tcs-thirumalai-selvan-gets-back-his-job-after-7-year-battle-read-his-story-here-11655717066600.html,"Sacked in 2015, did freelance work as software consultant and a real estate broker, fought  a court case and now 48 year old Thirumalai Selvan can sigh a heave of relief when a Chennai court has ruled that Tata Consultancy Services should pay him his salary and benefits of seven years in full. That's right, the Chennai court ordered TCS to pay Selvan his complete salary for the past seven years and reinstate him into the company.  Read the story here. Thirumalai Selvan had worked for TCS, an information technology company for eight years before he became a victim of the mass layoffs in 2015.  Selvan was asked to leave citing poor performance, wherein the information Technology company said his performance was not up to its expectations. Selvan then approached the court seeking continuity of service. Selvan served on a managerial position in the company. After the layoff, he was forced to look for freelance jobs. As a software consultant and a real estate broker, Selvan managed to earn ₹10,000th per month. His family depended on savings and his wife’s salary. TCS in their argument stated that Selvan was working in a managerial cadre and would not come under the category of ‘workman’. However, C Kumarappan, Principal Labour Court’s presiding officer said, “The reason for not mentioning the petitioner’s other duties is nothing but a subterfuge, to camouflage his principal nature of duty"". The court observed that Selvan’s primary role was that of a skilled worker. Adding to Selvan’s financial troubles were legal hassles. “I would have travelled to the court more than 150 times in the last seven years,"" he told DT Next. After spending seven years, the Chennai court ruled in his favour. It refuted TCS’ argument that Selvan belonged to the managerial cadre and was not a workman -- someone with a specified skill. The Forum for IT Employees (FITE), that helped Selvan in his court case, celebrated the judgement. “Justice anywhere is hope everywhere and a reminder to all who are forcing employees to resign,"" the group was quoted as saying by the Federal website. “Great work done by Team FITE Chennai and salute to the TCS employee who fought for justice."" A mechanical engineer by graduation, Selvan worked in his core sector for four years before switching to the software lane in 2001. He became a part of TCS as an assistant systems engineer in 2006. Meanwhile, share of the top Indian IT company Tata Consultancy Services (TCS) have fallen sharply amid the current market volatility and the IT stocks are trading near their respective 52-week low levels. TCS shares are down about 18% in 2022 so far whereas that of Infosys have fallen more than 25% during the same period.  "
Updated: 17 Jun 2022,"Top stocks that HDFC, Axis, other mutual fund houses bet on last month",https://www.livemint.com/mutual-fund/mf-news/mutual-funds-top-stocks-that-hdfc-axis-kotak-mfs-and-other-amcs-bought-in-may-11655458553402.html,"In May, Mutual Funds (MFs) were seen adding stocks like HDFC Bank, Life Insurance Corporation of India (LIC), Reliance Industries (RIL) and Delhivery, whereas they slightly trimmed holdings in Kotak Mahindra Bank, Steel Authority of India (SAIL), UPL, and HDFC Life. The key midcap stocks additions Delhivery, Campus Activewear, Escorts Kubota and Jubilant Foodworks whereas key reductions in the midcap space were SAIL, Jindal Steel, Zydus Life, and Deepak Nitrite, data by Edelweiss showed. Under smallcap, top stocks that MFs added were Paradeep Phosphates, Prudent Corporate Advisory and Go Fashion whereas key reductions were GHCL, Intellect Design, Sobha, and CPCL. As per mutual fund houses' monthly activity analysed by brokerage Edelweiss, Aditya Birla Sun Life MF's major additions were Infosys, RIL and HDFC Bank. It's major reductions were Voltas, Pfizer, and Tata Motors, LIC and eMudhra were new entrants while Suven Pharma was a complete exit. HDFC AMC's large additions were HDFC Bank, Infosys and Tata Consultancy Services (TCS). It's prominent reductions were NTPC, Larsen & Toubro (L&T) and GAIL (India). LIC and Delhivery were new entrants while SJVN was a complete exit. Axis MF's prominent additions were Mahindra & Mahindra (M&M), LIC and Maruti Suzuki. It reduced TCS, State Bank of India (SBI) and Wipro. New entrants included LIC and Aether Industries while Emami was a complete exit. Kotak mutual fund's large additions were Infosys, Asian Paints and Tata Steel. It's prominent reductions included HDFC Bank, NTPC, and IOC. New entrants included LIC and Aether Industries while Apollo Tyres was a complete exit. ICICI Pru MF's major additions were Infosys, HDFC Bank, and LIC. The fund  reduced HDFC, Mahindra & Mahindra and ITC. LIC and Delhivery were new entrants while Wonderla Holiday was a complete exit. DSP MFs large additions were Maruti Suzuki, Bajaj Finance and Infosys. It's major reduce included UltraTech Cement, ICICI Pru Life and Axis Bank. Paradeep Phosphates and LIC were new entrants while complete exit included GMDC. Franklin Templeton MFs major additions were Reliance Inds, UltraTech Cem and LIC. The fund reduced exposure in Mahindra & Mahindra, BPCL and Bharti Airtel while Caplin Point Lab was a complete exit.  "
Updated: 09 Jun 2022,Telcos and tech cos at loggerheads on 5G private networks,https://www.livemint.com/industry/telecom/telcos-and-tech-cos-at-loggerheads-on-5g-private-networks-11654767817399.html,"NEW DELHI: Indian telecom operators and the Broadband India Forum (BIF) are at loggerheads over the issue of private entities being allowed to set up captive networks with direct allotment of 5G spectrum. The Forum, comprising members such as Tata Consultancy Services, Amazon, and Meta, among others, has said that private networks are revenue generators for the government and giving out 5G spectrum to set up private networks does not pose a security threat as the networks are closed and disconnected from public telecom networks. In a position paper, Broadband India Forum has emphasised that the government should have a forward-looking approach towards use and advancement of technology, while asking the Centre to earmark certain amount of exclusive spectrum for private 5G networks in each type of spectrum band. “Allow direct allocation of spectrum to enterprises/organisations at nominal administrative fee, as per global best practices,"" it said. “Facilitate a light-touch online portal based paperless regime for acquiring permission/license for ‘Captive Wireless Private Network (CWPN)’ within 30 days of application, (as recommended by Trai) to enable ease of doing business,"" the body led by technology companies has said. It has argued that private 5G networks were best set up by enterprises since public networks cannot deliver the levels of efficiencies required. It added that such networks would make for additional revenue streams for telcos and the government, since they will purchase the spectrum at a price fixed by the government and allocated administratively. The Forum noted that the perception that spectrum can be assigned only through auction is grossly inaccurate and misleading, referring to the Supreme Court guidelines on spectrum allocation issued in 2012. It also said that private 5G networks were not allowed for external communications and the need for lawful monitoring, interceptions and the possibility of threats to national security do not arise at all. Indian telcos, on the other hand, have written to the government against direct allocation of 5G airwaves to private companies as it will adversely impact the enterprise businesses of telecom companies and will leave no business case for the carriers to roll out 5G services. In a communication to telecom minister Ashwini Vaishnaw, the Cellular Operators Association of India (COAI) which represents Reliance Jio, Bharti Airtel and Vodafone Idea, has sought the government’s “urgent intervention"" to protect the interest of telcos. The association said giving away dedicated spectrum for private captive networks will hurt the financial health of the industry which is on the path of revival after the government’s relief package last year. “We request your urgent kind intervention in the matter so as to ensure that the interest of the TSPs as well the enterprise segment is efficiently catered to,"" the association said in a letter to the minister on Thursday. This comes in response to private companies such as Tata Consultancy Services seeking direct allocation of 5G spectrum, following recommendations of the Telecom Regulatory Authority of India (Trai) that had left it to the government to either license out the airwaves directly or through a leasing model via existing telcos. The telecom department has taken an internal view that telcos were best suited to provide the services to private companies, however a final decision on the matter is yet to be taken. The association had on Wednesday said in a position paper that there was no justification for allocating radiowaves directly to enterprises for operating private captive networks, and that licensed telecom companies are fully capable of providing all customised solutions in the most competitive and economic manner. “If independent entities set up private captive networks with direct 5G spectrum allotment by DoT, the business case of TSPs (telecom service providers) will get severely degraded... This will diminish the revenue so much that there will be no viable business case left for the TSPs and there will not remain any need for 5G Networks rollout by TSPs,"" the association said in the letter to the ministry sent on Thursday. “If private captive networks for enterprises are set up independently by other entities then this would mean dramatically altering the industry dynamics and hurting the financial health of the industry and will strike at the very heart of the business case,"" it further stated. The association has said that worldwide, statistically, wherever 5G has been rolled out, any consequent revenue increment has not come from the retail segment but rather only from the enterprise segment. It also argued that revenues of telcos are not going to increase from the retail segment despite very heavy capital investments for rollout of 5G networks, which will get accentuated further because of the high price-sensitivity of the market. “The new segment that would be benefitted by 5G services of the TSPs is the enterprise segment including manufacturing, logistics, education, hospitals, campuses, factories, etc. Our TSP members have also conducted successful 5G trials for many of these use cases in the last one year,"" the association said, noting that with 5G auctions, telcos were targeting the enterprise segment for revenue enhancement."
Updated: 06 Jun 2022,"TCS MBA recruitment 2022: Check eligibility criteria, process to register here",https://www.livemint.com/news/india/tcs-mba-hiring-2022-check-eligibility-criteria-process-to-register-here-11654512476303.html,"Tata's IT consultancy service provider Tata Consultancy Services has invited application for MBA freshers or graduates who are eligible to join the company for the financial year 2022-23.  The online portal for interested candidates to apply has been opened. However, the last date to apply is still unknown as it has not been mentioned. To register on the TCS Next Step Portal, click here TCS mentioned on its page, “TCS Management Hiring initiative is exclusively open for all management graduates who can join our workforce in FY 2022-23."" It further mentioned “he path to build a strong foundation to a remarkable career is now open for all PAN India candidates with Year of Passing (YOP) as 2020, 2021 and 2022 for permitted specializations only.""  “Our shared belief is that we can transform our global businesses for the better, with our innovative solutions. Every day, half a million of us strive to make a meaningful difference to our customers and communities. We look forward to achieving a lot more, with your passion and energy!"" the company's statement added. According to reports, TCS added 28,238 people in the third quarter, which included a mix of fresh engineering graduates and lateral hires with a consolidated headcount of over 5 lakhs with a diverse workforce comprising 147 nationalities. TCS has claimed that it hired over 1 lakh employees in FY22 and plans to hire over 40,000 freshers in the first quarter of the current fiscal year 2023. Currently, the company has 592,195 employees on its rolls with more than 200,000 women who made up 35.6% of its workforce. Eligibility Criteria: TCS Management (MBA) Hiring -TCS mentioned that candidates applying for the MBS recruitment drive should be minimum 18 years old, and maximum 28 years old. -Candidates should have done two years of full-time Master of Business Administration (MBA)/Master of Management Studies (MMS)/Post Graduate Diploma in Business Analytics (PGDBA)/Post Graduate Diploma in Management (PGDM) in marketing or finance or operations supply chain management or information technology or general management or business analytics or project management. -Candidates must be from Bachelor of Technology (B.Tech) background before pursuing MBA. -Students of 2020, 2021, and 2022 batches only are eligible. -Students should not have any backlogs at the time of appearing for the selection process. -The overall academic gap should not exceed 2 years. It is mandatory for students to declare gaps in education if any and should provide valid reasons supported by document proof. How to Register: TCS Management (MBA) Hiring -Log in to the TCS Next Step Portal  -Register and apply for the TCS MBA Hiring Scenario A. If you are a registered user, login and proceed to complete the application form. Upon submission, click on ‘Apply For Drive’ Scenario B. If you are a new user, click on Register Now, choose the category ‘IT’ and proceed to fill in your details. Submit your application form and click on ‘Apply For Drive’ -Select your mode of test as Remote and click on ‘Apply’ -To confirm your status, check ‘Track Your Application’. The status should reflect as ‘Applied for Drive’.  "
