article_time,article_title,article_link,article_content
Updated: 12 May 2022,UltraTech bids for Holcim units as bidders seek more access,https://www.livemint.com/companies/news/ultratech-bids-for-holcim-units-as-bidders-seek-more-access-11652294781879.html,"MUMBAI :   UltraTech Cement Ltd, India’s largest cement maker, has submitted a non-binding bid for Holcim Ltd’s Indian assets Ambuja Cements Ltd and ACC Ltd, two people aware of the development said. Details about UltraTech’s bid could not be immediately ascertained. A spokesperson for Aditya Birla Group, which controls the cement maker, declined to comment.           "
Updated: 10 May 2022,"Sensex, Nifty flat; UltraTech Cement, HUL & Bharti Airtel top gainers",https://www.livemint.com/market/stock-market-news/sensex-nifty-flat-ultratech-cement-hul-bharti-airtel-top-gainers-11652159254971.html,"Asian share markets are lower today tracking another Wall Street rout on fears over rising US interest rates and inflation, with investors eyeing earnings reports. The Nikkei dropped 0.8% while the Hang Seng is down over 3%. The Shanghai Composite is trading up by 0.2%. In US stock markets, Wall Street indices ended sharply lower on Monday, led by declines in mega-cap growth shares as the benchmark 10-year yield hit fresh 3-1/2 year highs and investors grew more concerned about the interest rate outlook. The Dow Jones plunged 2% while the Nasdaq Composite fell a massive 4.3%. Back home, Indian share markets are trading on a flat note. Benchmark indices opened with marginal gains even as markets across the global tumbled.                                                 "
Updated: 03 May 2022,The growing list of Holcim India suitors,https://www.livemint.com/companies/news/dalmia-may-join-race-for-holcim-s-india-biz-11651517115374.html,"MUMBAI : Cement maker Dalmia Bharat Ltd is set to throw its hat in the ring to buy Holcim Ltd’s India businesses, joining a hotly contested race that has garnered interest from conglomerates including Adani, JSW and Aditya Birla groups, two people aware of the development said. Dalmia Bharat, one of India’s oldest cement makers, is talking to banks to stitch together the financing for its bid for the Swiss building materials maker’s two Indian cement companies—ACC Ltd and Gujarat Ambuja Ltd—with a combined manufacturing capacity of almost 65 million tonnes per annum (mtpa), the people said, requesting anonymity. Dalmia’s current capacity is 35 mtpa.               "
Updated: 27 Apr 2022,Holcim Group weighs offers for cement biz,https://www.livemint.com/companies/news/holcim-group-weighs-offers-for-cement-biz-11650998350792.html,"MUMBAI : The board of Swiss cement maker Holcim Group is set to meet next week to decide on the sale of its Indian cement businesses—Ambuja Cements Ltd and ACC Ltd—for which Adani Group, JSW Group and UltraTech Cement are in contention, two people aware of the development said. “The Holcim board is meeting early next week to consider the future course of action for the sale of Ambuja and ACC stakes, having received interest from the Adani Group, JSW and Aditya Birla’s UltraTech Cement. All three are still in contention for the assets, and nothing has been finalized as of yet. The bids for the two assets are expected to be upwards of $10 billion,"" said one of the two people cited above. Holcim owns a 63.19% stake in Ambuja Cements through Holderind Investments Ltd, while Ambuja Cements holds a 50.05% stake in ACC, and Holderind directly owns 4.48%. The companies’ combined market capitalization stood at over ₹1.19 trillion as of Tuesday. A stake sale will trigger an open offer to acquire shares from public investors of the companies. A successful sale by Holcim will also make it one of the biggest deals in India.      "
Updated: 18 Apr 2022,What Holcim's likely exit from India means for cement sector's pricing power,https://www.livemint.com/market/mark-to-market/what-holcim-s-likely-exit-from-india-means-for-cement-sector-s-pricing-power-11650268693591.html,"The cement sector is in the headlines, yet again, but this time, it is not for cost inflation pressure issues. Investors in the sector may need to prepare for the announcement of a landmark deal. Media reports said Switzerland-based building materials conglomerate Holderind Investments Ltd (Holcim) is looking to exit India and is exploring a stake sale in Ambuja Cements Ltd. Holcim holds a 63.19% stake in Ambuja and a 4.48% stake in ACC Ltd. It should be noted that Ambuja also holds a 50.05% stake in ACC. Clearly, if and when such a deal goes through, there would be repercussions not on these stocks but for other companies as well. For ACC and Ambuja a change of ownership could be a re-rating event, note analysts. Investors would reckon that both these companies have been losing market share due to capacity constraints. This is at a time when their close competitors Ultratech Cement Ltd and Shree Cement Ltd were expanding their footprints across regions aggressively.       "
Updated: 13 Apr 2022,HDFC MF's Prashant Jain & team raise stakes in these pharma stocks in March ,https://www.livemint.com/mutual-fund/mf-news/hdfc-mf-s-prashant-jain-team-raise-stakes-in-these-pharma-stocks-in-march-11649841981113.html,"Equity mutual funds attracted an all-time high net inflow of ₹28,463 crore in March on continued interest by investors. This was significantly higher than the net inflow of ₹19,705 crore in February, ₹14,888 crore in January and ₹25,077 crore in December 2021, data from the Association of Mutual Funds in India (AMFI) showed.  HDFC Mutual Fund's large additions were HDFC ( ₹17.16 bn), HDFC Bank ( ₹11.8 bn) and UltraTech Cement ( ₹3.18 bn). It's prominent reductions were ITC, NHPC Ltd and Adani Wilma. Zydus Wellness and Sudarshan Chem were new entrants while L&T Fin Holdings was a complete exit, the fund house's data accumulated by Edelweiss showed.   "
Updated: 23 Mar 2022,Cement price outlook muted for East India,https://www.livemint.com/market/mark-to-market/cement-price-outlook-muted-for-east-india-11648057381490.html,"Cement companies are seen exiting the March quarter (Q4FY22) with flat prices, despite Q4 being seasonally strong. In the following quarter, Q1FY23, cement makers are expected to raise prices amid steep cost inflation, showed dealers channel checks by various brokerages. Higher realizations would help the sector prevent the erosion of operating margins. However, the eastern region is unlikely to see a meaningful increase in prices as it suffers from an acute demand-supply imbalance. Oversupply in this market against the backdrop of inadequate cement demand growth would weigh on prices, at least in the near term. If demand fails to absorb the supply, the region’s utilization can be expected to stay low. Of the total slated capacity additions of 27.5 million tonnes in FY23, 13.1 million tonnes is scheduled in east India alone, according to estimates of JM Financial Institutional Securities Ltd.     "
Updated: 17 Mar 2022,Day trading guide for Thursday: 5 stocks to buy or sell today — 17th March,https://www.livemint.com/market/stock-market-news/day-trading-guide-for-thursday-5-stocks-to-buy-or-sell-today-17th-march-11647477813450.html,
Updated: 04 Mar 2022,Cement stocks under pressure as price hikes offer little solace,https://www.livemint.com/market/mark-to-market/cement-stocks-under-pressure-as-price-hikes-offer-little-solace-11646369777074.html,"There is no light at the end of the tunnel for investors in cement stocks, at least for now. Shares of key cement manufacturers Ultratech Cement Ltd, ACC Ltd, Ambuja Cements Ltd and Shree Cement Ltd have dropped 12-8% in the last five trading sessions. This is despite dealers' channel checks indicating that price hikes have been taken in some regions. On a month-on-month basis, cement prices have risen by 4-5% in southern, western and eastern India, according to Jefferies India Pvt Ltd's report dated 3 March. On the other hand, the northern region saw a month-on-month price decline of 2%. Two crucial factors have not played out as per expectations of the Street. In a double whammy, costs are feared to rise futher and uptick in demand has not been as strong as previously anticipated. It should be noted that cement companies use crude-derived petroleum coke (petcoke) and imported coal as key inputs. Prices of these commodities were already elevated, but the ongoing Russia-Ukraine conflict could add to further upward pressure on supply constraints. ""There has been a substantial increase (up 75%/52%) in South African/Australian coal prices in the last one month (40-50% increase in two weeks),"" domestic brokerage house Motilal Oswal Financial Services Ltd said in a report on 2 March. At present, imported coal prices are significantly higher than their peak in October 2021. For example, the South African coal price stood around $300/tonne versus its peak of $248/tonne. Petcoke prices too have started to rise, added the report. Analysts caution of peak margin pressures for cement companies in the June quarter of FY23. As far as demand growth is concerned, there is no cheer on that front as well. It should be noted that March quarter is seasonally strong for the sector and has historically seen meaningful uptick in construction activities. However, this time around demand so far in the quarter, has remained muted. ""Demand was weak in Feb'22 like Jan'22 - while dealers attribute to increasing costs of construction materials like steel/sand, companies attribute it to a high base,"" said the Jefferies report. Given the unimpresaive demand scenario, analysts at Jefferies see a risk to their estimate of Rs40 per bag increase in cement prices in Q4FY22. Needless to say, for cement companies the risk of earnings downgrades is getting more pronounced. ""Variable costs are expected to remain elevated in H1CY22 and may pose downside risks to our / consensus FY22-24E earnings in the absence of cumulative Rs45-50/bag price increase during H1CY22,"" analysts at ICICI Securities Ltd said in a report on 2 March."
Updated: 02 Mar 2022,Super 15: Stocks benefitting from rising popularity of ESG theme ,https://www.livemint.com/market/mark-to-market/super-15-stock-benefitting-from-rising-popularity-of-esg-theme-11646195130371.html,"In a post-Covid world, conscious investing has gained lot of traction among investors. In fact, in 2021, at a global platform, India made a commitment to reach net carbon zero by 2070. With the environment, social and governance (ESG) theme fast catching-up, analysts at Jefferies India Pvt. Ltd have outlined key considerations for investors and picked stocks from five sectors to bet on this theme. They are as follows: 1) Coal Sector: The fundamental question for India's transition is linked to its coal sector. Ensuring a well-planned and just transition away from coal will be a significant challenge, with both risks and opportunities in the power sector and beyond. With around 8% of state revenue from coal activities, diversification of the economy is needed. Coal India Ltd will be central to the transition. The company has already taken steps to diversify into renewable power, with three gigawatts of planned solar capacity to FY24. Natural gas is also set to play a significant role in displacing coal. GAIL India Ltd operates around 220 mmsmd (million metric standard cubic meter per day) of pipeline capacity and is the largest LNG trader in India. 2) Agriculture accounts for around 20% of India's greenhouse gas emissions and is the main source of non-carbon dioxide related emissions. Opportunities exist for investors through chemical free farming and low-cost solutions which improve irrigation and energy efficiency. UPL Ltd will likely play a central role in decarbonisation efforts. Through various projects, it is driving the adoption of digital solutions and increased penetration of bio-solutions. 3) Road Transport: With auto demand set to grow to 2040, an uptake in electric power-trains is an important area of focus for policy-makers. Tata Motors Ltd leads the local market with nearly 7% market share. Bajaj Auto Ltd, TVS Motor Company Ltd & Hero MotoCorp Ltd are actively expanding their electric vehicles portfolios. 4) Power Utilities: State-run distribution companies will underpin India's energy transition. Their financial fragility however currently inhibits their appetite for investment and transformation of the power grid. NTPC Ltd should be a key beneficiary of new renewable capacity given its access to low cost funding. Power Grid Corporation of India, Larsen & Toubro Ltd, Siemens Ltd and KEI International Ltd could all see tailwinds from increased transmission and distribution spend. 5) Heavy Industry: Heavy industry's share of energy consumption has increased to 42%, making it the largest end user of energy. Incumbents are focused on renewable power with Shree Cement Ltd, The Ramco Cements Ltd and Ultratech Cement Ltd all active in this regard."
Updated: 21 Feb 2022,Outlook darkens for cement companies,https://www.livemint.com/market/earnings-downgrades-for-cement-stocks-rise-11645380971332.html,
Updated: 17 Feb 2022,Why cement stocks are under pressure ahead of Ambuja Cement Q3 results,https://www.livemint.com/market/stock-market-news/why-cement-stocks-are-under-pressure-ahead-of-ambuja-cement-q3-results-11645082954903.html,"Stock market today: Ahead of Ambuja Cement results for Q3FY22, cement stocks are under selloff heat. UltraTech Cement shares are down near 1 per cent, Shree Cement share are down 0.50 per cent, JK Cement share price is quoting 1.50 per cent lower from its yesterday's close, Ramco Cements shares shed around 1 per cent whereas ACC cement shares are down near half a per cent today. According to stock market experts, cement shares are under pressure ahead of Ambuja Cement results as market is expecting weak Q3 numbers from the cement major. They said that market is trying to adjust with the new EPS (earning per share) and P/E ratio of the cement companies comparing with the P/E ratio and EPS of Ambuja Cement in the wake of weak Q3 results. They went on to add that major reason for weak Q3 results from cement major is rising input cost after surge in coal prices.    "
Updated: 10 Feb 2022,"Once a laggard, ACC is now fast catching-up with peers",https://www.livemint.com/market/mark-to-market/once-a-laggard-acc-is-now-fast-catch-up-with-peers-11644480122958.html,"The December quarter earnings of cement maker ACC Ltd were unexciting. Akin to peers Ultratech Cement Ltd and Shree Cement Ltd, ACC's sales volumes fell, while input cost rose. It should be noted that Ambuja Cements Ltd is yet to announce its December quarter earnings. ACC's sales volume was down 3% year-on-year (y-o-y) to 7.49 million tonne. The company follows a January-December accounting year. Ultratech and Shree Cement saw sales volume decline 3% y-o-y and 8.3% y-o-y in Q3FY22. High variable cost continued to hurt, leading to contraction in ACC's operating margin to 13.1% in 4QCY21 from 14.1% in Q3CY21. Hit by a surge in coal prices, power and fuel cost on a per tonne basis rose 27% year-on-year in Q4CY21. In a positive, however, due to its master supply agreement (MSA) with Ambuja, freight cost and raw material costs declined in Q4CY21 compared to Q4CY20. Understandably, ACC shares were muted on Thursday, trading flat on the National Stock Exchange, in reaction to the company's December quarter performance. Nonetheless, the stock’s performance in the last one year has been impressive. ACC shares have risen 31%, outperforming Ultratech’s 17% returns in the same span. Shree Cement stock price has declined 9% in the last one year. In the last five years, ACC shares have given lower returns than Ambuja, Ultratech and Shree. In the the last three years, ACC shares have risen by 66% compared to 110% surge in Ultratech and 80% jump in Ambuja shares. Analysts say the company’s expansion plans are on track and its cost rationalisation measures are yielding results and driving optimism towards the stock.   "
Updated: 07 Feb 2022,Shree Cement is losing its key edge over peers,https://www.livemint.com/market/mark-to-market/shree-cement-is-losing-its-key-edge-over-peers-11644168633437.html,
Updated: 01 Feb 2022,ACC vs UltraTech Cement: Which Cement Stock is Better?,https://www.livemint.com/market/stock-market-news/acc-vs-ultratech-cement-which-cement-stock-is-better-11643713148782.html,"Cement, as a commodity, ranks second in volume among the top industrial products manufactured in the world. So it’s no surprise that India, the second most populated country in the world is also the second-largest manufacturer of cement. According to the Cement Manufacturers Association, India boasts a total installed capacity of 540 m tonnes. The top five players control half the country's production. In today’s article, we compare and contrast two of the top cement players, UltraTech Cement and ACC. The idea is to study their past, to eliminate risks, and profit from their future. Background ACC: ACC is one of the oldest cement companies in India with a rich history. It was bought by the world leader in cement, the Swiss based Holcim group in 2004.                                                                "
Updated: 18 Jan 2022,Diving input costs may ease Ultratech Q3 pain,https://www.livemint.com/market/mark-to-market/diving-input-costs-may-ease-ultratech-q3-pain-11642439337366.html,"December quarter performance remained subdued for Ultratech Cement Ltd, a cement-maker with a pan-India focus. Consolidated sales volume (grey and white cement) in Q3FY22 fell 3% year-on-year (y-o-y) to 23.13 million tonnes. Except in the north, demand in other markets remained muted, impacted by cyclones in the east and south, and reduced cement demand from the infrastructure segment in the central region. Further, elevated input costs meant consolidated operating margin contracted sharply to 20% from 28% in the same period last year. In Q2FY22, margin was at 24%.         "
Updated: 17 Jan 2022,Mcap of BSE-listed companies jumps to all-time high of over ₹280 lakh cr,https://www.livemint.com/market/stock-market-news/mcap-of-bse-listed-companies-jumps-to-all-time-high-of-over-280-lakh-cr-11642428378951.html,"NEW DELHI : Market capitalisation of BSE-listed companies jumped to an all-time high of over ₹280 lakh crore on Monday as benchmark indices bounced back after taking a breather in the previous trade. The 30-share BSE benchmark gained 85.88 points or 0.14% to settle at 61,308.91. During the day, it jumped 162.45 points to 61,385.48. The market capitalisation of BSE-listed firms reached a lifetime high of ₹2,80,02,437.71 crore on Monday. Sensex and Nifty broke their five-day rising streak to close with slim losses on Friday. ""Markets started the week on a flat note amid mixed global cues. As the day progressed, high volatility was witnessed but the benchmark traded in a positive range for most of the session,"" said Ajit Mishra, VP - Research, Religare Broking Ltd. In the broader market, BSE midcap index rose by 0.23% while smallcap index gained 0.61%. "
Updated: 17 Jan 2022,"UltraTech Cement Q3 results: Net profit beats estimates, rises 8% to ₹1,708 cr",https://www.livemint.com/companies/company-results/ultratech-cement-q3-results-net-profit-beats-estimates-rises-8-to-rs-1-708-cr-11642409256355.html,
